Date,Activity Type,Content,Upvotes
2023-10-06 18:48:29,Comment,"Traditional TA doesn't follow a token with just over $3 mln. market cap. 

To be honest traditional TA often cannot even explain BTC movements with over $500 bln. market cap...",3
2023-10-06 06:32:55,Comment,"That depends on where you live. In the UK I receive around 20 BAT a month. It's not much but it's totally passive income.

Also, those ads are mostly crypto-related and interesting",3
2023-10-06 06:19:20,Comment,Must be at least 69,1
2023-10-06 06:16:49,Comment,$50 DCA keeps Gensler away! :-P,3
2023-10-06 06:07:02,Comment,BAT rewards are paid for using the Brave browser. Donuts are reward (and governance) tokens on https://www.reddit.com/r/ethtrader/,1
2023-10-06 06:03:15,Comment,!donut,3
2023-10-06 06:00:30,Comment,When life gives you Crabs make crab flavored Ramen,1
2023-10-06 05:58:11,Comment,"Many members were complaining that their posts were removed due to ""duplicate posts""",3
2023-10-06 05:56:38,Comment,Plus BAT rewards and Donut distro is soon too,5
2023-10-06 05:37:05,Comment,You mean XMR Monero,1
2023-10-06 05:12:31,Comment,These days ETH gas fees are very low no matter what day you make a tx,4
2023-10-06 04:33:06,Comment,Slow but steady wins the race :-),2
2023-10-06 04:28:08,Comment,Kraken listing is still on the table,3
2023-10-06 04:27:14,Comment,Injective is doing pretty good if you ask me,2
2023-10-06 04:17:52,Comment,"The largest ""buy"" transaction on Donuts was completed on Sep 22 on Uniswap.

A whale bought 707.85K Donuts for $14.28K. The price of a $Donut was $0.02018  
  
He is still holding 769k Donuts despite the loss",8
2023-10-06 02:13:22,Comment,So quiet here today. I guess the drop in Donut's price demotivated many users from farming Daily,5
2023-10-06 02:10:14,Comment,Not every new crypto project aims to be a store of value like BTC,1
2023-10-06 02:08:00,Comment,Who needs a house when you can buy a van and live a Degens life?,1
2023-10-06 02:06:42,Comment,Cause there's not much left to rob :-P,1
2023-10-06 01:27:23,Comment,RWA real world assets,1
2023-10-06 00:59:44,Comment,Lots of them are locked into LP,2
2023-10-06 00:57:06,Comment,"Not started yet. You can check the progress in Gnosis Safe

https://app.safe.global/home?safe=gno:0x682b5664c2b9a6a93749f2159f95c23fed654f0a",3
2023-10-06 00:44:05,Comment,https://donut-dashboard.com/#/register,1
2023-10-06 00:00:59,Comment,">more rewarding compared to investing in the other two RCPs right?

It always has been",2
2023-10-05 23:56:59,Comment,I'm just one stubborn mutha :-P,2
2023-10-05 23:29:49,Comment,"I'm multitasking. I work, drink coffee, scratch my ass and farm at the same time",1
2023-10-05 23:26:17,Comment,Then stop looking at charts or you will ruin us all!,3
2023-10-05 23:01:00,Comment,"$730,000,000 worth of Bitcoin & Ethereum options will expire on Friday.

What's your take on that?",4
2023-10-05 22:58:24,Comment,"200,000 ETH options are expiring this Friday",4
2023-10-05 22:47:27,Comment,Formula 1 Qatar grand prix,3
2023-10-05 22:14:25,Comment,$69k or I'll riot!,1
2023-10-05 21:42:41,Comment,!mykarma,2
2023-10-05 21:40:21,Comment,!userstats,2
2023-10-05 21:39:52,Comment,"Everything's down right now. On the bright side, it doesn't take a lot to pump the Donuts up",3
2023-10-05 21:36:10,Comment,My wallet is connected. It's been connected for more than one year now :-),2
2023-10-05 21:23:16,Comment,It's nothing compared to my ex gf,2
2023-10-05 21:18:13,Comment,Sunday late night  has the lowest tx fees,2
2023-10-05 21:16:21,Comment,I see that you don't have a connected wallet yet.,2
2023-10-05 20:04:26,Comment,"First, let me take my profits during the next Bull...",2
2023-10-05 18:43:57,Comment,I used Orbiter bridge twice today with no problems. I'm fighting the FUD with my own wallet :-),3
2023-10-05 18:23:33,Comment,"Increased unemployment rates, lower retail sales and manufacturing activity are good indicators",2
2023-10-05 18:11:36,Comment,"Crabs and Bears, you can try but you won't wear me out! :-)",4
2023-10-05 18:06:15,Comment,"I didn't quit, and bought, when BTC was at $16k why would I quit now? :-)",2
2023-10-05 06:53:03,Comment,WSB dabble in Stonks not in Crypto,2
2023-10-05 06:40:04,Comment,Not taking enough profits,1
2023-10-05 06:28:41,Comment,I wouldn't pass up an opportunity to take investment advice from a broke man! ;-),1
2023-10-05 06:18:43,Comment,Who told you that donuts aren't healthy? Probably those avocado-munching crooks :-P,2
2023-10-05 06:11:11,Comment,"Are we going to have a Pumpy Thursday?

What do you think?",5
2023-10-05 06:08:05,Comment,"Everything's in the norm *until* I check it.

Just like my portfolio is all green until I look at it :-)",3
2023-10-05 06:06:32,Comment,Such a FUD!,2
2023-10-05 05:52:57,Comment,"I'm gonna follow an experimental diet today 🍩for breakfast 🍩 for lunch and 🍩 for diner

What can go wrong?",4
2023-10-05 05:49:59,Comment,I accumulated enough. Now I want to see some profits,2
2023-10-05 05:43:46,Comment,Don't frown upon a 10% gain when dreaming about your future Lambos :-),2
2023-10-05 05:25:17,Comment,I ain't afraid of no ~~ghosts~~ crabs,1
2023-10-05 05:22:40,Comment,AAVE is having a decent pump this morning,2
2023-10-05 03:33:36,Comment,">epic moonshot one day

That's the most accurate MOON price prediction so far :-P",1
2023-10-05 03:32:30,Comment,I would choose Lido because they offer 3.6% APR,3
2023-10-05 03:28:43,Comment,That would be an alley behind Wendy's :-),2
2023-10-05 02:54:50,Comment,Way ahead of you. Posting while sitting on my porcelain throne,1
2023-10-05 02:53:52,Comment,It's a bonus for good behavior on Daily,2
2023-10-05 02:52:28,Comment,How to make homemade donuts?,2
2023-10-05 02:17:03,Comment,"Basically, all you need to do is transfer some funds to a blockchain that you're about to farm and then do regular transactions on it: swapping, liquidity providing, yield farming, NFT minting etc.",3
2023-10-05 02:14:39,Comment,That would be my private wallet address :-P,4
2023-10-05 00:35:01,Comment,"350 comments on a Daily so far.

*Not great but not terrible*",5
2023-10-04 23:42:27,Comment,![img](emote|t5_37jgj|32651)![img](emote|t5_37jgj|32641),2
2023-10-04 22:37:28,Comment,That's great. I'll check it out,2
2023-10-04 22:33:41,Comment,Once we reach 69 it doesn't go up from there :-P,3
2023-10-04 22:32:16,Comment,I'm getting zkSwap ads right now. They must know about my airdrop-hunting addiction by now :-),1
2023-10-04 22:30:40,Comment,Hopium is the cheapest drug on the market!,5
2023-10-04 21:32:25,Comment,"I received more than I expected. So yes, I'm happy",2
2023-10-04 21:00:37,Comment,US judge denied SEC's attempt to appeal Ripple ruling ! That's a great news,5
2023-10-04 20:55:50,Comment,I'm a proud squid 🦑 now!,2
2023-10-04 20:54:42,Comment,Moon farming is a non-stop commitment. Only the toughest farmers will make it :-),3
2023-10-04 20:53:19,Comment,I went to an underground dnb rave. It's much more interesting than a regular clubbing,2
2023-10-04 20:38:36,Comment,Same here. I'm happy as a pig in the mud! :-),2
2023-10-04 20:34:49,Comment,I'd Liquid stake them and used stETH for yield farming,1
2023-10-04 20:28:01,Comment,Here you can monitor the state of the Donut distro: https://app.safe.global/home?safe=gno:0x682b5664c2b9a6a93749f2159f95c23fed654f0a,1
2023-10-04 20:21:57,Comment,My biggest regret was not selling SOL on time. But its time will come and this time I'll divorce my bag :-),2
2023-10-04 18:50:24,Comment,"The main goal in Crypto is to win more than you lose  
  
Hold *winners* longer instead of adding to the *losers*",2
2023-10-04 18:44:31,Comment,I'll celebrate it with a monster workout!,1
2023-10-04 04:23:47,Comment,Moon distro day today! A ray of light in those crabbish times,4
2023-10-04 02:55:27,Comment,"I think it's because he always tries to belittle other blockchains, especially Ethereum, instead of trying to *positively* elevate his own project",1
2023-10-04 02:42:28,Comment,Liquidity is still very high on Donuts. Almost 10% of its total market cap,3
2023-10-04 02:14:33,Comment,What would you do if  Jim Cramer picked your largest crypto bag as a “buy” ?,1
2023-10-04 02:08:49,Comment,A small portion and already diluted by Crab :-P,1
2023-10-04 02:07:28,Comment,What's wrong with today?,1
2023-10-04 02:05:25,Comment,That's a good stuff. Not the purest but good enough,1
2023-10-04 01:51:42,Comment,It's gonna vomit my gains back :-),1
2023-10-04 01:44:55,Comment,"Damn, I ran out of Hopium again. Any Hopium pushers around here? It can even be cut with Copium.",3
2023-10-04 01:33:48,Comment,You mean **Pablo Eskobear?**,2
2023-10-04 01:32:27,Comment,"OK then 1000,001 Donuts for you",2
2023-10-04 01:15:59,Comment,"1000,000 Donuts 🍩 and I call it a day",1
2023-10-04 01:15:22,Comment,I swear I'm gonna punch that Bear in the belly!,2
2023-10-04 01:13:54,Comment,>just for talking about ~~Crypto~~ Moons :-),1
2023-10-04 01:12:09,Comment,The Winter is coming.,1
2023-10-04 01:11:52,Comment,Here's the box. You have 15 mins to pack,1
2023-10-04 01:10:47,Comment,">is call getting a job

you mean wage slavery? :-)",1
2023-10-04 01:09:10,Comment,And in the end there was PEPE :-P,1
2023-10-03 22:45:09,Comment,"The one about donuts? OK, I won't",2
2023-10-03 22:40:42,Comment,Me stopping my $10 weekly DCA,2
2023-10-03 22:38:41,Comment,I would give a punch in the face,3
2023-10-03 21:57:02,Comment,Between r/cc and ETHtrader I would have no time for other subs,2
2023-10-03 21:55:33,Comment,ARB and SOL,3
2023-10-03 21:50:59,Comment,Of course you can,1
2023-10-03 21:25:52,Comment,3.61% annual return with Lido. 0.3% a month from 1 ETH that is around $5,2
2023-10-03 21:05:37,Comment,🤧,2
2023-10-03 20:59:36,Comment,"If you're feeling blue today due to this minor dip, picture yourself SBF for up to 115 years behind bars",4
2023-10-03 20:49:24,Comment,"Crypto is an investment with almost unlimited potential gains but also great potential losses.

I like taking calculated risks and don't mind volatility so this market is for me.",1
2023-10-03 20:36:53,Comment,"Do your research, make an investment, and stick to it until it's time to take your profits. Don't become an exit liquidity for market manipulators",4
2023-10-03 19:37:16,Comment,Buy in the Bear market and the Fortune will spread her legs wide open for you when we reach the Bullrun,2
2023-10-03 19:33:12,Comment,Can't get the dips if you don't give them tips,2
2023-10-03 18:28:32,Comment,Arbitrage bots are operating on Uniswap's Donut/ETH pair,3
2023-10-03 18:25:21,Comment,DOT is like that talented child who never amounted to anything in adult life.,2
2023-10-03 18:17:46,Comment,"I learned something new today.  
  
Now I'm experienced enough to do x50 leverage :-P",1
2023-10-03 18:12:53,Comment,"*“Since Bankman-Fried and Ellison are both from educated, higher-income childhood homes, one might consider that the wilful actions leading to the downfall of FTX and Alameda were likely less about financial need than the addictively powerful chance to opportunistically beat the system.”*

*https://beincrypto.com/bizarre-fairy-tale-story-sam-bankman-fried-caroline-ellison/*",2
2023-10-03 18:07:24,Comment,I like the concept of BAT tokens integrated with Brave Browser,4
2023-10-03 17:58:01,Comment,"Once you've got enough you always want some more. Greed and fear rule the market, my fren",2
2023-10-03 17:48:27,Comment,"Some whales are dumping Donuts on Uniswap

[https://www.geckoterminal.com/eth/pools/0x718dd8b743ea19d71bdb4cb48bb984b73a65ce06](https://www.geckoterminal.com/eth/pools/0x718dd8b743ea19d71bdb4cb48bb984b73a65ce06)",1
2023-10-03 17:32:23,Comment,"Technically, when Bitcoin pumps Donuts go down and vice versa",2
2023-10-03 17:12:45,Comment,If Donut doesn't show up on your Uniswap swap list copypaste a Donut contract address into Uniswap https://www.coingecko.com/en/coins/donut,1
2023-10-03 17:00:40,Comment,This one is not much of a discount,3
2023-10-03 15:56:25,Comment,"Overall, for the last 7 days, ETH is still 4% on plus",2
2023-10-02 23:59:47,Comment,"With growing metrics like trade volume, liquidity, and number of active wallets our chances for🍩CEX listing ![img](emote|t5_37jgj|32639) will grow exponentially.",3
2023-10-02 23:40:29,Comment,They are deep-fried in hot fat to be exact 🍩🍩🍩,2
2023-10-02 22:42:44,Comment,"Take a look at the new whale on ETH Trader  
  
u/suikonami bought 1,000,000 Donuts",3
2023-10-02 22:38:34,Comment,"They haven't released it, unfortunately",1
2023-10-02 22:04:53,Comment,It's the cheapest on Sunday late night,2
2023-10-02 21:50:51,Comment,https://etherscan.io/gastracker,2
2023-10-02 21:45:55,Comment,"I'm not an NFT guy but I would be very tempted to buy some if The Witcher (the game) released a limited digital collection.

How about you?",3
2023-10-02 19:47:39,Comment,Honda now accepts Ethereum as payment method,1
2023-10-02 19:34:43,Comment,"I don't know, dude. Some lady offered him her foot pics for it",2
2023-10-02 19:25:21,Comment,"The ""funny"" thing is that first he asked for donations and later on he revealed that he had more assets to sell",2
2023-10-02 19:04:33,Comment,"Bitboy Crypto is selling his Bored Ape NFT

""I’m selling my Bored Ape (...) I paid 56 ETH for it""

Any buyers? :-P

https://twitter.com/BenArmstrongsX/status/1708502384182210579",3
2023-10-02 18:11:48,Comment,"Why would I FOMO when I've bought what I needed on the cheap already?

Right now I just sit and wait to take my profits.",2
2023-10-02 17:56:51,Comment,What's important here is that they are free for the nominated person,2
2023-10-02 16:43:19,Comment,"They are no burning a hole in my pocket.

I'll let them lie in the vault and grow in value",2
2023-10-02 16:25:37,Comment,People just have to stop panicking whenever BTC makes  -/+ 1% move,8
2023-10-02 16:15:43,Comment,Decentralized blockchain relying on centralized solutions is not the right way,2
2023-10-02 15:47:15,Comment,"Now you can trade Forex on VELA DEX on Arbitrum.

With up to x250 leverage!

Maximum Degen zone :-)",2
2023-10-02 15:05:04,Comment,Royale with Cheese,2
2023-10-02 14:41:42,Comment,You can earn Donuts on ETHtrader subreddit,1
2023-10-02 14:40:15,Comment,I honestly cannot give you even one name that I would recommend. Most of them are shillers anyway,1
2023-10-02 14:38:45,Comment,They're going to be sitting there in my wallet waiting for the CEX listing,3
2023-10-02 14:25:50,Comment,Are you calling -1% on ETH and -0.5% on BTC in the last hour a dump?,4
2023-10-02 05:07:09,Comment,and don't forget donuts,2
2023-10-02 04:53:48,Comment,"In the long run there is a strong change it will get listed on Binance. 
Right now we need to focus on listing on smaller CEXs and increase Donut trade volume and liquidity.",5
2023-10-02 04:48:50,Comment,It's a Bear trap,1
2023-10-02 04:47:23,Comment,The Bull are the Crab,1
2023-10-02 04:25:51,Comment,Right now I'm only in loose partnership with my coins,1
2023-10-02 04:12:28,Comment,Uptober did its magic,1
2023-10-02 03:26:16,Comment,"Are you feeling it now, Mr. Krabs?",1
2023-10-02 03:25:22,Comment,ETH wiped $70 million in shorts today. That's what you get for being bearish on Uptober,6
2023-10-02 02:46:21,Comment,Shorts and sell walls can't much the power of Uptober,3
2023-10-02 02:45:01,Comment,10k or I'll riot :-P,3
2023-10-02 02:18:06,Comment,">SBF trial

Burn the witch!",2
2023-10-02 02:16:51,Comment,I think I'm more bullish on crypto gambling,3
2023-10-02 01:51:26,Comment,Coffee makes me more productive. I can stare at candlestick charts much longer,2
2023-10-02 01:16:27,Comment,"Some whale added 157,769 MOON and 26 ETH liquidity on SushiSwap today",8
2023-10-01 22:49:58,Comment,Uptober never fails to deliver!,3
2023-10-01 22:48:58,Comment,It's an Uptober pamp!,1
2023-10-01 21:38:09,Comment,Is downvoting army back on daily?,1
2023-10-01 21:03:08,Comment,"If people are waiting to buy at the top, let them do so",3
2023-10-01 21:01:07,Comment,I think they are hogging BTC off-the-counter to not increase the overall price,2
2023-10-01 20:56:57,Comment,"I'd rather look for fresh altcoins with a relatively small market cap and current market narrative.  
  
The ETH killer narrative is old and didn't work for any of them during the last bullrun. So much less for the upcoming bullrun loaded with L2 scaling solutions for Ethereum",1
2023-10-01 20:38:49,Comment,There are literally dozens of altcoins that are better investments than ADA for the upcoming bullrun,1
2023-10-01 20:35:03,Comment,I stopped counting,3
2023-10-01 19:20:23,Comment,LISA is a full-fledged shitcoin,1
2023-10-01 19:04:41,Comment,I lost interest in *Lovelace*,2
2023-10-01 19:04:09,Comment,GMX,1
2023-10-01 19:03:42,Comment,Don't marry your bags,2
2023-10-01 19:03:03,Comment,Michael Saylor,3
2023-10-01 19:02:03,Comment,Blockchain petrol,2
2023-10-01 18:44:41,Comment,SOL may be one of the altcoin season big surprises,1
2023-10-01 18:16:34,Comment,I never had such a crazy idea,2
2023-10-01 18:16:02,Comment,Of course. I will post tips on how to degen your way to riches.,1
2023-10-01 18:02:41,Comment,Book your Lambo now before the line is too long ;-),1
