Date,Activity Type,Content,Upvotes
2023-10-27 11:48:04,Post,I'm in the space,2
2023-10-26 19:30:54,Post,For art CONEoisseurs,6
2023-10-26 11:03:35,Post,Muay Thai Fight Tips,2
2023-10-25 13:13:12,Post,Have a cow,12
2023-10-25 12:20:13,Post,'I won't make any money with traditional investing': Millennials turn to alternative investments amid economic woes,121
2023-10-24 18:59:04,Post,Capoeira vs Muay Thai,1
2023-10-24 18:57:23,Post,At-home bodyweight workouts,1
2023-10-24 12:33:31,Post,Name this Cone,11
2023-10-23 12:46:02,Post,Thai tattoo symbols and meanings,2
2023-10-23 11:56:29,Post,Bitcoin equals human freedom: BlackRock CEO says,39
2023-10-23 11:46:38,Post,An artsy Cone,13
2023-10-22 22:46:43,Post,Tether Aims To Publish Reserves Data in Real Time by Next Year,22
2023-10-21 16:00:02,Post,"Ethereum ICO Participant Wakes Up After 8 Years, Moves $3 Million In ETH",99
2023-10-21 12:12:37,Post,Post-workout recovery tips,0
2023-10-19 21:55:58,Post,ConArt,8
2023-10-19 09:27:42,Post,Why Monero matters: the key to privacy in digital currency,44
2023-10-18 15:42:03,Post,Coneman,6
2023-10-16 15:09:10,Post,At-home bodyweight workouts,2
2023-10-15 11:57:47,Post,Countdown starts now? BTC crosses key bullish indicator for second time in history,7
2023-10-15 11:48:34,Post,Khmer tattoo symbols and meanings,0
2023-10-14 15:17:33,Post,Naughty cone,8
2023-10-14 14:46:30,Post,Bodyweight workout routine,2
2023-10-13 17:50:02,Post,A recent announcement from the Chinese Communist Party suggests China may be opening up to crypto assets,74
2023-10-12 15:26:28,Post,Muay Thai for Self-defense,0
2023-10-11 13:23:52,Post,Luxury hotels around the world that are now embracing cryptocurrency,44
2023-10-11 08:19:58,Post,Name this Cone,11
2023-10-10 10:10:36,Post,At-home bodyweight workouts,2
2023-10-07 17:08:13,Post,BitMex Co-founder Predicts Largest Bull Market in History for Cryptocurrencies,4
2023-10-03 16:56:37,Post,Advanced Muay Thai moves,1
2023-10-01 18:21:22,Post,Former FTX engineer speaks out about Sam Bankman-Fried's sex orgies and role-playing sessions at their luxury Bahamas penthouse,21
2023-09-30 18:03:13,Post,"nChain CEO resigns, claims Craig Wright is not Satoshi",20
2023-10-27 17:28:47,Comment,!myactivity,1
2023-10-27 11:53:32,Comment,I didn't. Did he leave ETH trader?,2
2023-10-27 11:47:11,Comment,What's the FUD of the day?,2
2023-10-26 22:35:19,Comment,"Since 12k BTC won't happen again, I'll go with 12k ETH",2
2023-10-26 20:14:44,Comment,![img](avatar_exp|144381624|holo_card),3
2023-10-26 11:07:37,Comment,I love the smell of burning Shorts in the morning 🔥Smells like victory!,3
2023-10-25 23:58:35,Comment,Reddit doesn't love us? 🥹 Gib us .csv,2
2023-10-25 20:10:03,Comment,If you've been rugged by **BlockFi** now you can submit a withdrawal request to get your money back,2
2023-10-25 15:51:39,Comment,"We're pumping. Are you feeling it now, Mr Krabs?",4
2023-10-25 14:58:10,Comment,I was born bullish,2
2023-10-25 13:46:21,Comment,👀 waiting for another bearish prediction coming from the mouth of Jim Cramer 👀,5
2023-10-25 11:32:01,Comment,Another green day and the market sentiment is turning positive,4
2023-10-25 11:28:58,Comment,"That's good, the market sentiment is more important than many other indicators, including often erratic TA",1
2023-10-25 11:26:53,Comment,"SEC is playing games trying to delay and destabilize the market.

The longer they will delay it, the stronger the rebound is going to be after the approval",2
2023-10-24 20:57:22,Comment,"OK, I'll keep that in mind.  
  
btw. the Daily is removed",2
2023-10-24 20:37:43,Comment,To be honest Bitcoin news is usually relevant to ETH and other coins due to BTC's dominance and influence over the crypto market.,1
2023-10-24 19:29:10,Comment,Fresh news: *CFTC Commissioner Says Market is Ready For Spot Bitcoin ETFs*,1
2023-10-24 18:31:58,Comment,It's very transparent. I don't get why people are still getting fooled by that,1
2023-10-24 18:00:24,Comment,There's a drama. I don't know what color for my future Lambo to choose :-P,1
2023-10-24 17:27:48,Comment,FUD on Reddit has no influence over how the real market works,3
2023-10-24 17:25:52,Comment,They are trying to shake off normies :-),2
2023-10-24 12:59:57,Comment,El Capo has finally admitted that he was wrong with his bearish BTC scenario and that he took losses on his shorts,1
2023-10-23 20:51:01,Comment,I wouldn't like to be a Bear right now cause they are getting pegged,2
2023-10-23 20:24:57,Comment,We're so back,2
2023-10-23 18:00:12,Comment,Once Bitcoin breaks that magical $31.4k resistance the miracles will happen,2
2023-10-23 17:57:34,Comment,Try HoneySwap,3
2023-10-23 17:31:48,Comment,The similarities are due to r/cc users migrating to ETH trader :-),2
2023-10-23 17:15:50,Comment,"\#""Bitcoin dominance holds"" and ""BTC shorters were recently recked"" those are facts. The rest is just a speculation",2
2023-10-23 17:10:41,Comment,"Projects #2, #3, #7, #8, #9 (ongoing) #11 #12 with possible airdrops",1
2023-10-23 17:04:40,Comment,Most importantly: wen Lambo? :-P,2
2023-10-23 17:03:32,Comment,Kraken ![img](emote|t5_37jgj|32639) was hit by the moon and now it needs some time to recover,3
2023-10-23 16:43:29,Comment,Which of you sold your heavy bags so we can have this nice pump today? :-P,3
2023-10-23 11:50:08,Comment,I would load up on MASQ and wait for their Web3 browser release,1
2023-10-23 11:48:42,Comment,Don't forget to connect your MM wallet to receive Donut rewards,1
2023-10-23 11:26:35,Comment,Are you downvoting? :-P,3
2023-10-23 11:25:59,Comment,TheOneWhoCares,2
2023-10-23 11:17:02,Comment,So you preached but didn't follow?,1
2023-10-23 11:08:09,Comment,Use those skills to your advantage when you can because it won't last forever,1
2023-10-23 11:05:51,Comment,"4: buying heavily discounted quality alts in the bear season, swing trade them during the bullrun",2
2023-10-23 11:00:13,Comment,So the altcoins I've been *shilling* for months like AAVE and INJ are among those that went up the most recently. From now on you can call me Inverse Cramer :-P,1
2023-10-23 10:44:35,Comment,I'm following multiple crypto projects. MOOND because it seems to be important for crypto Reddit,2
2023-10-23 10:36:53,Comment,And since the value of r/cc MOON slightly decreased again I'm guessing some users swapped their MOON for MOOND,2
2023-10-23 10:33:53,Comment,So MOOND went up by almost 100% in the last 24 hrs,7
2023-10-22 22:44:34,Comment,Are you keeping your MOOND or selling it/swapping it for Donuts?,3
2023-10-22 17:54:12,Comment,What if I told you that MOOND is the next Bitcoin ;-D,5
2023-10-22 16:31:12,Comment,Damn inverse prodigy,1
2023-10-22 16:22:43,Comment,I knew we'd have a pump once I read that Jim Cramer is bearish on Bitcoin,4
2023-10-22 12:28:26,Comment,Set up a free VPN like Proton. It's a 5 minute job,3
2023-10-22 12:24:53,Comment,What about easy earned money? :-P,2
2023-10-22 12:20:15,Comment,We cannot tip posts anymore? Is it a glitch or a new policy?,3
2023-10-22 12:17:05,Comment,"OK then, but if I'm not a millionaire on Jan 1st, 2025 I'll riot!",2
2023-10-22 12:15:48,Comment,After what happened on Reddit recently you cannot blame them,1
2023-10-22 12:06:15,Comment,Are we millionaires yet? :-),6
2023-10-22 09:49:16,Comment,he paid $0.31 for 1 ETH,2
2023-10-21 18:48:16,Comment,So far it has produced profits for me but have it your way,1
2023-10-21 17:57:39,Comment,Do you know any blockchain game that doesn't look dated? :-),1
2023-10-21 17:55:18,Comment,It's a free game,1
2023-10-21 17:34:17,Comment,"Epic Store launched a blockchain game ""Brawlers"" 

https://store.epicgames.com/en-US/p/brawlers-84957e

Edit: the game is free to play",3
2023-10-21 16:33:52,Comment,Just another week in crypto,0
2023-10-21 16:33:16,Comment,"ARB pump my beautiful, pump ![gif](emote|free_emotes_pack|upvote)",2
2023-10-21 14:11:43,Comment,"No, tomorrow is pumping others' bags and providing exit liquidity",2
2023-10-21 13:58:59,Comment,"INJ, AAVE, SOL",1
2023-10-21 13:57:37,Comment,"I'll cash out much sooner, my fren :-)

I'm not holding bags into the next bear market",2
2023-10-21 12:20:04,Comment,"*When is the better time to accumulate*

The best time to accumulate was yesterday. The next best moment to accumulate is today",10
2023-10-21 12:08:43,Comment,"$0.036

That's the only marketplace for Moond

https://www.finexbox.com/Home/Orders/market/pair/MOOND-BTC.html",2
2023-10-21 12:01:31,Comment,"inverse Reddit is the best investment strategy, right after inverse Cramer.",4
2023-10-21 11:41:58,Comment,"Those who risked their money in the early days are now reaping the fruits of their investment. That's how it should be.

Invest now and you may become one of them in the future.",1
2023-10-21 11:31:52,Comment,"For those who claimed it, how much did you get from Moonsdust airdrop?",7
2023-10-21 10:48:15,Comment,What's the FUD of the day?,7
2023-10-20 20:48:04,Comment,Two whales 🐋 just bought 190k Donuts 🍩 each,3
2023-10-20 17:40:59,Comment,"Info: A guy made $41.8 million in profits from trading ETH.  
  
*Me checking the comments and thinking:*  
  
*What a fool...If he* ***only listened*** *to wise Reddit advisors he would be a billionaire by now just like all of them ;-)*",1
2023-10-20 17:37:11,Comment,"Yeah, imagine making $48 mln. in profits from your investment. What a fool ;-)",1
2023-10-20 17:09:19,Comment,"Guild.xyz is optional. What's important is the number of smart contracts you interacted with, the frequency of interactions, and the amount of crypto you are bridging/swapping/supplying into LPs

On blockchain, everything is recorded and they don't need any 3rd party to validate your contribution.

You can participate with any amount, but the higher the tx amount the more chances for a substantial \[possible\] airdrop.",3
2023-10-20 16:57:21,Comment,So in the end he made x3.5 profit on his investment,10
2023-10-20 16:13:01,Comment,On /r/CryptoCurrencyMeta/ there is a list of those who sold (before and after the announcement) and those who didn't sell their Moons,2
2023-10-20 14:57:24,Comment,take profits gradually. DCA out,2
2023-10-20 14:56:33,Comment,I've been good at playing it so far,3
2023-10-20 13:14:13,Comment,"zkSync ERA, Arbitrum and Mainnet",2
2023-10-20 13:10:55,Comment,It depends on whether Reddit handles the keys to r/cc admins,2
2023-10-20 12:52:47,Comment,So it is! Thanks for the info,2
2023-10-20 12:29:20,Comment,Were the keys handled to r/cc admins or not? Any info on that?,3
2023-10-20 12:27:52,Comment, Once it does those who were sh\*\*ing on SOL will most likely FOMO in,1
2023-10-20 12:07:46,Comment,"And I'm watching it *loudly*. 

I see no reason why I shouldn't participate in r/cc and discuss Bitcoin and other coins that are not relevant to ETH trader",2
2023-10-20 12:03:39,Comment,"*The value has to come from somewhere*

The value will come from those who panic sold and will FOMO buy once the market starts pumping",97
2023-10-20 11:44:26,Comment,I wonder if *il Capo* is still waiting for $12k? :-P,1
2023-10-20 11:33:40,Comment,Most testnets are a waste of time. The only one I care about right now is Venom testnet.,2
2023-10-20 11:24:23,Comment,Are we talking about testnet or a mainnet? Cause I knew that testnet is not going to be incentivized since September,2
2023-10-20 10:41:51,Comment,The ETF pump is going to be much larger. This is just a starter,2
2023-10-20 10:38:30,Comment,Bitcoin is almost touching $30k again,2
2023-10-20 10:11:18,Comment,"Welcome back, mate",2
2023-10-20 10:08:35,Comment,"ETH, INJ, AAVE, SOL",1
2023-10-20 09:52:47,Comment,That's the kind of news I'd like to wake up to,1
2023-10-20 09:45:38,Comment,"Finally, I see some green in my portfolio! ![gif](emote|free_emotes_pack|upvote)",6
2023-10-19 21:22:22,Comment,All Layer-2s and basically all Ethereum tokens,1
2023-10-19 17:47:46,Comment,I heard a word that Binance will list it once we cross 69 upvotes on the daily,2
2023-10-19 17:25:39,Comment,"btw, Cecil, when have you decided to become our local fudder?  :-)",1
2023-10-19 17:13:15,Comment,Some of them won't touch crypto ever again,2
2023-10-19 17:08:45,Comment,The volume is normal now. It was blown out of proportion yesterday. We had a trade volume of $350k on a $1.7 million asset,2
2023-10-19 17:06:05,Comment,I'd like to see some hot ladies but that's not gonna happen,3
2023-10-19 17:05:22,Comment,So better make your gains now when it's still unregulated and full of opportunities to either get rich or wrecked,2
2023-10-19 17:00:15,Comment,They were always on the blockchain,1
2023-10-19 16:57:32,Comment,"That's nothing new. I saw some of them stealing my jokes or pasting here what I wrote on the ETH trader

Those slugs :-P",1
2023-10-19 16:51:12,Comment,"It's not a tool's fault, it's the user that can't handle it",4
2023-10-19 16:48:37,Comment,*Stay awhile and listen*,1
2023-10-19 15:32:46,Comment,Almost all altcoins are down against Bitcoin,8
2023-10-19 14:49:29,Comment,![img](emote|t5_37jgj|32640),1
2023-10-19 14:38:18,Comment,So I made it. #82 :-P,1
2023-10-19 14:35:04,Comment,"Gnosis ecosystem

https://gnosischain.world/",1
2023-10-19 13:53:32,Comment,Injective is on a bullish trajectory,5
2023-10-19 13:48:58,Comment,Higher gas fees combined with burning mechanism are making an ETH a deflationary asset,1
2023-10-19 13:35:34,Comment,"That depends on how many upvotes you get. 

It's worth noting that the karma ratio will be low this month since there are so many active refugees from r/cc on a Daily",3
2023-10-19 11:06:21,Comment,Don't start a tribal war here,1
2023-10-19 10:54:10,Comment,"Doctor, I have this craving for donuts. Could you prescribe me something to deal with it?",1
2023-10-19 10:51:15,Comment,I am. I'm interested in how the situation develops and how will they deal with it.,2
2023-10-19 10:26:40,Comment,How will my Asian GFs contact me if I disable DMs? :-P,1
2023-10-19 10:24:58,Comment,![img](emote|t5_37jgj|32639) doesn't love us anymore :-P,1
2023-10-19 10:14:10,Comment,It's doing well as long as I don't look into it,1
2023-10-19 09:58:39,Comment,"So you better register now to be eligible for the future distros

https://www.reddit.com/r/ethtrader/comments/kl6ldu/donuts\_faq/",1
2023-10-19 09:38:41,Comment,Nothing changes regarding the distro on the ETH trader,2
2023-10-19 09:23:43,Comment,"First, let the dust settle before we push it further ![img](emote|t5_37jgj|32639) :-P",2
2023-10-19 09:21:47,Comment,"Damn, r/cc daily looks like a setting for some post-apocalyptic movie",8
2023-10-19 09:19:24,Comment,No recent admin announcements?,1
2023-10-19 09:15:45,Comment,"Yes, but there's a low liquidity warning",2
2023-10-19 09:10:32,Comment,So what's the current situation regarding r/cc and the Moons?,1
2023-10-19 09:02:43,Comment,"My target is clear: the more, the better",3
2023-10-19 08:59:30,Comment,You can check your governance score here: https://donut-dashboard.com/#/governance,2
2023-10-19 08:55:36,Comment,Donuts are decentralized and don't rely on a Reddit vault,1
2023-10-19 08:53:11,Comment,And don't get stingy with upvotes,2
2023-10-19 08:52:14,Comment,The warning was posted on a Daily many times already,2
2023-10-19 08:49:47,Comment,I would load up on xDai and Monero,2
2023-10-19 08:46:02,Comment,"Yeah, tipping directly works for me too",3
2023-10-19 08:43:26,Comment,/u/reddito321 take a look into it because you may be missing a lot of tips from your website,2
2023-10-19 08:39:31,Comment,Did you tip him from [https://www.mydonuts.online/](https://www.mydonuts.online/) or directly or ethtrader?,3
2023-10-19 08:33:36,Comment,"There's no error. Tip gets approved, however, Send Tip doesn't activate my Metamask. No problems with tipping posts on ethtrader.

Try it now, and see if it goes through https://www.mydonuts.online/",4
2023-10-19 08:19:57,Comment,I'm trying to tip /u/reddito321 for his Donut Estimator and a tip doesn't go through. Have you got the same problem?,5
2023-10-19 08:11:23,Comment,Who else was here when we had a ratio of over 100?,4
2023-10-19 08:04:16,Comment,Now you started witch🧙hunting :-P,3
2023-10-19 07:55:56,Comment,$1 is an annual fee to be precise,1
2023-10-18 20:39:26,Comment,Downvoters shall not pass!,1
2023-10-18 19:44:34,Comment,👍,2
2023-10-18 19:41:26,Comment,Some people think it's a zero sum game,1
2023-10-18 18:13:42,Comment,Not all whales are as smart as Donut whales,6
2023-10-18 18:11:55,Comment,Why is this NSFW?,1
2023-10-18 16:16:36,Comment,My heavy bags?,1
2023-10-18 15:48:04,Comment,"Set up your wallet to receive Donuts

https://www.reddit.com/r/ethtrader/comments/kl6ldu/donuts\_faq/",2
2023-10-18 15:19:13,Comment,I'm tempted to transfer you 1 Donut on the mainnet :-P,2
2023-10-18 15:18:02,Comment,Sunday late night is the best time for cheap tx,2
2023-10-18 15:04:11,Comment,"Reddit giveth and Reddit taketh away. 

And now people will learn about the importance of decentralization",2
2023-10-18 15:00:52,Comment,That's a handsome amount of Donuts,1
2023-10-18 14:59:41,Comment,It's recovering *despite* the FUD,2
2023-10-18 14:56:40,Comment,What's the FUD of the day? :-P,1
2023-10-18 14:48:25,Comment,It's possible to provide liquidity: https://donut-dashboard.com/#/stake,1
2023-10-18 14:39:58,Comment,">jump to the dark side

Dark side of the Moon?",3
2023-10-18 14:30:45,Comment,"Some whale 🐋 just bought 512,000 Donuts 🍩",4
2023-10-18 14:13:40,Comment,"I don't mean to brag, but I was temporarily banned on r/cc 3 times :-P",3
2023-10-18 12:49:39,Comment,And don't forget to set up your wallet and start earning $Donuts 🍩: https://www.reddit.com/r/ethtrader/comments/kl6ldu/donuts\_faq/,1
2023-10-18 12:47:20,Comment,it's an arbitrage bot,1
2023-10-18 12:42:17,Comment,You can buy them on Uniswap on the Ethereum Mainnet or HoneySwap on the Gnosis blockchain,2
2023-10-18 12:36:47,Comment,Don't forget to set up your wallet and start earning Donuts: https://www.reddit.com/r/ethtrader/comments/kl6ldu/donuts\_faq/,1
2023-10-18 12:28:40,Comment,Set up your wallet and join the party: https://www.reddit.com/r/ethtrader/comments/kl6ldu/donuts\_faq/,2
2023-10-18 12:16:45,Comment,You mean 169 upvotes,2
2023-10-18 11:54:35,Comment,Trade volume on Donuts crossed $316k on Mainnet and $59k on Gnosis. And now there are more buyers than sellers. Take note ![img](emote|t5_37jgj|32639),3
2023-10-18 11:46:36,Comment,I rather have a sponge bath with Megan Fox 💋,1
2023-10-18 11:44:36,Comment,This is crypto. Expect unexpected,1
2023-10-18 11:43:19,Comment,"It's not the end of the World. We survived Elon's FUD, LUNA collapse, FTX scam we'll survive the Reddit rugpull",2
2023-10-18 11:40:47,Comment,"The sub will be just fine, less busy perhaps",1
2023-10-18 11:40:07,Comment,Make *Dark Side of the Moon* coin instead,2
2023-10-18 11:32:46,Comment,It was fun when it lasted,2
2023-10-18 11:27:07,Comment,"If you're new here, that's how you register for $Donuts:

https://www.reddit.com/r/ethtrader/comments/kl6ldu/donuts\_faq/",6
2023-10-18 11:15:03,Comment,"It's good that I sold most of it last year to qualify for the Arbitrum airdrop. And another chunk for $0.45  this year. Alway take your profits!

I'm going to tattoo that on my buttcheeks",2
2023-10-18 11:10:52,Comment,I was asking *about* the Purge not *for* Purge. I guess I jinxed it  😂,2
2023-10-18 10:59:32,Comment,Admins want to follow ETH trader Donut's decentralized distribution process for Moons,2
2023-10-18 10:46:00,Comment,Let's make a toast for the last distro! 🍸,-3
2023-10-18 10:22:09,Comment,"r/cc admins want to follow the ETH trader example:

https://old.reddit.com/r/CryptoCurrencyMoons/comments/17alh9w/summary\_of\_reddits\_abandonment\_of\_rcps\_and\_moving/",6
2023-10-18 10:07:58,Comment,You need to connect your Metamask with the Gnosis network to participate in the Donut distribution,2
2023-10-18 09:49:44,Comment,"There are different rules. No max. comment cap and there is a 250 Donuts fee for posting (but not for commenting)

And also you have to connect your Metamask wallet with the Gnosis network to receive distribution",1
2023-10-18 09:44:52,Comment,Then start your wallet and join us,2
2023-10-18 09:08:18,Comment,"Jesse Powell's (Kraken) comment on this whole situation: 

https://www.reddit.com/r/CryptoCurrency/comments/17a33ql/serious\_sunsetting\_community\_points\_beta\_and/k5ae9qu/?context=3",3
2023-10-18 08:48:37,Comment,And that's why decentralization is crucial,1
2023-10-18 08:18:40,Comment,So it looks like $Donut 🍩 bottomed out and is ready to rebound,5
2023-10-18 08:09:58,Comment,We're back to a humble beginnings,2
2023-10-18 08:06:48,Comment,And don't forget Harmony ONE,4
2023-10-17 20:37:00,Comment,ETH trader Donuts,2
2023-10-17 19:53:13,Comment,https://www.reddit.com/r/ethtrader/comments/17a344b/sunsetting\_community\_points\_beta\_and\_special/,2
2023-10-17 19:51:46,Comment,Only death and taxes are certain,2
2023-10-17 19:48:15,Comment,Why not? The trade volume is high lol,2
2023-10-17 19:47:33,Comment,Black Swan event ;-),2
2023-10-17 19:46:22,Comment,there's more buying pressure on Uniswap now,3
2023-10-17 19:37:27,Comment,And you were followed by another whale who bought 464k Donuts,2
2023-10-17 19:12:51,Comment,It's a good lesson on the advantages of decentralization,2
2023-10-17 19:03:41,Comment,And that's exactly why decentralization is so important,1
2023-10-17 18:32:35,Comment,Donuts runs independently from the Reddit vault,1
2023-10-17 18:18:01,Comment,Donuts are separate and decentralized. They don't rely on Reddit vault,8
2023-10-17 18:16:09,Comment,First they took our SNEKS and now they're taking our Moons?,2
2023-10-17 18:09:37,Comment,"Fortunately, unlike Moons, Donuts 🍩are decentralized and doesn't rely on the Reddit vault",2
2023-10-17 16:32:26,Comment,"I wouldn't change a thing. All that suffering during the bear market made me a better person.

OK, enough with this bull\*, I would time the market obviously",2
2023-10-17 15:04:47,Comment,"Is there going to be a Purge before the next distro?

Asking for a friend",3
2023-10-17 14:53:58,Comment,What karma ratio are we expecting for the upcoming 🌕 distro round?,6
2023-10-17 14:51:31,Comment,Not all whales are smart. Some of them become shrimps during the cycle,1
2023-10-17 14:49:44,Comment,Patience. Sometimes doing nothing is the best action you can do at a time,2
2023-10-17 14:46:10,Comment,the only exchange that even comes close in trade volume to Binance is OKX and it's still 3 times smaller,1
2023-10-17 12:37:06,Comment,Thanks to you we'll soon have to solve captcha on that site :-P,1
2023-10-17 12:19:14,Comment,"Invest in Harmony ONE, Algorand, Loopring

Oh wait...",3
2023-10-17 12:18:00,Comment,Only if have access to a very cheap/free electricity,1
2023-10-17 11:59:54,Comment,A Banana man,1
2023-10-17 11:19:34,Comment,It looks like Bitcoin's dominance is growing. It is now sitting at almost 52%,0
2023-10-17 11:17:31,Comment,Gainz & losses,5
2023-10-17 11:02:00,Comment,And in the UK Binance stopped accepting new users since they lost FCA authorised approver,3
2023-10-17 10:28:36,Comment,"Listing Donuts in 2023 is like buying Tesla stocks in 2019, but better.",1
2023-10-17 09:59:12,Comment,"Grunge

Now I'm listening to Creed - My own prison",1
2023-10-17 09:57:22,Comment,"Well, you had your chance to take profits ;-)",2
2023-10-17 09:56:32,Comment,We're back to crabbing 🦀,3
2023-10-17 09:16:34,Comment,A whale bought $5.7b in Bitcoin futures amid Bitcoin ETF fake news,9
2023-10-17 08:18:49,Comment,You'll see what happens if there's another /purge on r/cc before the snapshot,3
2023-10-17 08:00:04,Comment,That's the second time he has sent a substantial amount of money to a CEX in the last 2 months. I think he is  building a Death Star,7
2023-10-17 07:44:04,Comment,"Vitalik sent some money to CEX again, 15M USDC to Gemini this time.",2
2023-10-17 07:30:23,Comment,"*Downvoters are easily startled, but they'll soon be back and in greater numbers*",3
2023-10-17 07:28:24,Comment,5 wheels including spare,1
2023-10-17 07:27:31,Comment,A real ETF approval news,2
2023-10-17 07:25:34,Comment,Back to crabbing? 🦀,1
2023-10-17 07:24:36,Comment,"More often than ""ETH"" :-)",1
2023-10-17 07:18:29,Comment,Are you immune to irony my fren? ;-),2
2023-10-16 20:25:46,Comment,I'm going back to 80's lol,2
2023-10-16 20:22:27,Comment,I want to get child benefit and a housing benefit from it :-P,2
2023-10-16 20:18:13,Comment,another fake news,1
2023-10-16 20:17:13,Comment,Since the news wrecked $100 mln. in shorts it's no surprise that it went up :-P,3
2023-10-16 20:15:42,Comment,"With stocks it does. With crypto...it depends. Sometimes buying the dip works better.

Microstrategy was DCAing into BTC for the last 3 years and they are currently at a loss.",1
2023-10-16 19:10:48,Comment,Say whatever you want but I prefer those exciting days packed with drama to the mindless crabbing 🦀 we've had so far :-P,6
2023-10-16 19:08:20,Comment,More likely he is swing-trading,2
2023-10-16 19:02:22,Comment,Suikonami dropped 1.5 mil. Donuts 🍩 on us :-P,4
2023-10-16 17:53:24,Comment,And the lesson from today's event is: **don't short ₿ Bitcoin**,2
2023-10-16 17:51:12,Comment,Split the bill in half,1
2023-10-16 17:49:49,Comment,Another fake news :-P,1
2023-10-16 17:48:27,Comment,$Donut 🍩 ETF will be next,2
2023-10-16 17:46:19,Comment,"Yes, you will",2
2023-10-16 17:01:29,Comment,*Try leverage* 😈,1
2023-10-16 16:59:26,Comment,We learned that fake news produce real results :-P,3
2023-10-16 16:56:19,Comment,True dat. BAT is always last to pump and first to dump :-P,1
2023-10-16 16:05:50,Comment,"That's due to $100 mil. liquidated in BTC and ETH shorts on account of the fake news

The times we're living in",1
2023-10-16 15:59:11,Comment,*Fake* news produced *real* green dildos,5
2023-10-16 15:05:52,Comment,The news may be fake but the green candles are real,2
