Date,Activity Type,Content,Upvotes
2023-10-16 15:01:17,Comment,"Actually, It did move since the fake news wrecked $100 mil. in shorts (including $64 mil. in Bitcoin shorts)",2
2023-10-16 14:37:08,Comment,BTC ETF fake news liquidated $100 mil. in Bitcoin & ETH shorts,2
2023-10-16 14:25:20,Comment,So that coin telegraph fake news liquidated $100 million in BTC & ETH shorts,3
2023-10-16 13:48:50,Comment,Bitcoin shorts are getting wrecked,1
2023-10-16 13:02:01,Comment,"They will be priceless, as always",1
2023-10-16 12:59:31,Comment,Different crypto tribes will smack each other with their heavy bags forever,1
2023-10-16 12:57:12,Comment,Trabant brown,2
2023-10-16 12:55:44,Comment,The bull is still shy and scared of the giant Crab,2
2023-10-16 12:55:15,Comment,between 0.69 and 4.20,1
2023-10-16 12:50:12,Comment,"I ate a weird looking mushroom and I saw the future.

Ask me anything",5
2023-10-16 12:30:42,Comment,Bitcoin block rewards for mining will be cut in half,2
2023-10-16 12:24:36,Comment,This battle is won by the Ethereum before it even started,1
2023-10-16 12:23:32,Comment,Upbit exchange received a licence in Singapore,2
2023-10-16 12:21:31,Comment,191 days left until the ₿ Bitcoin halving,4
2023-10-16 12:19:06,Comment,My crypto success story lies in my heavy bags :-),2
2023-10-16 12:18:23,Comment,Maybe not entire trading but I would use it more often that's for sure,1
2023-10-16 12:17:21,Comment,A downvoting army again? Perhaps some new members don't realize it's not r/cc and that's not how we operate,2
2023-10-16 12:15:55,Comment,I'd say quality and volume,1
2023-10-16 12:14:15,Comment,It runs on Cardano so we don't like it :-P,2
2023-10-16 12:01:17,Comment,">300k eth

So he makes almost 10k ETH a year if he staked on Lido for 3.3 APR

That's around $1.5 mln.",1
2023-10-16 11:57:59,Comment,0.69,2
2023-10-16 10:24:26,Comment,Hodling + Swing trading,2
2023-10-16 10:22:48,Comment,And then waiting another 2 weeks for distro :-P,2
2023-10-16 10:21:42,Comment,SNEKinu,4
2023-10-16 10:08:01,Comment,You farm like there's no tomorrow,3
2023-10-16 10:06:46,Comment,9 days from now,3
2023-10-16 10:05:28,Comment,Low trade volume is my best guess,2
2023-10-16 09:54:59,Comment,Every crypto youtuber,1
2023-10-16 09:54:01,Comment,Tether is the only major stablecoin that hasn't depegged so far,2
2023-10-16 09:52:34,Comment,I'll stick to my crystal ball 🔮. It's more accurate :-),2
2023-10-16 09:50:12,Comment,You have to learn how to post comments on ETH Trader while you sleep,3
2023-10-16 09:13:30,Comment,"I don't want to spoil the party, but most of them can be bots :-)",2
2023-10-16 08:37:50,Comment,"We're in the longest crypto bear market 🐻 ever recorded. 

Once we're out, I expect the longest Bull market for us too",16
2023-10-16 08:31:32,Comment,Let me confirm it with my crystal ball 🔮,2
2023-10-16 08:29:58,Comment,https://ambcrypto.com/has-uniswap-shattered-the-basics-of-defi-with-this-update/,2
2023-10-16 07:42:01,Comment,Have you heard the news? Uniswap is going to introduce KYC on its V4,1
2023-10-16 07:41:11,Comment,Uniswap is going to introduce KYC on its V4,4
2023-10-16 07:32:30,Comment,The early worm 🪱 gets the bird,1
2023-10-16 07:31:17,Comment,We've got nowhere else to go ;-),1
2023-10-16 07:30:27,Comment,I think Venom testnet will be good. I'm not sure about the rest,2
2023-10-16 07:28:42,Comment,I'm not a degen enough,2
2023-10-16 07:27:24,Comment,I don't marry my bags,1
2023-10-16 07:26:48,Comment,ARB,2
2023-10-16 07:22:03,Comment,"*Sometimes up, sometimes down*

Always sideways 🦀",1
2023-10-15 19:51:16,Comment,Not taking profits often enough during the last Bullrun,3
2023-10-15 19:50:18,Comment,Holding them. Moons have still a lot of potential to appreciate in value,1
2023-10-15 19:23:12,Comment,Only if there's another Purge before the snapshot,2
2023-10-15 19:22:07,Comment,You can use stablecoins for yield farming,1
2023-10-15 19:21:11,Comment,USDC,2
2023-10-15 19:19:45,Comment,I don't smoke so it's an easy yes for me,1
2023-10-15 19:02:45,Comment,Because he is a rebel,1
2023-10-15 19:02:28,Comment,We all know who he is. GG,2
2023-10-15 18:57:31,Comment,"I spoke with the Bull.

AMA",5
2023-10-15 18:56:37,Comment,I'd rather go to Thailand :-P,2
2023-10-15 18:51:52,Comment,PERP DEXs have plenty of trading options that in the past could only be used on CEXs (like Binance). And regular DEXes like Uniswap are just simple swaps,1
2023-10-15 18:30:29,Comment,Low trade volume,0
2023-10-15 18:18:25,Comment,I prefer perpetual DEXs like GMX and VELA on Arbitrum,1
2023-10-15 18:07:05,Comment,Fortnite BRICKS got delisted on MEXC. The price is going down,10
2023-10-15 17:34:53,Comment,"Be the change you want to see in the world. 

Whenever you buy something, on eBay for example, ask the seller if you can pay with crypto",2
2023-10-15 17:32:34,Comment,Right now Rocketpool is at max. staking capacity,3
2023-10-15 17:31:16,Comment,Because it's fun and catchy. And you can't say no to it,2
2023-10-15 14:48:40,Comment,Pick one  :-P,1
2023-10-15 13:19:41,Comment,"What's wrong with that one?

https://www.reddit.com/r/ethtrader/comments/p8ovvk/vitalik\_approves\_donuts/",3
2023-10-15 13:13:19,Comment,Once you earn them you can do whatever you want with them,1
2023-10-15 12:57:57,Comment,"No, Donuts are distributed on the Gnosis blockchain where gas fees are minuscule ( a fracture of a penny for one tx).

You can transfer them to mainnet if you want.",1
2023-10-15 12:55:05,Comment,Did you speak with the bull?,1
2023-10-15 12:54:43,Comment,"*Flashy doggy, I buy* 🤤",3
2023-10-15 12:52:52,Comment,50 comments a day is a full-time job,1
2023-10-15 12:52:18,Comment,Portugal and UAE as well since there's no income tax there,2
2023-10-15 12:50:59,Comment,I started to live below my means and invest the rest,1
2023-10-15 12:50:08,Comment,Are you saying that crypto is gambling? :-P,3
2023-10-15 12:35:33,Comment,I'll buy a crab meal 🦀 to take my revenge,2
2023-10-15 12:32:41,Comment,Cash is burning a hole in your pocket? :-),1
2023-10-15 12:18:04,Comment,"With Donuts there's no karma ratio penalty for selling. And there's also no limit for comments (no negative karma for 50+ comments). 

On the other hand, you have to pay (with Donuts) for posting.",3
2023-10-15 12:15:08,Comment,RWA real word assets,1
2023-10-15 11:59:42,Comment,And now there's Hamas FUD in the mainstream media...,1
2023-10-15 11:52:05,Comment,"Real happy or ""*you will have nothing and you will be happy*"" kind of happy? :-P",1
2023-10-15 10:33:19,Comment,If you look deep enough there are local pumps here and there,2
2023-10-15 10:32:40,Comment,You need permission from Elders Council,2
2023-10-15 10:25:11,Comment,I wonder what is fueling ArbDoge's recent rapid growth. Any ideas?,5
2023-10-15 10:20:42,Comment,You would be touching the grass :-P,2
2023-10-15 10:18:57,Comment,Blasphemy!,3
2023-10-15 10:17:57,Comment,It will start once I sell my bags,3
2023-10-15 10:06:35,Comment,Remind me when there're 69 days left,3
2023-10-15 10:04:21,Comment,"Nooo, because of fundamentarinos and spaceman bad :-P",1
2023-10-15 10:01:46,Comment,That depends on what you're selling :-),2
2023-10-15 10:01:18,Comment,Check Reddit and inverse trade :-),2
2023-10-15 09:10:37,Comment,Or you can buy an van and live by the river like the rest of us :-P,2
2023-10-15 09:07:26,Comment,Only until the next Bullrun when FOMO kicks in,1
2023-10-15 09:06:28,Comment,Bitcoin and Ethereum ETFs being approved,1
2023-10-15 09:05:38,Comment,"I would buy INJ, AAVE, MASQ and VELA . In that order",2
2023-10-15 09:04:00,Comment,The next may be ByBit,2
2023-10-15 09:02:51,Comment,"I bet many ppl got were spooked by the Ledger controversy. Fortunately, there's an open-source Trezor and they just released their new wallet",3
2023-10-15 07:43:02,Comment,3.31% APR on Lido,2
2023-10-15 07:39:51,Comment,That's the kind of Hopium I've been hoping for this morning!,1
2023-10-15 07:39:14,Comment,"*Web3 gaming will get an audience when* devs start creating fun and engaging games. 

Just start with a good concept for a game with decent graphics and in-game mechanics and then add Web3 on top of it.",1
2023-10-15 07:28:15,Comment,">Make 25k donuts per month for a year (25k\*12=300k total donuts)  
>  
>Donuts hit 1$ during bull, you get 300k in profit

Convert the profits into ETH and stake it. Create a nice passive income and rent a Lambo ;-)",2
2023-10-15 07:25:34,Comment,Only if they buy the right coins and hold them long enough,1
2023-10-15 07:25:04,Comment,"Charles is a very polarizing figure and a major PR weakness of Cardano

He would rather speak badly about other blockchains, especially Ethereum than create a positive attitude about Cardano",1
2023-10-15 07:03:00,Comment,Half of the crypto news is about Ferrari accepting crypto and another half is about Hamas using crypto...,1
2023-10-14 20:08:54,Comment,The number of posts and comments,1
2023-10-14 20:07:59,Comment,"Nothing official yet, but yes, the Kraken team is lurking around the Daily",1
2023-10-14 20:01:12,Comment,"A short-lasted FUD.

We can't even afford a decent FUD in this damn crab market...",1
2023-10-14 19:54:34,Comment,High trade volume on Uniswap?,1
2023-10-14 19:49:19,Comment,I was hoping for twerking Donut :-),1
2023-10-14 19:39:07,Comment,"First, let me break even :-P",2
2023-10-14 19:35:38,Comment,Upvoting is sexy 😉,4
2023-10-14 19:20:10,Comment,I can't wait for Bitcoin to break 69k,2
2023-10-14 19:18:42,Comment,"I would spend those profits on crypto, not on vacation :-P",3
2023-10-14 18:48:59,Comment,"Copypaste your wallet address into Arbitrum Nova blockchain explorer

https://nova.arbiscan.io/",2
2023-10-14 18:47:12,Comment,"Yes, once we get through 25c sell wall",1
2023-10-14 18:37:28,Comment,It doesn't have a ring to it,2
2023-10-14 18:25:55,Comment,You can buy Taylor Swift concert tickets with crypto :-P,1
2023-10-14 18:22:08,Comment,I saw Solana Phantom wallet already posted and advertised on Twitter that it's available in the Apple Store during the FUD :-P,1
2023-10-14 17:55:18,Comment,What if I told you that Moons at $0.24 is a discount?,5
2023-10-14 17:39:04,Comment,Because Moons are in the green zone,1
2023-10-14 17:37:31,Comment,It's already solved,1
2023-10-14 17:29:05,Comment,You would've earned a handsome amount of upvotes for disarming that FUD :-),1
2023-10-14 17:22:52,Comment,We can't even afford a decent FUD during this Crab. Metamask FUD lasted only for a few hours,3
2023-10-14 17:21:36,Comment,I'm pretty sure that was Scrooge McDuck,1
2023-10-14 17:19:42,Comment,"So Metamask FUD didn't last long. 

Have we any other FUD on the table?",3
2023-10-14 17:17:00,Comment,The future is bright,1
2023-10-14 16:10:03,Comment,So I spoke with the Bull yesterday and he said he ain't coming until we get rid of that nasty Crab,13
2023-10-14 16:07:39,Comment,Once we reach the age of 12 we lose our ability to earn Bricks :-P,1
2023-10-14 15:45:14,Comment,Did you pass by the bakery?,2
2023-10-14 15:42:35,Comment,I'm buying the dippidy dips,2
2023-10-14 15:40:44,Comment,that's a bullish stance on Moons :-),1
2023-10-14 15:38:58,Comment,**Amazon**. Once they start accepting crypto everyone will follow,1
2023-10-14 15:38:01,Comment,Unless Lambo starts accepting Moons,2
2023-10-14 15:31:38,Comment,ArbDoge is pumping like crazy. +67% in the last 24hrs,2
2023-10-14 15:23:29,Comment,NSFW,2
2023-10-14 15:22:17,Comment,"USDT. Oh wait, it's already there :-P",1
2023-10-14 15:20:44,Comment,And Moons are the biggest transfer of wealth to farmers,1
2023-10-14 15:18:38,Comment,I can't. I've been cheating on Moons with Donuts 🍩 :-P,1
2023-10-14 14:50:09,Comment,Was that a TA?,1
2023-10-14 14:29:47,Comment,"I don't read any non-crypto and non-tech related news.

If they want me to read that crap they should pay me for my time and attention",1
2023-10-14 14:25:44,Comment,"> It rhymes with grape

ape?",2
2023-10-14 14:24:08,Comment,Inverse r/cc applies to coins shilled on Daily. The bullrun is immune to it :-),2
2023-10-14 13:31:53,Comment,**A half-pounder 🍔**. After all those years on the Ramen diet I deserve it :-P,2
2023-10-14 13:30:33,Comment,I fantasize about them hitting 0.69,1
2023-10-14 13:29:55,Comment,I'm motivated to buy a Tesla Cybertruck with Dogecoin ;-),2
2023-10-14 13:17:30,Comment,your daily Ramen,2
2023-10-14 13:15:30,Comment,"*""it ain't much but it's honest work""*",2
2023-10-14 13:12:44,Comment,Perhaps they want to steal crypto bros from Lambo :-P,5
2023-10-14 13:05:04,Comment,And mine will scare me 👻,2
2023-10-14 13:04:04,Comment,They never stopped looking great :-),2
2023-10-14 13:02:46,Comment,Adoption in adoption,3
2023-10-14 12:54:30,Comment,Because *greed* kicks in and doesn't allow us to sell until we *reach the moon*,2
2023-10-14 12:53:04,Comment,We're in for *the tech* :-P,1
2023-10-14 12:52:13,Comment,"My goal, as always, is a financial independence",2
2023-10-14 12:50:43,Comment,We've got more upvotes on Daily than r/cc 👀,10
2023-10-14 11:09:03,Comment,Wen Dacia? :-),1
2023-10-14 11:04:28,Comment,"And sold for $120 in 2021, right? Right?",2
2023-10-14 11:03:14,Comment,or Dacia,2
2023-10-14 10:55:34,Comment,Once Lamborghini starts accepting crypto payment we are officially in the bull run,4
2023-10-14 10:54:29,Comment,https://www.coingecko.com/en/coins/moon#markets,1
2023-10-14 09:34:41,Comment,$Moons mini pump is not interesting enough? :-),3
2023-10-14 08:02:02,Comment,"My first mistake was assuming that crypto youtubers know ""shit about fuck"" when it comes to crypto",2
2023-10-14 07:40:04,Comment,"Once you start earning Donuts 🍩 don't fade the Gnosis ecosystem

https://gnosischain.world/",2
2023-10-14 07:25:46,Comment,I want it to fund my digital nomad lifestyle,3
2023-10-14 07:24:28,Comment,"Uniswap on Ethereum mainnet

Camelot and Vela on Arbitrum One

SyncSwap on zkSync ERA",2
2023-10-14 07:22:20,Comment,They did not appeal court decision,1
2023-10-14 07:20:42,Comment,Congrats on your Lambo :-D,2
2023-10-14 07:19:56,Comment,"I would use a noble term: Shitposter :-)

Alternatively a Donut Farmer",2
2023-10-14 06:57:00,Comment,"It's most likely a glitch called ""Saturday"" :-)",1
2023-10-14 06:55:33,Comment,What pissed me off the most was the statement about FTX surprising the BTC price during the last bullrun,2
2023-10-14 06:53:56,Comment,"Hopefully, since I accumulated so many cheap/free NFTs farming airdrops :-P",1
2023-10-14 06:53:00,Comment,I'm adding to my current bags like INJ and ARB,1
2023-10-14 06:51:52,Comment,So many times that now I have to solve the *captcha* :-P,2
2023-10-14 06:48:25,Comment,"Moons are pumping. Come one, Donut 🍩follow their example",2
2023-10-14 06:46:49,Comment,Feels great waking up to a pumping Moons! 🌕,1
2023-10-13 19:43:04,Comment,Mine is not taking profits often enough during the last bull run,1
2023-10-13 19:37:23,Comment,And what are you selling? :-),2
2023-10-13 19:35:38,Comment,Bitcone,1
2023-10-13 19:34:52,Comment,"Karma ratio 0.87

Not great, not terrible",2
2023-10-13 19:16:25,Comment,Why Ethereum tokens are you invested in right now?,3
2023-10-13 19:07:37,Comment,Cultivation of Moons,2
2023-10-13 19:06:55,Comment,500 Moons will make me happy,1
2023-10-13 19:04:37,Comment,Donuts :-),2
2023-10-13 18:58:49,Comment,Give Crabtober a chance. There are still over 2 weeks left to No-nut November,2
2023-10-13 18:51:59,Comment,I would sentence him to life in prison and give him a slow Windows Vista laptop with a frustratingly unstable WiFi connection,2
2023-10-13 18:06:32,Comment,I own a full Moon 🌕,2
2023-10-13 18:04:31,Comment,And that's precisely why his identity remains secret :-),2
2023-10-13 17:54:30,Comment,"*""buy high sell low""*",3
2023-10-13 16:32:51,Comment,Release the Kraken! 🐙,-1
2023-10-13 15:28:40,Comment,See? Doing Good always pays ;-),1
2023-10-13 15:27:44,Comment,"I don't remember...OK, OK I admit it, it was 5 minutes ago...",2
2023-10-13 15:26:45,Comment,Loopring LRC and Harmony ONE,1
2023-10-13 15:23:31,Comment,Litecoin without doubt,1
2023-10-13 15:22:23,Comment,"On the upside, karma ratio is going to be higher now",2
2023-10-13 15:14:43,Comment,He should get the same sentence as Bernie Madoff,1
2023-10-13 15:11:48,Comment,Crab sandwich is good too,3
2023-10-13 15:10:28,Comment,Those crooks are worth each other,3
2023-10-13 15:09:27,Comment,So it's Crabbish,4
2023-10-13 14:00:47,Comment,"The main use of Moons is for hoarding.

My precious :-)",1
2023-10-13 13:56:09,Comment,If Cyberpunk 2077 did it it would be even better!,3
2023-10-13 13:37:35,Comment,"Fortnite sub is virtually inaccessible to outsiders, or anyone older than 12 for that matter, hence the frustration :-P",1
2023-10-13 13:35:22,Comment,"Come on Donut 🍩, show ETH ![img](emote|t5_37jgj|32637) how it's done",2
2023-10-13 12:32:46,Comment,My Plan B is living on Ramen until the bull 🐂 hits hard,2
2023-10-13 12:30:31,Comment,I'm sticking to some of my heavy bags but also betting on the new champions,2
2023-10-13 12:29:23,Comment,RWA Real-World Assets,1
2023-10-13 12:29:00,Comment,That twerking Donut always gets me,2
2023-10-13 12:27:49,Comment,"SNEKS ![img](emote|t5_37jgj|32640) were Overlords of the crypto community on Reddit.

They are gone but not forgotten",1
2023-10-13 11:58:54,Comment,Moonish 🌕,1
2023-10-13 11:42:40,Comment,The Crab 🦀is still better than the Bear 🐻...,2
2023-10-13 11:35:20,Comment,We're getting close to **69** today quickly,6
2023-10-13 10:56:08,Comment,One large whale bought Moons for 20 ETH yesterday. With another 80 ETH bridged to Arbitrum Nova in reserve,1
2023-10-13 09:36:59,Comment,I own ETH Trader Donuts. They have great potential to expand in price,3
2023-10-13 09:34:32,Comment,I would set new more ambitious goals,1
2023-10-13 09:06:56,Comment,I sold a free NFT for $28 in the bear market. That's an achievement! 😊,3
2023-10-13 08:45:57,Comment,Friday the 13th is lucky for the Moons 🌕 so far,3
2023-10-13 08:29:28,Comment,"Gary Gensler is getting slammed by The US House Committee again. At some point, he will give in.",7
2023-10-13 08:25:21,Comment,Sure we are. Set up your MM wallet and join the 🍩 revolution!,2
2023-10-13 08:17:49,Comment,Every single Moon 🌕 earned during a Bear market will count as x10 during the 🐂 Bull market!,7
2023-10-13 07:58:28,Comment,I'm putting my hopes in no-nut November,1
2023-10-13 07:33:56,Comment,And what's your take on r/coneheads $CONE tokens? Does it have a bright future?,1
2023-10-13 07:19:44,Comment,Smoking is such a waste of money. You're burning your cash and your health at the same time,3
2023-10-13 07:14:26,Comment,**suikonami** became a Mega-Whale 🐋 with his 1.6 million Donuts 🍩,2
2023-10-13 07:03:37,Comment,"I've already started adding eggs to my Ramen.

Nest stop: slices of sausage!",2
2023-10-13 07:01:53,Comment,It's up to us to lift it up now!,1
2023-10-13 06:59:32,Comment,I rather trust my crystal ball,4
2023-10-13 06:57:10,Comment,"It's a Giant Crab, sir",1
2023-10-13 06:56:24,Comment,"Over 2 years now. I've been here through ""silent days"" right after the end of the 2021 bullrun",1
2023-10-13 06:34:09,Comment,"C'mon Moons, break that $0.24 resistance",4
2023-10-13 06:33:06,Comment,Beautiful green day for Donuts 🍩,3
2023-10-12 20:12:22,Comment,"We will BagYou, my fren",1
2023-10-12 20:11:02,Comment,"We crossed the magical number on Daily upvotes.

No more 69 for you horndogs! :-)",3
2023-10-12 18:57:11,Comment,"How does ""Pumptober"" treat you so far?",6
2023-10-12 18:54:48,Comment,And those who wet their bed are more likely to become billionaires,1
2023-10-12 18:52:33,Comment,That depends if you buy low and sell high or the other way around.,2
2023-10-12 18:49:13,Comment,The thrill is in the chase,1
2023-10-12 18:35:28,Comment,So good 🥹,2
2023-10-12 18:24:16,Comment,I'm checking it but I'm still surprised at the end of the month...,1
2023-10-12 18:21:36,Comment,Who's that girl? Asking for a friend :-),2
2023-10-12 18:16:09,Comment,Shib is an ETH Whales playfield so it's not going anywhere anytime soon,1
2023-10-12 18:13:13,Comment,You mean rug pulls?,1
2023-10-12 17:37:19,Comment,"Buy high, sell low.",1
2023-10-12 17:34:36,Comment,It's Rectober so far,1
2023-10-12 17:33:18,Comment,Whales🐋 are hungry for 🍩 today,1
2023-10-12 17:29:18,Comment,minus 34%,1
2023-10-12 17:28:00,Comment,POOP is a product of your BOWELS,2
2023-10-12 17:26:19,Comment,Moon whales are buying,1
2023-10-12 17:25:33,Comment,tldr: Master FUD and FOMO,1
2023-10-12 17:22:42,Comment,"And that's why we should focus on new market narratives, like RWE, and new future bullrun champions",2
2023-10-12 17:07:55,Comment,I know that I know nothing,1
2023-10-12 17:05:43,Comment,You can have Pet Rock tattoed on your arm for just $1.3 mil.,1
2023-10-12 16:58:47,Comment,Screwed by JaredFromSubway,1
2023-10-12 16:53:51,Comment,Whales bought it. One particular whale 🐋 bought Moons for 20 ETH today.,1
2023-10-12 15:48:40,Comment,with little Hot Dogs cut up in them?,2
2023-10-12 15:46:43,Comment,Can't help it. I'm going crazy tonite!,2
2023-10-12 15:45:30,Comment,$Moon puts an egg in my Ramen tonite :-),5
2023-10-12 15:42:02,Comment,"There are plenty of crypto ads in the Formula 1 races. OKX, Kraken, ByBit, you name it",1
2023-10-12 15:38:28,Comment,"Don't forget to take your profits. 

Untamed Greed during the Bullrun will make you suffer during the next bear market",2
2023-10-12 15:36:53,Comment,"What's more important, we are on the verge of a $0.02 Donut 🍩",1
2023-10-12 15:35:32,Comment,Tonite I'm gonna add half an egg to my Ramen to celebrate it :-),4
2023-10-12 14:50:56,Comment,"$Donut trade volume on Uniswap is up to $47k  
  
One 🐋just bought 100k Donuts 🍩",5
2023-10-12 14:02:02,Comment,"102 ETH \[$158,373\] bridged to Arbitrum Nova. 

135,000 $MOON for 20 ETH was bought so far by this wallet",7
2023-10-12 13:11:50,Comment,Swap on Gnosis and forget about Jared,1
2023-10-12 11:23:32,Comment,One Moon a day keeps Gensler away!,3
2023-10-12 11:11:35,Comment,"USDR depegged to $0.53

I wonder if they are going to back it up. If they do, some Degens will make a lot of money by buying one dollar for 50 cents.

Just like those who bought 1 USDC for $0.87 earlier this year.",4
2023-10-12 10:44:32,Comment,And now the insane SOL pump from the last bullrun makes much more sense,1
2023-10-12 10:24:23,Comment,Moons 🌕 are the only source of green in my portfolio today,2
2023-10-12 10:07:48,Comment,I nominate one of our 🍩 whales 🐋 ;-),1
2023-10-12 09:55:03,Comment,Good 🐋. Eat some more,2
2023-10-12 09:35:24,Comment,"*DOT under $10 is a steal!*

A YouTube shiller AD 2022",2
2023-10-12 09:33:36,Comment,So we are 300k bots stronger now?,1
2023-10-12 09:19:29,Comment,I check it once in the morning instead of coffee to increase my blood pressure,3
2023-10-12 08:57:51,Comment,For 1 BTC you would have to kiss her goodnight :-P,2
2023-10-12 08:45:00,Comment,Action: taking my profits,3
2023-10-12 08:42:56,Comment,"Dunno, now that Bitboy is gone there are no more reliable sources of information about crypto on yt ;-D",2
2023-10-12 08:38:55,Comment,Our local whales buying 🍩 on the cheap,3
2023-10-12 08:35:02,Comment,Injective. It surprised me how resilient it is,3
2023-10-12 08:31:46,Comment,"It doesn't take much to pump Bricks with a small market cap. For ETH we need a large amount of $ to be pumped in.

RCPs whales are small Porpoises compared to Ethereum whales",2
2023-10-12 08:27:46,Comment,There is some buying pressure for Donuts today with 3 tx for 100k 🍩,5
2023-10-12 08:20:45,Comment,**suikonami** is back at 1 million from \~ half a mil. a week ago,2
2023-10-12 08:12:19,Comment,"Would you go on a date with her for 1 ETH?

https://twitter.com/cousincrypt0/status/1712156784490619137/photo/1",2
2023-10-11 20:00:05,Comment,USDR,2
2023-10-11 19:55:41,Comment,That's Mr. Burns's level of evil,2
2023-10-11 19:51:07,Comment,"Rocket emojis in every second comment, duh ;-)",1
2023-10-11 19:34:13,Comment,Gambling is not one of the options on the menu?,2
2023-10-11 19:32:06,Comment,Let this Recktober pass already and pave the way for No-nut November,2
2023-10-11 19:31:00,Comment,Face melting gains,1
2023-10-11 19:29:50,Comment,Bridge ETH to Polygon. Send it to Coinbase,2
2023-10-11 18:59:35,Comment,Your TA for today: It will stop when it feels like it.,1
2023-10-11 18:58:36,Comment,"Now, all you need to do is invest $1bln in Moons :-P",1
2023-10-11 18:46:05,Comment,Certainly not for the money,1
2023-10-11 18:36:12,Comment,Will you be able to survive 50 years on Ramen thought?,3
2023-10-11 18:26:28,Comment,SyncSwap is a big tease with their airdrop hints,1
2023-10-11 18:23:56,Comment,That's good. I have high hopes for zkSync ERA,2
2023-10-11 18:22:02,Comment,The one that pumps the most in a given time,2
2023-10-11 17:27:29,Comment,But I'm a crypto millionaire. I can't afford $449.99...,2
2023-10-11 17:25:24,Comment,"Jim Cramer says “*#Bitcoin is about to go down big*!” 

Such a relief...",7
2023-10-11 17:20:02,Comment,Is it too early to ask for my Lambo? :-),2
2023-10-11 17:02:55,Comment,"Now I will have nightmares so you'll have it too. I know that you can't refuse to take a peak.

The beauty of Caroline:

https://twitter.com/AutismCapital/status/1711922830512939481/photo/1",3
2023-10-11 16:50:43,Comment,Yes.,1
2023-10-11 16:50:14,Comment,I'm simply observing.,2
2023-10-11 16:47:56,Comment,"Type o Negative ""Everything Dies"" :-P",2
2023-10-11 16:46:56,Comment,"Forged in losses, falling knives, and red dildos united we stand :-P",2
2023-10-11 16:11:36,Comment,You and your big mouth :-P,1
2023-10-11 16:11:05,Comment,Don't spend it all in one CEX!,1
2023-10-11 16:10:39,Comment,"Nope, it's a third thing I think about in the morning. 

\#1 and #2 takes priority",1
2023-10-11 16:06:58,Comment,"I see some potential in you, young padawan. Would you like to be my apprentice?",1
2023-10-11 16:05:44,Comment,I would prefer Ig Nobel prize if you don't mind,1
