Date,Activity Type,Content,Upvotes
2023-10-11 16:03:36,Comment,Who said it was free?,2
2023-10-11 16:02:55,Comment,"Also, when you close your eyes you become invisible!",2
2023-10-11 16:01:35,Comment,She may get shorter sentence for ratting on SBF,2
2023-10-11 16:00:41,Comment,Under my bed where the monster lives,2
2023-10-11 15:56:55,Comment,"My TA of the crypto market: it will either go up or down. Or perhaps it will remain in the same position. 

Thank you",3
2023-10-11 15:18:05,Comment,Read about past airdrops like Arbitrum and Optimism,1
2023-10-11 15:16:42,Comment,"MASQ, a competitor to Brave browser's BAT",1
2023-10-11 15:15:49,Comment,I had too much money and I decided to burn it ;-),2
2023-10-11 14:23:58,Comment,"If you can't beat them, join them.

*raymv1987 on* r/FortniteBR *""How do you do fellow kids?*"" :-D",3
2023-10-11 14:19:11,Comment,!donut,1
2023-10-11 13:55:39,Comment,My forecast is that the majority will come back to pump our bags up when FOMO hits hard,1
2023-10-11 13:39:41,Comment,700 days of Bear market have passed. Only the most resilient degens remain on post :-),5
2023-10-11 13:29:39,Comment,Right now all altcoins are bleeding out compared to Bitcoin. And the future crypto pump also depends on BTC moving up,2
2023-10-11 12:03:35,Comment,You get this with a special membership for 200 Donuts a month,1
2023-10-11 11:39:58,Comment,"They will have to drop or they'll risk losing their community. 

SUI was a good example of what happens when you ignore your community",2
2023-10-11 11:27:30,Comment,Venom is the only testnet airdrop that I'm farming. The rest of them seem like a waste of time,3
2023-10-11 11:22:02,Comment,What **airdrops** are you currently farming?,7
2023-10-11 11:19:45,Comment,For airdrop farmers: there's a new task to complete on the Venom testnet,2
2023-10-11 08:32:00,Comment,"*Let it be Binance, let it be Binance...*",1
2023-10-11 08:31:25,Comment,"We are feeling good, however, Crypto doesn't feel very well...",2
2023-10-11 08:29:57,Comment,Let me call the Crypto CEO,1
2023-10-11 08:02:31,Comment,Which coin you don't see recovering from its losses even when we hit a bull market?,4
2023-10-11 07:57:53,Comment,MEXC,2
2023-10-11 07:56:31,Comment,"Connect your wallet, then, and prepare for the next distro",3
2023-10-11 07:26:04,Comment,So Pumptober failed us so far. Our only hope is now in no-nut November.,5
2023-10-11 07:24:08,Comment,Would you like to speak with the CEO of Crypto?,2
2023-10-11 07:18:24,Comment,It's a signal that investors are preparing to buy more crypto,2
2023-10-11 07:11:52,Comment,USDT supply on exchanges hits the highest level since March. That's good news,2
2023-10-11 07:01:42,Comment,"Laziness is your strength then. Perhaps, one day you will invent a new investing strategy called *lazy gains*",2
2023-10-11 06:59:13,Comment,Crypto is like a box of chocolates.,8
2023-10-11 06:54:52,Comment,The market is trying to shake us out. Only those with the strongest conviction will remain and profit from it in the future.,4
2023-10-11 06:49:23,Comment,"That feeling is called ""crypto investment""",2
2023-10-11 06:47:05,Comment,">Never give your seed to your gf

Isn't that the whole point of having a gf?",2
2023-10-11 06:37:22,Comment,Jim Cramer is bearish on Bitcoin. This makes me calm,6
2023-10-11 06:21:45,Comment,Check if you're on this list: https://app.safe.global/transactions/tx?id=multisig\_0x682b5664C2b9a6a93749f2159F95c23fEd654F0A\_0xd3e7fd26133d657e168debaba72a6c0b2fbe561305438b66da9d8768fa430e3f&safe=gno:0x682b5664c2b9a6a93749f2159f95c23fed654f0a,2
2023-10-11 06:19:30,Comment,Check if you r wallet address is on this list: https://app.safe.global/transactions/tx?id=multisig\_0x682b5664C2b9a6a93749f2159F95c23fEd654F0A\_0xd3e7fd26133d657e168debaba72a6c0b2fbe561305438b66da9d8768fa430e3f&safe=gno:0x682b5664c2b9a6a93749f2159f95c23fed654f0a,2
2023-10-11 06:18:14,Comment,It's up to you. If you're planning on providing liquidity you can do it on Honeyswap on the Gnosis or Uniswap on Mainnet,2
2023-10-11 06:14:34,Comment,!crypto Refund,2
2023-10-11 06:12:38,Comment,!crypto rfd,1
2023-10-11 06:09:49,Comment,"Yes, the number of distributed Moons is slowly decreasing with each distribution",1
2023-10-11 06:08:13,Comment,**Litecoin**. It's almost as ancient as Bitcoin and it survived all crypto winters,2
2023-10-11 05:55:24,Comment,"OK, Donuts 🍩. You can stop bleeding now. You already taught us a lesson",5
2023-10-11 05:52:51,Comment,That's the one for today. Distro 128,1
2023-10-11 05:50:47,Comment,But what would we scan in order to receive Donuts? :-P,2
2023-10-11 05:48:34,Comment,If you could remove one person from the history of Crypto who it would be: Gary Gensler or Sam Bankman-Fried?,5
2023-10-10 19:10:36,Comment,Where's the Inverse Bart drinking from a Cup and handle pattern?,2
2023-10-10 19:08:24,Comment,Buy some plots on the Moon,2
2023-10-10 18:58:50,Comment,">We started sleeping together

Yuck, that's too much detail for me...",2
2023-10-10 18:56:33,Comment,*\*BONK\* go to horny jail!*,2
2023-10-10 18:55:46,Comment,No penalty,2
2023-10-10 18:48:10,Comment,Right now? USDC,1
2023-10-10 18:43:58,Comment,"Remember, no Bronuts in no-nut November :-)",2
2023-10-10 18:41:44,Comment,"All good, we're riding the bull. Don't worry and have some rest",2
2023-10-10 18:40:42,Comment,It looks to me that the price is $1564,1
2023-10-10 18:14:04,Comment,Only the most resilient will make it. And that's how it should be,1
2023-10-10 18:11:06,Comment,I'm waiting for a dippidy dip,1
2023-10-10 18:10:19,Comment,Needs less ADA,1
2023-10-10 18:07:20,Comment,I've done my part today,3
2023-10-10 18:06:27,Comment,Real World Assets,3
2023-10-10 18:05:47,Comment,Then I'll swallow them like a hog!,2
2023-10-10 17:57:52,Comment,His wickedness has no boundaries!,1
2023-10-10 17:52:05,Comment,Just a friendly reminder that it's all Gensler's fault :-P,2
2023-10-10 17:43:35,Comment,Investing in crypto is my degen lifestyle,3
2023-10-10 17:42:44,Comment,I don't care about it. I want my SNEKS back!,3
2023-10-10 17:41:58,Comment,There's always a no-nut November left,1
2023-10-10 17:37:08,Comment,"Yes, we should be thankful for our -90% heavy bags :-P",1
2023-10-10 17:33:48,Comment,"Yes, you can make money with it ***if*** you invest upfront in good cards.

Otherwise, you will be grinding for months for peanuts",2
2023-10-10 17:22:42,Comment,It will happen once most of the r/cc give up. That's the rule,1
2023-10-10 17:16:57,Comment,">Today I sold some art.

No way you found a  ~~sucker~~  an NFT buyer in the current market 👀",2
2023-10-10 17:08:52,Comment,The state of Donut distribution https://app.safe.global/home?safe=gno:0x682b5664c2b9a6a93749f2159f95c23fed654f0a,2
2023-10-10 17:07:03,Comment,"Ethereum foundation sold 1,700 ETH",2
2023-10-10 17:04:41,Comment,What's the FUD of the day?,3
2023-10-10 17:01:50,Comment,Not that frequently since I never leave,2
2023-10-10 17:00:49,Comment,"Yup, those 15-20 BATs a month are just an extra",1
2023-10-10 16:37:48,Comment,A passion for burning money :-P,2
2023-10-10 16:35:31,Comment,I'm waiting for a dippidy dip,2
2023-10-10 16:34:40,Comment,This is crypto. There's always another dip to buy,1
2023-10-10 16:01:17,Comment,Interesting fact: one Donut 🍩 is worth more than one Ruble,3
2023-10-10 15:59:15,Comment,"No one's gonna give you -5 on a comment here on Daily.

Unless you write something bad about Donuts. Then burn in hell :-P",5
2023-10-10 15:55:55,Comment,"No worries, betting on losers is a national sport here on r/cc",1
2023-10-10 15:51:16,Comment,You paid with your time and effort.,1
2023-10-10 15:43:17,Comment,We don't need whales but everyone wants to become a Donuts 🍩 whale :-P,1
2023-10-10 15:41:21,Comment,Donuts are unrestricted,3
2023-10-10 15:40:28,Comment,NSFW,2
2023-10-10 15:17:06,Comment,Dogecoin co-founder Billy Markus asked the SEC to **return all crypto taxes** since the regulator considers crypto to have ‘no innate or inherent value.’,4
2023-10-10 15:13:48,Comment,Damn. Binance’s $1b recovery fund plummets to just $32m,2
2023-10-10 14:58:45,Comment,4. Buy an old black van and a stash of Ramen. Invest the rest in microcaps and leverage trading,1
2023-10-10 14:52:58,Comment,True Degens don't dabble with anything above $1m market cap,1
2023-10-10 14:37:54,Comment,We'll get to 69. We always do,3
2023-10-10 14:36:18,Comment,Once you catch enough falling knives they will! :-P,1
2023-10-10 14:33:34,Comment,An old DOGE meme :-D,1
2023-10-10 14:28:29,Comment,\*BONK\* go to horny jail!,1
2023-10-10 14:21:55,Comment,Better late than never. The next snapshot is just around the corner,2
2023-10-10 14:15:52,Comment,Out of curiosity: who came up with a **Bronut** idea?,4
2023-10-10 12:39:06,Comment,Ethereum,3
2023-10-10 12:38:01,Comment,Litecoin. It's almost as ancient as Bitcoin and survived all crypto winters so far,3
2023-10-10 12:36:07,Comment,We can burn them. Starting with the largest wallets,1
2023-10-10 12:23:46,Comment,You wouldn't listen back then,2
2023-10-10 10:42:33,Comment,"Nope, it's the autumn farming season",2
2023-10-10 10:41:41,Comment,"It may or may not.

You can quote me on that",2
2023-10-10 10:40:54,Comment,The best we can do is some Hopium,3
2023-10-10 10:40:03,Comment,Make Donuts 🍩not war,1
2023-10-10 10:38:48,Comment,Donut🍩a day keeps negativity away!,5
2023-10-10 10:13:16,Comment,Because there will be not enough ETH left to buy for us,3
2023-10-10 09:57:20,Comment,They will be stored in my wallet waiting for the better days,1
2023-10-10 09:32:44,Comment,I'll stand by INJ and MASQ,1
2023-10-10 09:29:49,Comment,It's more of a hurdling imo,1
2023-10-10 09:11:53,Comment,And get accused of *shilling*? no way :-),1
2023-10-10 09:10:48,Comment,"In that logic, Moons were the shitcoin *until* quite a recent Kraken listing, no? :-)",1
2023-10-10 09:08:25,Comment,So far he is only *alienating* Cardano community :-P,1
2023-10-10 09:06:34,Comment,username checks :-),2
2023-10-10 09:05:47,Comment,It may be delayed but it will be delivered :-),1
2023-10-10 08:36:27,Comment,What's the amount of $Donuts 🍩 are you aspiring to hold?,9
2023-10-10 08:33:50,Comment,The best thing you can do right now is to buy promising unlisted tokens on the cheap. It will pay off handsomely once they hit CEX during the bull,3
2023-10-10 08:32:16,Comment,Accumulating and investing in undervalued quality projects and CEX unlisted tokens,2
2023-10-10 08:26:04,Comment,Isn't it too early in the morning to sniff so much hopium already? :-P,1
2023-10-10 08:23:24,Comment,That's Didi from the Bitcoin Family. He is a Bitcoin maxi,1
2023-10-10 08:21:34,Comment,Is it still a tax-free zone for cryptocurrency?,2
2023-10-10 08:18:47,Comment,I'm wearing my Banana costume,1
2023-10-10 08:15:32,Comment,If I see it can bring me profits in the future I'll buy it,2
2023-10-10 08:14:17,Comment,"I'm currently playing Pancake Protectors, a tower defense game on zkSync",2
2023-10-10 08:12:10,Comment,I rather have a bull market,2
2023-10-10 08:11:19,Comment,RWA real-world assets,2
2023-10-10 07:58:50,Comment,"Founder of Cardano and former co-founder of Ethereum.

Instead of positively promoting his own blockchain he attacks Ethereum on a regular basis",2
2023-10-10 07:44:13,Comment,I expect the great positive 🦀,2
2023-10-10 07:31:20,Comment,Who else can't stand Charles Hoskinson?,3
2023-10-10 07:29:15,Comment,I expect the great 🦀,2
2023-10-10 07:27:32,Comment,Many bots among them,2
2023-10-10 07:24:13,Comment,">""Guys I took my profits today, enjoy the ride!""

And the crowd was like: *Are you allergic to profits?* :-P",2
2023-10-10 07:22:27,Comment,There is only one step from love to hate...,2
2023-10-10 07:16:19,Comment,"Could go up or down or stay the same. 

You can quote me on that",1
2023-10-10 07:01:09,Comment,And yet we only hear about the ETH foundation FUD...,1
2023-10-10 06:59:51,Comment,"Perhaps he only cares about himself?

Caring is sharing. Let him demonstrate it with 🍩",2
2023-10-10 06:57:22,Comment,We are Reddit farmers so we also qualify for agricultural subsidies,1
2023-10-10 06:53:09,Comment,BTC and Ethereum ETFs approved,2
2023-10-10 06:09:04,Comment,tldr: a new FUD just hit the market :-),3
2023-10-10 06:08:33,Comment,I'm gonna buy a private island with them and start a new revolutionary community based on Lord of the Flies,3
2023-10-10 06:07:33,Comment,There's always 420 left,5
2023-10-10 06:04:47,Comment,I'm neither selling nor buying. I'm waiting,2
2023-10-10 06:03:52,Comment,"I don't think it's going to affect crypto that much.

Especially since we are in a bearish mode anyway",1
2023-10-10 06:02:15,Comment,"I wouldn't read too much into it. Once they sold the FUD created a dip.

Same when Vitalik transferred some of his ETH to a CEX a while ago",3
2023-10-10 05:48:00,Comment,Because it's a fact. Cannot argue with that. Selling back then and buying back at a much lower price makes a lot of sense,3
2023-10-10 05:46:39,Comment,That's true,2
2023-10-10 05:42:09,Comment,"Selling Moons at $0.50 was the right move after all.

Congrats to all who took their profits",6
2023-10-10 05:39:43,Comment,"Is Ethereum![img](emote|t5_37jgj|32637) going to hold a $1,500 and resist to go lower?",5
2023-10-09 15:20:48,Comment,Remember the Looping? Who still has faith in that project?,3
2023-10-09 15:19:30,Comment,What was the most heavily shilled coin on this sub and where is it now?,5
2023-10-09 13:16:42,Comment,"Yeah, but zkSync ERA is already on mainnet",2
2023-10-09 13:05:40,Comment,Is testnet airdrop hunting just a waste of time?,2
2023-10-09 12:49:31,Comment,"5 transactions within half an hour, not half an hour ago. He made those tx 11 PM-12AM last night  on Uniswap",1
2023-10-09 12:23:54,Comment,"One wallet made 5 consecutive $Donut buy transactions (no sell in between) for $400-500 on the mainnet within half an hour.

I wonder what's his strategy?",2
2023-10-09 12:17:56,Comment,Have you been able to accurately time the market when selling your crypto?,7
2023-10-09 08:43:57,Comment,And I'll share my Ramen with you!,2
2023-10-09 08:42:59,Comment,"And they will be quoted in the future under a ""Reverse Reddit"" section :-D",2
2023-10-09 08:35:40,Comment,"Pokemon, gotta catch 'em all!",1
2023-10-09 08:34:41,Comment,Donut people? Is that a new species? :-),2
2023-10-09 07:02:07,Comment,r/stellarcannacoin,3
2023-10-09 07:00:42,Comment,"The more I have, the more I want. Greed is good :-)",2
2023-10-09 06:59:48,Comment,There's also a Cannacoin,3
2023-10-09 06:57:30,Comment,Starting the day with a cup of coffee and a line of hopium!,2
2023-10-09 06:55:49,Comment,More Donuts for us then.,2
2023-10-09 06:41:49,Comment,Checking charts is my daily ritual. I can't help it :-),3
2023-10-09 06:36:22,Comment,$60k is going to be a new floor. I'm expecting BTC to breach $100k in 2025,2
2023-10-09 06:34:56,Comment,Farming RCPs keeps me positive,3
2023-10-09 06:32:17,Comment,Once there was more than 3 weeks delay,2
2023-10-09 06:31:37,Comment,I'd rather keep my gains alive!,2
2023-10-08 16:35:06,Comment,"Our whole lives are centered around earning money, making money, spending money, and so on and crypto is not an exception",2
2023-10-08 16:32:13,Comment,Instructions confirmed. Proceed to buy a *budget* Lambo,3
2023-10-08 15:20:16,Comment,We will start a Revolution!,2
2023-10-08 13:51:07,Comment,Sure thing. I'd buy it back during the bear market and then wait again for the bull,1
2023-10-08 13:48:14,Comment,Were you farming the testnet?,1
2023-10-08 13:34:53,Comment,Unless Moons pump a little. This will motivate r/cc lazy bones to farm more ;-),1
2023-10-08 13:11:55,Comment,Unless they enter during crypto winter at the bottom of the market and will mostly observe gains in their portfolio until the end of the cycle,2
2023-10-08 13:09:07,Comment,"It's like asking for how long are you going to use money? For the rest of your life. 

And crypto is money, but better.",2
2023-10-08 13:06:37,Comment,Moons price goes down = less comments. Moons price goes up = farming goes up,2
2023-10-08 09:49:28,Comment,When sitting on my porcelain throne in my temple of thought.,2
2023-10-08 09:44:33,Comment,Looks a bit like Michelin Man :-),3
2023-10-08 09:32:59,Comment,I'm not using anything else except for fiat off-ramps,1
2023-10-08 09:31:43,Comment,ETH at $4000 is of better quality than $800 ETH,1
2023-10-08 09:28:07,Comment,What does WAGMI stand for? Only wrong answers,3
2023-10-08 09:16:22,Comment,Yes.,1
2023-10-08 09:15:26,Comment,Diamond hands :-P,2
2023-10-08 09:03:35,Comment,Many normies also know Dogecoin,2
2023-10-08 09:02:43,Comment,You can do calisthenics in front of a laptop ;-),3
2023-10-08 08:59:53,Comment,Let's pray we'll have some mini-pump before the end of the year :-D,3
2023-10-08 08:53:08,Comment, In his youth a telegraph was a cutting-edge technology,2
2023-10-08 08:48:15,Comment,Same but also ![img](emote|t5_37jgj|32651),3
2023-10-08 08:36:06,Comment,other teams sponsored by OKX and ByBit!,2
2023-10-08 08:34:13,Comment,My friend who was an ETH miner,2
2023-10-08 08:31:45,Comment,"Number of crypto owners by country. The US is not #1 and there's only one European country in the top10

[https://twitter.com/BitcoinNewsCom/status/1710649371174342698](https://twitter.com/BitcoinNewsCom/status/1710649371174342698)",5
2023-10-08 08:22:13,Comment,Once you get into crypto there's no way out. You will always be excited by the cycle and would want some more gains :-),2
2023-10-08 08:16:05,Comment,For $1000 I would let them take my dog's paws prints,2
2023-10-08 08:12:36,Comment,I collect all the tokens like Pokemons :-P,1
2023-10-08 08:11:37,Comment,"10k Donuts 🍩 

I have to feed my SNEKS",3
2023-10-08 08:02:12,Comment,serving FUD for breakfast :-P,2
2023-10-08 08:00:19,Comment,About the same as today. A very high ratio was only during the first 6 distros,3
2023-10-08 07:55:40,Comment,"I don't know why people are staking on Coinbase instead of Lido or Rocketpool. 

Even if they don't care about decentralization they must care about APR which is higher on Lido/RP than on Coinabase",1
2023-10-08 02:41:25,Comment,I flirt with many altcoins but I'm not married to any of them,1
2023-10-08 02:39:03,Comment,"Yes, it takes 7 days to move funds via the official Arbitrum bridge.",1
2023-10-08 02:33:06,Comment,Unicorns are fun. Those who played The Wicher 3 know that very well :-P,2
2023-10-08 02:26:14,Comment,"Cardano DeFi ecosystem: 23 dapps

Ethereum Defi: 810 dapps",1
2023-10-08 02:24:53,Comment,"Meanwhile, Cardano TVL $160 million

Ethereum TVL $21 billion",1
2023-10-08 02:18:47,Comment,up to 69 with it!,2
2023-10-08 01:26:16,Comment,What does FUD stand for? Wrong answers only,4
2023-10-08 01:19:39,Comment,What does FUD stand for? Wrong answers only,5
2023-10-07 23:38:02,Comment,More active wallets and more trade volume,2
2023-10-07 23:37:00,Comment,Joe Rogan discusses (and is bullish on) Bitcoin in his latest podcast,4
2023-10-07 23:12:39,Comment,If it was cheap and easy everyone would do it,1
2023-10-07 22:53:39,Comment,"MASQ, because it going to be a capable web3 browser",3
2023-10-07 22:18:12,Comment,* showing off the Moon count on r/cc subreddit,5
2023-10-07 21:01:51,Comment,"zkSync, LayerZero, Starknet, Linea",1
2023-10-07 21:00:41,Comment,That's because Ripple was built around a concept of global financial transfers and the currency exchange,2
2023-10-07 19:48:15,Comment,Just from staking? That would take a lot of ETH. Yield farming is more feasible,1
2023-10-07 19:42:32,Comment,But the karma ratio is better so it evens out,2
2023-10-07 19:16:07,Comment,"""Lex prospicit non respicit""  The law should not have a retroactive effect",2
2023-10-07 19:03:27,Comment,Millions of Donuts or millions of $? :-P,1
2023-10-07 19:02:52,Comment,69 is such a great number though...,1
2023-10-07 19:01:46,Comment,With ETHTrader Donuts you can sell 100% of them without getting karma punish,3
2023-10-07 17:35:18,Comment,"You win some, you loose some",1
2023-10-07 17:25:04,Comment,What's the FUD of the day?,2
2023-10-07 16:52:52,Comment,You don't have to code it. You can subscribe to available grid bots,2
2023-10-07 16:42:59,Comment,"Yeah, those short attention span simps

\**me staring at 15 min. BTC chart*",1
2023-10-07 16:40:27,Comment,It's about crypto degeneracy and donuts,1
2023-10-07 16:29:08,Comment,"I don't know why *you* are doing this. I know why I am doing this.

I like the Bitcoin cycle.",1
2023-10-07 16:17:52,Comment,It's a tower defense game. No need to download it,1
2023-10-07 16:15:40,Comment,Tokenomics: https://docs.pancakeswap.finance/products/pancake-protectors,1
2023-10-07 16:15:20,Comment,Game tokenomics: https://docs.pancakeswap.finance/products/pancake-protectors,2
2023-10-07 16:07:45,Comment,I just found it 2 weeks ago while farming zkSync airdrop,2
2023-10-07 16:01:07,Comment,zkSync ERA,2
2023-10-07 16:00:45,Comment,zkSync. My mistake. Pancake Swap is behind it,2
2023-10-07 15:54:04,Comment,"I've finally found a blockchain game that I enjoy playing: Pancake Protectors on zkSync.

It's a simple tower defense game but so addictive :-)",3
2023-10-07 15:43:30,Comment,I assume that you joined right before the last bullrun and didn't take your profits. You will have your next chance to sell your heavy bags for profit in 2024.25,1
2023-10-07 15:41:06,Comment,I rather invest directly in Bitcoin,3
2023-10-07 15:32:53,Comment,"Stonks, bonds, gold, pokemon cards...",1
2023-10-07 15:32:00,Comment,2 years in crypto is like 10 years in biological terms,2
2023-10-07 15:30:44,Comment,"Donut's 🍩 sitting at ¢16

*Not great, not terrible*",1
2023-10-07 07:29:05,Comment,">My heart

You mean your wallet",1
2023-10-07 07:28:08,Comment,AVAX has given and AVAX has taken,1
2023-10-07 07:26:46,Comment,INJ and MASQ,2
2023-10-07 07:26:14,Comment,"Just one. 

I have to work on becoming more popular",1
2023-10-07 06:25:43,Comment,The magic of Reverse Reddit,1
2023-10-07 06:22:45,Comment,They just can't stand our happiness,5
2023-10-07 06:08:16,Comment,One year in a detention center and he's gonna beg for a cheeseburger,2
2023-10-07 06:02:02,Comment,"> and stay positive

We are human beings not protons, sir",6
2023-10-07 06:00:13,Comment,SBF looks a bit like Ursula from Little Mermaid,2
2023-10-07 05:48:08,Comment,It's that thing that happens when parents are *wrestling*,2
2023-10-07 05:24:55,Comment,Stick to Daily and farm like there so tomorrow :-),2
2023-10-07 05:24:16,Comment,">take some time off to refresh yourself

I had a shower last week :-P",1
2023-10-07 05:17:54,Comment,Gnosis is cheaper and Mainnet has more liquidity,2
2023-10-07 05:16:20,Comment,Donuts have no connection with Vault. Vault is basically an Arbitrum Nova wallet and Donuts resides on Gnosis,3
2023-10-07 05:04:17,Comment,We've already reached the bottom last year at \~ %16k,3
2023-10-07 04:50:32,Comment,"Most of the  ""Ethereum killers""",2
2023-10-07 04:33:15,Comment,Close but no cigar :-),2
2023-10-07 04:32:46,Comment,"Donuts 🍩are up 15% and Moons ![img](emote|t5_37jgj|32635) are down 7.5% in the last 24hrs 

Wen flippening? :-P",7
2023-10-07 03:57:10,Comment,Donuts are **PoF** tokens. Who knows what it stands for?,3
2023-10-07 03:39:00,Comment,So you don't know that Bitcoin just crossed $30k?,0
2023-10-07 03:36:41,Comment,"It's my money, my gains and my losses.",3
2023-10-07 03:22:01,Comment,">What's in between Kraken and Donuts

A sexual tension",4
2023-10-06 23:29:03,Comment,I wouldn't mind MEXC listing either,2
2023-10-06 23:27:34,Comment,I'm a squid. Next round I want to be a turtle,2
2023-10-06 23:03:03,Comment,I bought Waifu for the same reason...,2
2023-10-06 22:26:38,Comment,I deal with them with fiat currency,2
2023-10-06 21:56:29,Comment,"Cramer is a legend

https://twitter.com/ChamathWarriors/status/1710367095496544269/photo/1",2
2023-10-06 21:44:02,Comment,"Timing the market is pretty easy. Once the activity on the Daily drops to a minimum it's time to buy. 

And when it goes to maximum and ppl are posting emojis with a rocket to the moon, it's time to sell :-P",1
2023-10-06 21:41:20,Comment,Your future self is smarter that your present self. Listen to him :-),2
2023-10-06 21:35:34,Comment,Deep dive into zkSync with some info about an airdrop,1
2023-10-06 19:55:13,Comment,...that Ramen ain't that bad,3
2023-10-06 19:52:58,Comment,"> wonder how people comment 50 plus.

I never achieved such a great feat. Perhaps today it's gonna be that day?",3
2023-10-06 19:48:35,Comment,"> i can't figure out whether now is right time to buy or sell moons

Now it's the great time to earn Moons",1
2023-10-06 19:46:42,Comment,Formula 1 was better with Grid Girls,1
2023-10-06 19:40:44,Comment,"You can use Connext bridge.

Btw. I used Orbiter 3 times yesterday to move ETH between mainnet and Layer 2's with no issues",2
2023-10-06 19:38:08,Comment,I snatched some ETH for under $1000 last year too,1
2023-10-06 19:30:15,Comment,"Dunno, he hasn't shown up since we conducted an online business deal :-P",1
2023-10-06 19:28:14,Comment,">someone worse than him

And where are you going to find someone like that? :-P",2
2023-10-06 19:26:02,Comment,I'm going to buy an island and start a Lord of Flies type of society,0
2023-10-06 19:24:01,Comment,There's already a Crab Market microcap token on DexTools :-),2
2023-10-06 19:03:29,Comment,That's because the mass media created that image of the crypto sphere as scammers den,2
2023-10-06 19:00:31,Comment,There's a Bear lurking in the woods,2
2023-10-06 18:57:09,Comment,It doesn't count unless there's an inverse Bart pattern implemented on it,2
2023-10-06 18:54:59,Comment,"The Bear market makes me feel motivated because I know that those who remain and continue investing will get far ahead of those who gave up.

And those who gave up will come back later to pump our bags once the market gets bullish again.",5
