Date,Activity Type,Upvotes,Content
2023-10-29 06:43:38,Comment,1,!myactivity
2023-10-29 06:33:32,Comment,6,What are your top 5 Favourite Alt Coins ??
2023-10-29 02:56:54,Comment,6,"In 2025 People will be saying ""Man I wish I had bought more back in 2023""."
2023-10-28 06:45:16,Comment,6,"Imagine how bonkers the alt market will be,Once ETH finally breaks 2k again."
2023-10-27 12:05:28,Comment,2,Yes it will surely pump.. Donut 🍩🍩
2023-10-27 09:40:02,Comment,1,"Reddit is releasing the contract, Obviously. We go full Donuts 🍩 Baby.."
2023-10-26 22:17:24,Comment,3,I name each of my kid with one word !
2023-10-26 20:56:35,Comment,1,!mykarma
2023-10-26 06:20:07,Comment,2,"In any case, the retail market in 2023 doesn't see Ethereum's potential, just like it didn't see Bitcoin's potential in 2013."
2023-10-26 06:19:30,Comment,1,"The future is all decentralized. The DEXes will steadily replace the CEXes. And in that decentralized future, it will be Ethereum, and ETH, that will be bedrock of the financial system."
2023-10-26 06:18:56,Comment,3,"The regulatory risk for ETH has also passed, with repeated declarations by various US regulatory agencies that ETH is a commodity."
2023-10-26 06:12:47,Comment,1,"ETH has all of the DEXes. If the centralized exchanges ever get restricted, ETH will actually be far more resilient. The largest crypto exchange in the world is now Uniswap, on Ethereum, and the largest trading pairs on Uniswap are pairs that include ETH."
2023-10-24 05:24:16,Comment,7,"News : Hitman $25K in Crypto currency to Kill His Girlfriend
Author: Anthonia Isichei.
After sending $8,000 worth of Crypto to a wrong address, James Wan sent three more Crypto payments valued at $17,200 to murder his girlfriend."
2023-10-23 11:55:52,Comment,2,That's great choice of Crypto.
2023-10-23 11:53:15,Comment,1,That is nice choice 👍👍
2023-10-23 11:47:20,Comment,9,"If you where to buy $1000 worth of Crypto right now, What would you grab??"
2023-10-18 03:43:27,Comment,3,Moon are badly affected
2023-10-18 03:28:58,Comment,2,What happened suddenly to Donut 🍩🍩😭😭
2023-10-17 01:09:14,Comment,4,ETH is recovering ..
2023-10-16 16:29:14,Comment,1,No mistake.. just accumulated.
2023-10-16 16:24:27,Comment,4,What’s the biggest mistake you’ve made in crypto in this bear market ?
2023-10-16 12:06:01,Comment,-1,"Ethereum Gas Fees Hit New Low for 2023 as DeFi, NFT Activity Drops."
2023-10-16 10:22:08,Comment,1,!userstats
2023-10-16 10:21:11,Comment,1,!mykarma
2023-10-16 09:47:31,Comment,1,Ohh it's temporary unavailable.. it will resume after sometime.. now I read the news !!
2023-10-16 09:45:43,Comment,1,What the problem ??
2023-10-16 09:43:17,Comment,1,Can you type both commands now
2023-10-16 09:21:53,Comment,3,Bot not working since last two days..
2023-10-16 09:18:18,Comment,1,If one can sold all his DoNut 🍩🍩 it is not affected his next round DoNut 🍩 Distribution ? Like moon has !
2023-10-16 09:03:50,Comment,1,The Bot are not working well since two days..
2023-10-16 09:00:33,Comment,2,"G20 nations’ finance ministers have accepted the synthesis paper released by IMF-Financial Stability Board, paving the way for globally recognised regulatory framework for cryptocurrencies."
2023-10-16 05:19:41,Comment,3,"Lido Finance Faces Slashing Penalty of More Than $30,000 in Ethereum.
20 validators malfunctioned yesterday meaning the leading liquid staker Lido Finance will face serious penalties in the coming weeks."
2023-10-16 04:19:08,Comment,2,The recent behavior of Ethereum (ETH) on the market and its deflation have gathered the attention of many crypto traders and investors.
2023-10-16 02:37:06,Comment,2,Countdown starts now? BTC crosses key bullish indicator for second time in history.. It will boost Crypto currency Market ..
2023-10-16 02:34:08,Comment,3,Good News for Donut 🍩🍩 to boost.
2023-10-16 01:12:23,Comment,1,A hook that enables Know Your Customer (KYC) verification on Uniswap V4 pools is fueling debates about DeFi's future.
2023-10-15 12:24:07,Comment,1,Now Tesla is also coming with this payment system !!
2023-10-15 12:22:56,Comment,1,I have not sold till now .. even bot is angry ??
2023-10-15 11:59:02,Comment,4,"Why is ETH a good investment?
Ethereum is not just a cryptocurrency. It is also a platform for decentralized applications (dApps) and smart contracts. These applications create utility for ETH, which in turn, increases demand."
2023-10-15 11:55:32,Comment,1,Ha ha ha 🤣🤣 I tomorrow may be working fine
2023-10-15 11:51:05,Comment,-3,Can Ethereum (ETH) price rebound next week?
2023-10-15 11:44:29,Comment,2,"It's not like me, then is he showing yours ?? 😞"
2023-10-15 11:36:41,Comment,2,No estimate and User stats also not available today ?
2023-10-15 11:34:58,Comment,1,!userstats
2023-10-15 11:32:21,Comment,1,!mystats
2023-10-15 11:31:43,Comment,2,Why it shows 000 any idea ?
2023-10-15 11:29:33,Comment,2,You can check on !mykarma
2023-10-15 10:27:39,Comment,1,"ProShares prepares to launch unique Short Ether Strategy ETF
ProShares’ Short Ether Strategy ETF will start trading soon following the approval of the first Ethereum futures ETFs."
2023-10-15 08:02:03,Comment,2,"Standard Chartered Predicts Bright Future for Ethereum.
Even with Ethereum stuck in a web of uncertainty, bullish predictions for the world’s second-largest cryptocurrency keep rolling in."
2023-10-15 07:46:54,Comment,2,"Looking at the 4-hour chart, ETH is trapped in a descending wedge pattern, featuring clear lower highs and lower lows."
2023-10-15 07:42:34,Comment,5,"Ethereum is currently facing a difficult situation, with the token’s price hovering on the edge of a breakdown below the crucial support level at $1,500."
2023-10-15 07:33:33,Comment,3,"A recent report from a top-tier bank has sent ripples of excitement through the crypto community with its bold prediction for Ethereum’s (ETH) growth.

Standard Chartered has suggested a potential surge of over 2,000% could be on the cards for ETH – piquing the attention of investors worldwide.

This bullish sentiment around ETH has also left investors wondering if other tokens, like Bitcoin Minetrix (BTCMTX), might also be poised for sizable gains in the year ahead."
2023-10-15 06:28:22,Comment,1,"Such reasons are why Ethereum scaling solutions have been developed. Although numerous layer 2 solutions have emerged in the past few years, let us examine the two most popular ones – Polygon and Arbitrum. In this article, we will break down the differences between the two from a fundamental perspective."
2023-10-15 06:28:04,Comment,1," Why Ethereum scaling solutions have been developed. Although numerous layer 2 solutions have emerged in the past few years, let us examine the two most popular ones – Polygon and Arbitrum. In this article, we will break down the differences between the two from a fundamental perspective."
2023-10-15 06:20:16,Comment,2,"Ethereum is believed to be the most popular blockchain for Decentralized Finance (DeFi) protocols, dApps (decentralized applications), and Non- Fungible Tokens (NFTs). But historically, the network has suffered from congestion issues, high fees, and relatively slow transaction speeds due to a steady increase in the number of users on the network."
2023-10-15 06:02:11,Comment,4,"Ethereum is under regulatory pressure, whereas Bitcoin is not.."
2023-10-15 03:30:27,Comment,1,That is the reason..
2023-10-15 03:17:04,Comment,1,"Ethereum's New Low-Fee Regime May Put Its 'Ultra Sound Money' Thesis to Test
The Ethereum network's revenue from fees dropped to its lowest level since April 2020 as speculative activity disappeared and users migrated to layer 2s, IntoTheBlock said."
2023-10-14 05:16:55,Comment,2,Can we still trust on Binance ??
2023-10-12 09:14:36,Comment,1,How? Save and spend at same time will be possible ??
2023-10-12 09:13:14,Comment,1,Everyone now needs now low Gas fee  ⛽⛽.. Obviously I am also going with it !!
2023-10-12 09:10:43,Comment,2,This Gonsis Chain has very low Gas fee
2023-10-12 08:25:20,Comment,1,This whales are unpredictable... If they sold in market then Donut fall...
2023-10-12 05:47:50,Comment,2,Ethereum staking protocol Lido Finance has disclosed its protocol saw 20 slashing events due to a series of infrastructure and signer configuration issues from validators operated by Launchnodes.
2023-10-12 05:20:39,Comment,2,It's on Cointelegraph.com
2023-10-12 03:22:47,Comment,6,"'Mr. Bitcoin Is About to Go Down Big’: Jim Cramer Expects Lower Prices
Cramer in 2021 said he sold most of his bitcoin holdings."
2023-10-12 01:17:54,Comment,2,"A Brazilian congress committee alleges Binance moved $791.7 million USD with little regulatory oversight.

It further claims CEO Changpeng ""CZ"" Zhao established multiple companies in Brazil to evade local financial regulations."
2023-10-12 00:55:55,Comment,2,It was published by Analysis.. Crypto currency news my dear friend 🙏
2023-10-12 00:53:08,Comment,3,"The Ultimate List of the Best Crypto Coins to Buy Ahead of the Next Crypto Bull Run
Bitcoin – The crypto behemoth leading the decentralized revolution.

ApeMax – Introducing the pioneering “Boost-to-Earn” mechanism, newcomer ApeMax meshes Web3 dynamism with fun.

Ethereum – The bedrock for DApps and smart contract innovations.

Dogecoin – The meme coin that has transformed into a crypto mainstay.

Solana – Praised for its scalability, quick transaction times, and affordability.

Shiba Inu – Riding the meme coin trend while fleshing out a broader ecosystem.

Cardano – Focused on sustainability, scalability, and transparency in blockchain operations."
2023-10-11 22:19:40,Comment,3,This is wrong information as distribution calander is available you can check..
2023-10-11 21:59:39,Comment,1,!userstatas
2023-10-11 21:59:16,Comment,1,!mystats
2023-10-11 16:30:02,Comment,2,"In this Crypto currency Market no one can predict the future of Crypto.. The SC Bank is worldwide big Bank if they predict, then ETH have Potential.."
2023-10-11 16:07:52,Comment,4,I read it but why I can't swap with XDia.. why eth needed for swap?
2023-10-11 16:06:09,Comment,2,"Good, I will check.."
2023-10-11 16:03:08,Comment,2,"Very nice information but you miss, that after we received Donut on Gnosis Chain.. how to swap or trade ?"
2023-10-11 15:59:42,Comment,2,!userstats
2023-10-11 15:54:38,Comment,1,!userstats
2023-10-11 14:52:21,Comment,1,"Convince me I'm wrong, There's even less adoption and use of crypto today than 6 years ago, we've taken a step backwards.."
2023-10-11 14:44:17,Comment,1,Really.. it's amezing calculation My friend ..
2023-10-11 10:23:44,Comment,3,"It's depends on how many claims, how many Burn and governance score, I think ?"
2023-10-11 10:19:28,Comment,3,Are you talking about round 128 or upcoming 129 round ?
2023-10-11 08:27:43,Comment,1,Very nice Achievement My dear friend 🙏🙏 keep it up and earn Donut 🍩🍩
2023-10-11 08:25:47,Comment,2,!mykarma
2023-10-11 07:13:14,Comment,1,"This whale you can't trust, they can sell in one day and fuck the Donut market.. you can't predict them.. so this news we have to be taken care.."
2023-10-11 06:42:20,Comment,1,Yes that's the spirit.. of Crypto currency.. keep it up and comment..
2023-10-11 06:14:40,Comment,1,!balance
2023-10-11 06:12:33,Comment,1,!mykarma
2023-10-11 06:11:36,Comment,1,!userstats
2023-10-11 06:09:44,Comment,1,If someone can pay for that stupid money more than that then about Rock it is there since Earth exists..
2023-10-11 06:04:36,Comment,1,Lets make celebration with Buy eatable Donut 🍩 by crypto Donut 🍩 right ?
2023-10-11 06:02:32,Comment,2,"The company discloses a restructuring in the wake of its decision to exit services related to MEV-Boost Relay, a type of software used by Ethereum network validators."
2023-10-11 05:45:05,Comment,1,It is better to know who is misusing the Crypto currency
2023-10-11 05:44:05,Comment,2,"How to check governance score I, am first time received some around 367 Donut 🍩 I today.. some 3500 cut for posting post.."
2023-10-11 05:42:44,Comment,1,"Okay, then is there any relationship with governance score with earning Donut 🍩🍩"
2023-10-11 05:36:26,Comment,3,Can I swap all my available Donut or it will give me next round negative impact ?
2023-10-11 05:31:06,Comment,3,Is DoNut 🍩🍩 listed anywhere?
2023-10-11 05:10:33,Comment,2,The general optimism explaining rising open interest could be due to the recent approval of Ethereum Futures exchange-traded funds (ETFs). The United States Securities and Exchange Commission (SEC) approved multiple Ethereum Futures ETFs for the first time.
2023-10-11 04:44:01,Comment,1,"Arkham Data : Wallet “0x9eE457023bB3De16D51A003a247BaEaD7fce313D” swapped over 1,700 ETH for $2.7 million in USDC on Monday, Arkham data shows. The wallet is tagged as a “Grant Provider” on blockchain tracker Etherscan and holds nearly $400,000 worth of tokens as of Monday morning."
2023-10-11 04:02:38,Comment,1,Good comment convert this as post
2023-10-11 03:59:32,Comment,1,This NFTs are not understand by me from beginning.. All youtuber force to invest in NFTs.. but I am with crypto currency..
2023-10-11 03:31:17,Comment,3,"Ethereum continues to showcase stability and innovation. It remains the second-largest cryptocurrency by market cap, and following its Merge, ardent ETH holders believe it can eventually challenge Bitcoin at the top of the rankings.."
2023-10-11 03:29:42,Comment,1,That is there
2023-10-11 03:25:45,Comment,2,They miss to include DoNut 🍩🍩 on the list...
2023-10-11 03:06:01,Comment,1,Each post 250 Donut 🍩 deduction is very much affected for me ..
2023-10-10 20:50:04,Comment,2,"ETH liquid staking nears $20B – but what’s the risk?
Maximize rewards & protect Ethereum with liquid staking."
2023-10-10 20:38:33,Comment,1,!donuts
2023-10-10 20:37:14,Comment,2,5. If you have spare money to invest in Crypto 😀
2023-10-10 13:11:30,Comment,0,"U.S. Dollar ‘Collapse’—Shock $8 Trillion Predicted Fed Inflation Flip To Spark A ‘Critical’ Bitcoin, Ethereum, XRP And Crypto Price Boom To Rival Gold."
2023-10-09 22:41:25,Comment,1,XRP will definitely go pump up.. yes go for it !! 💪💪
2023-10-09 22:40:01,Comment,1,Drop the idea and find a job! 😁😁 And only concentrate on DoNut 🍩🍩🍩
2023-10-09 22:38:24,Comment,1,See my post on this discussion.. you will understand the fact.. But definitely it will break $2K
2023-10-09 22:35:56,Comment,1,"DoNut for sure, it have future"
2023-10-09 22:34:50,Comment,1,Hay buddy wait for some more time. Don't loose your patience ETH will definitely give you return what you are waiting for since long time..
2023-10-09 16:47:22,Comment,3,"3 reasons why Ethereum price can’t break $2K.. 

1)Ethereum price paints bear cycle fractal.
Ethereum’s inability to cross above $2,000 in 2023 resembles the bearish rejection near $425 from 2018 to 2019.
2)Stronger U.S. dollar, Bitcoin
A strengthening United States dollar has dampened demand for Ethereum in recent months, thus reducing its ability to close decisively above $2,000.
3)Ethereum network activity dips.
The total value locked (TVL) across the Ethereum ecosystem has dropped from 18.41 million ETH to 12.79 million ETH so far in 2023. That underscores a reduced availability of funds, resulting in lower yields for investors, as JP Morgan analysts also warned recently."
2023-10-09 14:59:48,Comment,3,Blockchain topic: Gitcoin’s project lead said the snafu has resulted in nearly half a million dollars of funds being locked in a one-way contract address.
2023-10-09 14:57:07,Comment,1,new UK legislation set to take effect.. is this effect is on ETH also ?
2023-10-09 10:23:45,Comment,1,Good to hear this recovery from any exchange.. good going Huobi.
2023-10-06 11:20:39,Comment,1,The rise in ether (ETH) staking since the Merge and Shanghai upgrades has come at a cost to Ethereum as the network has become more centralized and the overall staking yield has fallen
2023-10-06 02:33:40,Comment,2,"#1 BNB

First on our list and what likely won't be a surprise to anyone who has been paying attention it's BNB. BNB flash crashed to $230 after the collapse of FTX and is currently priced around $213. It recently hit a one year low of $204.

#2 Dogecoin (DOGE)

Next on our list is Dogecoin, but only on a technicality. Dogecoin was trading around $.10 before the collapse of FTX due to the hype of Elon Musk buying Twitter. It flash crashed to $.07 and is currently priced at $.061 making the list. Interesting enough Dogecoin is actually up over the last year and the lowest point is Oct. 2022 when Dogecoin was trading $.05X."
2023-10-06 01:58:16,Comment,3,With BTC up almost 90% and Ethereum up almost 50% since the collapse of FTX in Nov. 2022 and resulting flash crash. I wanted to take a look at which popular L1s have hit lower lows in 2023 and are underperforming the greater Crypto Market. Il
2023-10-05 21:43:24,Comment,1,!mykarma
2023-10-05 21:36:15,Comment,2,That's nice.. it's available on Genosis chain only directly right !
2023-10-05 21:35:02,Comment,3,Is there any commands available that can get me all stats get from this month ? About Donut 🍩?
2023-10-05 21:31:52,Comment,1,!userstats
2023-10-05 21:31:29,Comment,3,Oh that's nice to correct me..
2023-10-05 21:29:36,Comment,3,"I am glad that I may be one of them., but don't know when distribution ?"
2023-10-05 21:28:18,Comment,1,!userstat
2023-10-04 05:57:54,Comment,4,"Ethereum futures ETFs garner lukewarm reception on first day of trading
Day one trading volume across all nine products stood at less than $2 million."
2023-10-02 10:24:09,Comment,3,Is xdai available anywhere in exchange?
2023-10-02 03:17:32,Comment,3,This Week in Coins: ETF Hype Pumps Ethereum and Bitcoin as Chainlink and Bitcoin Cash Surge.. let wait for Donut 🍩🍩 to pump more..
2023-10-02 02:24:06,Comment,4,Eth still going on up... keep it up 💪💪💯
