Date,Activity Type,Upvotes,Content
2023-10-22 14:58:48,Post,36,"An Ethereum Whale sold 4,890 ETH with a loss of over $5.24 million"
2023-10-18 12:39:17,Post,11,Today's Story.
2023-10-14 16:14:56,Post,7,The Crypto Cycle
2023-10-13 16:06:11,Post,4,The Two States of Bronuts
2023-10-11 17:50:27,Post,6,Bronuts' Dream
2023-10-07 19:00:45,Post,1,"CBDC Adoption? Nah, We Choose to Laugh Instead!"
2023-10-28 11:48:34,Comment,1,!myactivity
2023-10-28 11:45:48,Comment,1,Does that place have a lot of donuts?
2023-10-28 11:44:54,Comment,1,Never tell them about crypto... You might have to lose it as alimony if you do.
2023-10-28 08:36:27,Comment,1,Government can freeze anyone's money. CBDCs are even worse than fiat.
2023-10-28 08:35:37,Comment,1,Good bot
2023-10-28 08:35:21,Comment,1,And I think there are a lot of them in India...
2023-10-28 08:33:45,Comment,1,"Exactly!

Or maybe in a Ledger intern's yard..."
2023-10-28 08:32:38,Comment,2,Not sure how secure it will be...
2023-10-28 08:25:53,Comment,2,Can't use expressions on PC... ☹️
2023-10-28 08:25:20,Comment,2,Sweet\*
2023-10-28 08:25:02,Comment,4,"Ledger has announced a seed phrase backup service. Users can backup their seeds and recover them if their device gets lost.

PS: I would rather write it on paper."
2023-10-26 06:44:04,Comment,2,Gas fees are low on Gnosis. 0.000227684025810705 xDAI for last distribution.
2023-10-26 06:42:56,Comment,2,You'll see it soon!
2023-10-26 06:42:38,Comment,1,And no mention of increase in salary/benefits.
2023-10-26 06:23:18,Comment,1,Working on it!
2023-10-26 06:22:45,Comment,4,Just attended a meeting at fiat mine! These meetings are a reminder that I need financial independence as soon as possible!
2023-10-26 06:20:02,Comment,3,Where are the bronuts?
2023-10-26 06:19:35,Comment,0,Wen CSV?
2023-10-25 14:22:48,Comment,1,!userstats
2023-10-25 14:22:34,Comment,3,And another person bought 481k
2023-10-25 14:21:48,Comment,1,Wen pump?
2023-10-25 14:21:09,Comment,2,when you start looking for one!
2023-10-25 14:20:28,Comment,1,You don't wanna be a mod?
2023-10-25 14:20:08,Comment,2,and u/pythonskynet
2023-10-25 10:06:28,Comment,2,Good bot
2023-10-25 02:30:04,Comment,3,They have to pay the artists too.. and they want profits as well...
2023-10-25 02:03:52,Comment,3,"Autentica Car Parts has launched a digital marketplace that allows Original Equipment Manufacturers (OEMs) to sell 3D-printable car parts designs to authorized dealers and repair centers.

They believe that ownership of these NFTs would serve as a certification of the produced parts."
2023-10-25 01:43:12,Comment,3,I think they want more income.
2023-10-25 01:35:55,Comment,2,"I don't think they can be used to send mail. Apparently, they are only for digital stamp collecting."
2023-10-25 01:31:27,Comment,4,"German postal service is launching stamps as NFTs on Polygon... Their use would only be stamp collecting...

They would cost 9.90 EUR

(Previously Faroe Islands have also issued NFT stamps)"
2023-10-25 01:29:38,Comment,3,Would love to see how they name their tokens...
2023-10-24 17:18:44,Comment,2,I hope more subs get CPs to divert their attention...
2023-10-24 17:17:34,Comment,1,"Inversed? Went against the advice given by r/cc?

If you want to lose your money again, send it to my wallet 😂   \\s"
2023-10-24 17:15:55,Comment,2,Downvoters migrated here!
2023-10-24 17:14:24,Comment,1,Don't buy memecoins on mainnet again! 😅
2023-10-24 17:10:42,Comment,1,Gas fee is like 20 times this amount?
2023-10-24 17:09:18,Comment,1,I wish I could nominate this!
2023-10-24 17:05:58,Comment,1,"How much PEPEG are you hodling?

PS: I prefer LADYWOJAK over PEPEG"
2023-10-24 17:01:16,Comment,1,"I don't like using Discord but I would check out their server...

PS: Your avatar looks cool!"
2023-10-24 16:59:07,Comment,1,Feel free to message me if you want to ask anything 😅
2023-10-24 16:58:15,Comment,1,People would have said the same about BTC in 2010
2023-10-24 16:57:26,Comment,3,I have set it up in the office... so I'm not paying for the electricity 😅
2023-10-24 16:56:54,Comment,3,Nope. Wanted to confess it....
2023-10-24 16:55:35,Comment,2,I used Nanswap Banano mining pool... See instructions for setting up XMRig [here](https://nanswap.com/mining/banano)
2023-10-24 16:50:04,Comment,3,I set up Banano mining using xmrig at a PC in the office. And got 2.777 Banano today...
2023-10-24 16:32:36,Comment,2,Any hints?
2023-10-24 16:27:06,Comment,2,ETH matters a lot more than Donuts!
2023-10-24 16:25:44,Comment,3,The pump in PEPE is caused by burning of tokens... And it has no use case...
2023-10-24 16:23:31,Comment,2,Would have been better... could have chosen colors like a donut but on a stick!
2023-10-24 16:19:45,Comment,2,Can skin color be changed?
2023-10-24 16:18:52,Comment,2,Or retire right now and let someone else approve ETFs
2023-10-24 16:18:14,Comment,1,Up good
2023-10-24 16:18:01,Comment,2,See [this](https://preview.redd.it/esaxwz33uztb1.png?width=640&crop=smart&auto=webp&s=8103e45e1d411b9e0aa0e6698d91f680e8aecd4e)
2023-10-24 16:14:36,Comment,2,When is Gary retiring?
2023-10-24 16:14:00,Comment,1,Welcome to crypto!
2023-10-24 15:58:49,Comment,2,Bears also have purpose... Bear is the discount season...
2023-10-24 15:56:30,Comment,2,Bear is back?
2023-10-24 15:54:47,Comment,1,Snapshot tomorrow in a few hours...
2023-10-24 15:54:18,Comment,1,No Pumpember?
2023-10-24 15:48:27,Comment,3,5% profit on a stable coin? In 10 minutes?
2023-10-24 15:47:02,Comment,1,More PEPE can be minted?
2023-10-24 15:45:51,Comment,1,"Three new whales together purchased 47,760 ETH in total over the past 24 hours. This amount of Ethereum was worth $82.97 million at the time of the purchases.  
  
See [this](https://u.today/new-eth-whales-grabbing-astonishing-number-of-ethereum-as-price-soars)"
2023-10-24 15:42:17,Comment,2,Have fun and enjoy 🍩
2023-10-24 15:29:33,Comment,2,Welcome!
2023-10-24 15:28:28,Comment,1,It changed from Discountober to Pumptober
2023-10-24 15:27:57,Comment,2,One of us! One of us!
2023-10-24 15:26:50,Comment,3,Reddit caused that!
2023-10-24 15:26:21,Comment,3,">“The strength of a wall is neither greater nor less than the courage of those who defend it.”  
>  
>Genghis Khan

Remember this when CBDCs arrive... Don't give up the wall of decentralization..."
2023-10-24 10:43:17,Comment,5,[mydonuts.online](https://www.mydonuts.online/) is showing karma ratio to be around 16. I guess it's not accurate! 😅
2023-10-24 10:42:06,Comment,2,Siberia should pay them a visit!
2023-10-24 10:41:46,Comment,2,Flippening has already happened. People no longer prefer moons over donuts.
2023-10-24 10:41:39,Comment,2,Flippening has already happened. People no longer prefer moons over donuts.
2023-10-24 10:32:07,Comment,2,Karma ratio?
2023-10-24 10:31:36,Comment,2,You got targetted by downvote gang!
2023-10-24 09:43:47,Comment,3,"You too, bronut!"
2023-10-24 09:04:56,Comment,1,I got 16 as well.
2023-10-24 09:04:40,Comment,1,The pump is still ongoing... It hasn't ended yet...
2023-10-24 09:01:50,Comment,1,Donuts will soon have larger marketcap than Moons
2023-10-24 09:01:20,Comment,1,And baking donuts while doing that!
2023-10-24 09:00:39,Comment,2,Profits? I'm a hodler.
2023-10-24 09:00:15,Comment,2,"Did my part, first thing in the morning."
2023-10-24 08:59:49,Comment,3,That's against traditions.
2023-10-24 08:53:29,Comment,1,Bull run will probably be twenty times better than this.
2023-10-24 08:51:35,Comment,2,We need the donut-moon flippening..
2023-10-24 08:51:12,Comment,0,I hope Pumpember follows.
2023-10-24 08:36:49,Comment,1,Do you have DAI for gas?
2023-10-24 08:34:57,Comment,2,What thoughts?
2023-10-24 08:32:30,Comment,3,Afraid of connecting your wallet?
2023-10-24 08:31:46,Comment,1,Was?
2023-10-24 08:29:00,Comment,1,October was very interesting. Discount season. then sunsetting. then pumping.
2023-10-24 08:27:54,Comment,6,MOOND pumped 14% in last 24 hrs. I feel like it would be rugpulled soon.
2023-10-24 08:23:59,Comment,1,Have you switched to Gnosis network?
2023-10-24 08:18:49,Comment,2,Pumptober started when we were least expecting it... I hope donuts start pumping as well...
2023-10-24 08:15:19,Comment,3,Ecstatic
2023-10-24 07:26:18,Comment,1,Do the polls depend on number of donuts? or number of votes?
2023-10-24 07:25:21,Comment,1,"Will the results depend on number of donuts? or number of votes? If it depends on number of donuts, are donuts on Gnosis accounted?"
2023-10-24 07:07:12,Comment,3,Check by copying your wallet address from the side bar...
2023-10-24 07:04:20,Comment,3,I was a crypto skeptic... and invested only in stocks... sold a percentage of stocks and invested in crypto because of the political conditions....
2023-10-24 06:38:26,Comment,3,May 2023.
2023-10-24 06:37:27,Comment,2,and MoonsDust would apparently do the same as Reddit..
2023-10-24 06:36:14,Comment,2,I prefer to send donuts to hot girls in my DM..
2023-10-24 06:26:29,Comment,3,found out about [moonplace.io](https://moonplace.io).  1 million moons were burnt by selling parts of pixelmap as NFTs.. It would be a great idea to reduce supply of donuts or to raise funds for development.
2023-10-24 06:19:54,Comment,1,I ate a few in the weekend... might get some in the evening...
2023-10-24 06:00:56,Comment,2,Donut days are greater than birthdays....
2023-10-24 05:46:53,Comment,3,![img](emote|t5_37jgj|32639)
2023-10-24 05:46:43,Comment,4,I can smell sweetness in the air!
2023-10-24 05:26:08,Comment,2,Have they shared a plan for future?
2023-10-24 04:22:25,Comment,1,I would be almost flying if it continues for a few more days... And I hope it does...
2023-10-24 04:21:40,Comment,2,It's alright... Happens to a lot of people... 😅
2023-10-24 04:21:16,Comment,2,"If it's a little taste, how would it feel like to have the whole cake?"
2023-10-24 04:09:13,Comment,2,Why is he such a cynic?
2023-10-24 04:08:26,Comment,3,Uptober will end soon! Hope we get a Pumpember as well...
2023-10-24 04:05:47,Comment,3,Good morning bronuts! Is this what bull run feels like?
2023-10-24 04:03:15,Comment,1,"Good morning

Wrong daily."
2023-10-23 18:39:34,Comment,4,Exchange your ETH to BTC... and send that to him as well...             /s
2023-10-23 18:37:28,Comment,2,"NFT News:

* MIBR, a sports brand, has launched an NFT collection for its 20th anniversary. Fans who possess 11 NFTs will receive a personalised shoutout from their favorite MIBR personality, while buyers owning 7 to 10 jerseys will enjoy discounts at the MIBR store and $BRZ bonus from Bybit. Those who collect the entire NFT set will be rewarded with an autographed MIBR jersey.
* Sharjah Digital Office has unveiled 'Sharjah NFT,' a pioneering initiative in the UAE that leverages NFT technology for government and private entities to issue verified digital certificates using soulbound tokens, efficiently storing and tracking documents using blockchain through a QR code."
2023-10-23 18:30:35,Comment,4,He wants your seed to confirm  if everything's okay?
2023-10-23 18:25:53,Comment,2,Or that stash can be burned!
2023-10-23 18:24:36,Comment,2,I wouldn't invest in shitcoins!
2023-10-23 18:23:46,Comment,2,And hopium!
2023-10-23 18:23:20,Comment,2,It'll be $1 in the bull run!
2023-10-23 13:15:40,Comment,2,"But while naming ports, if it has holes it's a female port. If it has pins, it's a male port."
2023-10-23 11:31:52,Comment,1,Fastest and surest!
2023-10-23 11:28:39,Comment,3,Investing in shitcoins
2023-10-23 11:28:10,Comment,1,"My screen is literally black background, white text and orange upvotes..."
2023-10-23 11:26:50,Comment,1,The early worm gets caught?
2023-10-23 11:25:51,Comment,3,Donuts have a hole... I guess that makes them female... Like male/female ports in computers....
2023-10-23 11:24:45,Comment,3,Panic selling
2023-10-23 11:24:29,Comment,2,Are you complaining?
2023-10-23 04:42:55,Comment,2,![gif](emote|free_emotes_pack|give_upvote)
2023-10-23 04:17:35,Comment,2,MOOND is at $0.07 (as per Coingecko)... Should I wait to see how it goes or sell it?
2023-10-23 04:00:22,Comment,1,Soon at $0.02
2023-10-23 03:54:42,Comment,4,There's r/TacoPlanet and r/Poopheadavatars too.
2023-10-23 03:53:30,Comment,1,"Bought SOL at $29 yesterday. Decided that it was a wrong decision and set the sell limit to recover investment. Woke up to find the trade executed.

ETH is looking nice."
2023-10-22 19:53:12,Comment,1,Thanks. I was looking for his posts... But it's a comment in the daily... Thanks for sharing...
2023-10-22 19:42:57,Comment,2,Can't find it.
2023-10-22 19:20:43,Comment,1,Another announcement?
2023-10-22 19:19:43,Comment,2,"$1 in the bull run, $5 if there's a listing"
2023-10-22 18:50:42,Comment,1,Thanks for sharing.
2023-10-22 17:41:11,Comment,8,The subs that apply should get approval after a governance poll.
2023-10-22 17:39:20,Comment,1,Is there any use case for Crypto Punks?
2023-10-22 17:37:40,Comment,3,No announcement from mods regarding insider trading?
2023-10-22 17:32:21,Comment,1,They can't post such news about XMR
2023-10-22 17:29:17,Comment,3,Has the intern been discovered?
2023-10-22 17:17:36,Comment,3,Time in market is better than timing the market.
2023-10-22 17:16:56,Comment,4,Will Cointelegraph post fake news again?
2023-10-22 17:08:06,Comment,0,Can you explain?
2023-10-22 17:05:56,Comment,0,But remember to stay away from centralized ones!
2023-10-22 17:04:40,Comment,2,Flippening started with Reddit's announcement. People prefer donuts over moons. That's the real flippening.
2023-10-22 16:32:46,Comment,1,🍩⬆️🚀
2023-10-22 16:18:57,Comment,1,Wife getting donuts\*... His flair indicates that he doesn't have a wife!
2023-10-22 16:17:09,Comment,2,I'm glad you started using 'she'. 😂
2023-10-22 16:15:02,Comment,2,Bubliks are nicer! I was researching Russian traditional sweets too! 😂
2023-10-22 16:14:05,Comment,2,"Bublik will be their community points?

Mather\*"
2023-10-22 16:12:29,Comment,2,You aren't denying it... I'm worried about your wife...
2023-10-22 16:10:50,Comment,5,Russian version of this sub?
2023-10-22 16:09:58,Comment,2,'it'... You use 'it' for your wife?
2023-10-22 16:04:48,Comment,4,ERC-20 tokens and NFTs are a part of ETH ecosystem?
2023-10-22 16:02:44,Comment,3,I hope you get enough donuts to get a wife!
2023-10-22 16:02:07,Comment,3,Upvoted all of them
2023-10-22 16:01:03,Comment,2,I'm thinking of adding more MATIC to my portfolio... I think it'll be around $50 in the bull run!
2023-10-22 15:56:03,Comment,2,Keep up the good work!
2023-10-22 15:55:44,Comment,2,![gif](emote|free_emotes_pack|give_upvote)
2023-10-22 15:55:39,Comment,1,Wen 6.9k comments?
2023-10-22 15:42:10,Comment,1,The whales want to make it to the news?
2023-10-22 15:39:48,Comment,1,!mykarma
2023-10-22 15:36:39,Comment,1,Yeah
2023-10-22 15:35:10,Comment,2,I received the lowest (16)
2023-10-22 15:18:38,Comment,2,Then Kraken ![img](emote|t5_37jgj|32639)
2023-10-22 15:18:07,Comment,1,He'll regret it later!
2023-10-22 15:13:24,Comment,2,Don't worry! It'll be $1 in the bull run! $5 if it gets a CEX listing.
2023-10-22 15:10:25,Comment,2,"Welcome. 

We were waiting for the flippening for a long time. And the sunsetting initiated it..."
2023-10-22 15:09:22,Comment,2,More bronuts! More fun!
2023-10-22 15:04:57,Comment,0,Probably.
2023-10-22 15:04:45,Comment,1,\[AutoMod\] News
2023-10-22 11:17:52,Comment,1,But that's against traditions...
2023-10-22 11:15:42,Comment,1,I will try to do that. 😂
2023-10-22 11:09:59,Comment,2,Congrats! I hope I get my investment back...
2023-10-22 11:08:26,Comment,1,![gif](emote|free_emotes_pack|give_upvote)
2023-10-22 11:06:51,Comment,1,Good bot
2023-10-22 11:05:27,Comment,6,Added SOL to my portfolio at $29 today... And it has started going down... Always happens to me...
2023-10-22 11:04:17,Comment,2,!userstats
2023-10-22 10:47:22,Comment,2,Congrats. Remember to check [revoke.cash](https://revoke.cash)
2023-10-22 10:46:00,Comment,2,And updoot other comments to beat the downvote gang!
2023-10-22 10:38:28,Comment,1,Always a good time to buy ETH..
2023-10-22 10:37:09,Comment,2,"Web3 Games have poor gaming experience...

Requiring investment to mint tokens isn't good. Game developers should share from their profits..."
2023-10-22 10:36:07,Comment,1,"And to you too, bronut!"
2023-10-22 10:35:25,Comment,1,This was ineviatable.
2023-10-22 10:35:06,Comment,1,"The affected tokens include Ether (ETH), USD Coin (USDC), Wrapped Ether (wETH), Tether (USDT), Dai (DAI), Wrapped Bitcoin (WBTC), Angle Protocol's agEUR, Gemini Dollar (GUSD), Liquidity USD (LUSD), Euro Coin (EUROC) and StraitsX Singapore Dollar (XSGD)."
2023-10-22 10:32:25,Comment,2,"Mastercard, in collaboration with the Reserve Bank of Australia (RBA) and the Digital Finance Cooperative Research Centre, has been working on a CBDC project. As per reports:

>The latest results, unveiled on Thursday, have demonstrated the potential of CBDCs and their interoperability across different blockchain networks."
2023-10-21 19:21:55,Comment,2,"Received chat requests from these two accounts (probably the same guy). 

https://www.reddit.com/u/NSFWCryptoPosting/s/BrrbUqqtzx

Stay safe."
2023-10-21 16:32:48,Comment,1,Wise guy
2023-10-21 16:05:44,Comment,1,"Brick holders don't even know about bricks.

Donut holders have hopium"
2023-10-21 14:45:02,Comment,3,Upvoting harder ![gif](emote|free_emotes_pack|give_upvote)
2023-10-21 14:31:41,Comment,1,Not sure what next 8 days will bring...
2023-10-21 14:29:28,Comment,2,But someone can send images of court orders as NFTs to someone's wallet and make it appear like they were involved in hacking/scamming
2023-10-21 14:17:14,Comment,2,Imagine getting your wallet marked by someone with a legal document without even doing anything...
2023-10-21 14:10:32,Comment,1,"1. Buy
2. HODL
3. Buy
4. HODL
5. Buy
6. HODL

Bronut Cycle"
2023-10-21 14:09:35,Comment,1,Assuming that you don't have to buy air.
2023-10-21 14:08:47,Comment,1,All ETH-killers are doomed to become ETH-killed.
2023-10-21 13:35:03,Comment,3,Governments\*
2023-10-21 13:34:07,Comment,4,u/LivingFondant1419 (an ethtrader mod) was allegedly involved in insider trading and dumped his moons and donuts before the official announcement by Reddit. He has deleted his account...
2023-10-21 13:32:20,Comment,5,"The Singapore High Court has allowed financial investigation firm Intelligent Sanctuary (iSanctuary) to attach nonfungible tokens (NFTs) containing a legal document to cold wallets associated with a hack. The NFTs will not prevent transactions with the wallets but will serve as a warning to counterparties and exchanges that the wallets were involved in a hack.

&#x200B;

Another use case for NFTs..."
2023-10-21 13:17:55,Comment,1,https://moonsdust.com/donut/
2023-10-21 13:04:22,Comment,2,Thanks!
2023-10-21 13:01:19,Comment,1,Thanks! Just checked and they are listed for $5.6 on Opensea...
2023-10-21 13:00:49,Comment,2,Thanks for the tip!
2023-10-21 12:45:09,Comment,2,"Thanks!

PS: Your RCA looks cool! I wish I had one of those! (You wanna sell it for donuts?)"
2023-10-21 12:41:19,Comment,6,Just claimed MOOND (I got 16)... And checked [revoke.cash](https://revoke.cash).... I hope I don't lose my donut stack...
2023-10-21 12:24:47,Comment,1,They are even named after other coins... I hope you get profits...
2023-10-21 12:17:57,Comment,1,More drama. I'm sure about that...
2023-10-21 12:01:51,Comment,2,You can get the address in distribution CSV...
2023-10-21 12:01:01,Comment,1,Thanks ![gif](emote|free_emotes_pack|grin)
2023-10-21 12:00:23,Comment,1,"MEMES is native token of [banter.app](https://banter.app).... It's a reddit alternative but only for memes... and it looks nice... I might be visiting it more...

And JOE is native token on a DEX"
2023-10-21 11:49:51,Comment,3,Do they have any use case?
2023-10-21 11:48:27,Comment,3,He might be waiting for donuts to rise!
2023-10-21 11:44:13,Comment,2,But taking action is difficult if all we know is a username...
2023-10-21 11:43:18,Comment,2,And artists should get 1-5% of secondary sales (like RCAs)
2023-10-21 11:41:17,Comment,2,Would be nice!
2023-10-21 11:38:33,Comment,2,Or ECNFT... Ethtrader Collectible NFTs... 1 NFT with 1000 supply to be sold for 100 donuts each every 3 months... And it should appear in the user's flair...
2023-10-21 11:35:42,Comment,3,Its on Arbitrum Nova... Details are on their main page.
2023-10-21 11:34:27,Comment,3,After deleting their account? I don't think anything would happen...
2023-10-21 11:33:26,Comment,3,Greed ruins a lot of people...
2023-10-21 11:32:44,Comment,2,He still has donuts... He might be dumping soon...
2023-10-21 11:32:00,Comment,8,"Oct 17 - Fake ETF News

Oct 18 - Sunsetting of RCPs

Oct 19 - Insider Trading by CC mods

Oct 20 - BTC and ETH pumping

Oct 21 - Alleged Insider Trading by an ethtrader mod.

New daily... new drama..."
2023-10-21 11:29:25,Comment,4,u/LivingFondant1419
2023-10-21 11:27:39,Comment,4,An ethtrader mod was alleged to be involved in insider trading after Reddit told the mods. He sold his donut and moon stack. We don't have an official announcement yet. He has deleted his account. u/LivingFondant1419
2023-10-21 11:09:49,Comment,1,I would like to join too.
2023-10-21 11:09:29,Comment,2,And staying decentralized\*
2023-10-21 11:00:19,Comment,4,A donut a day keeps losses away?
2023-10-21 10:58:48,Comment,3,Modumpinphobia?
2023-10-21 10:58:01,Comment,2,"And if you decide to check charts, inject hopium by visiting daily before checking them."
2023-10-21 10:56:42,Comment,1,Yeah ig 😅
2023-10-21 10:55:24,Comment,6,I have a new phobia... Phobia of mods selling their stacks... I think this condition deserves a proper name..
2023-10-21 10:53:44,Comment,3,A wise man said patience and hopium are the most important resources for crypto traders...
2023-10-21 10:53:04,Comment,3,![gif](emote|free_emotes_pack|stuck_out_tongue)
2023-10-21 10:49:44,Comment,1,ETH won't get a similar pump? Can we bribe another news agency?
2023-10-21 10:44:11,Comment,1,![gif](emote|free_emotes_pack|give_upvote)
2023-10-21 10:43:30,Comment,2,Will cointelegraph post fake news again?
2023-10-21 10:42:42,Comment,3,I hope you don't find something disturbing after you wake up!
2023-10-21 10:40:51,Comment,2,"Am I the only one who read it as ""goon"""
2023-10-21 10:38:57,Comment,2,Keep up the good work.
2023-10-21 10:38:33,Comment,3,I'm afraid of sleeping... Specially after the Reddit rug pull...
2023-10-21 10:07:30,Comment,1,Will there be an equivalent of Special Membership?
2023-10-21 10:05:51,Comment,2,Buy special membership? But it might get discontinued cuz of Reddit's announcement...
2023-10-21 09:59:37,Comment,2,Estimator is approximating karma to distribution ratio as 1:18.8? Is it accurate?
2023-10-21 09:50:42,Comment,3,XMR?
2023-10-21 09:48:55,Comment,2,Special Memberships are coming to an end... I thinkg they should be available to all...
2023-10-21 09:46:57,Comment,3,All the bronuts?
2023-10-21 09:46:30,Comment,1,And I hope a few other communities also start their own governance tokens... We need more adopters...
2023-10-21 09:45:16,Comment,5,When will flairs and GIFs be available to all?
2023-10-21 09:42:23,Comment,3,And stay away from centralization.
2023-10-21 09:41:17,Comment,3,Sunsetting of RCPs is a loss for crypto... I hope those communities continue with decentralized tokens...
2023-10-21 09:23:00,Comment,2,The account isn't deleted.. Posts and comments are...
2023-10-21 09:20:08,Comment,5,"He could still be here... With a new identity... Maybe one of the new faces...

PS: The posts and comments are deleted... The account isn't..."
2023-10-21 09:16:52,Comment,2,Will there be a Reddit Recap for 2023?
2023-10-21 09:14:57,Comment,4,How are new mods selected. I think the community will require more mods cuz the number of ethtrader members has increased..
2023-10-21 09:14:02,Comment,3,Im a kraken (the term future people use for someone greater than a whale)... Hodl donuts.
2023-10-21 09:13:12,Comment,5,Are the stories about an ethtrader mod involved in insider trading true?
2023-10-20 17:43:31,Comment,2,Thanks! ☺️
2023-10-20 17:21:42,Comment,5,Can you share the link?
2023-10-20 17:20:17,Comment,4,3.6k comments. We can reach 6.9k today...
2023-10-20 17:18:29,Comment,3,I call it 'The Flippening'.
2023-10-20 17:16:13,Comment,2,A lot of them don't even know that they exist.
2023-10-20 17:15:44,Comment,3,Bronut November?
2023-10-20 17:15:26,Comment,3,Uptober started when we least expected it...
2023-10-20 17:13:37,Comment,1,And they are issuing debit cards too...
2023-10-20 17:12:15,Comment,1,See [this](https://babydoge.com/).
2023-10-20 17:11:32,Comment,3,New York Cheesecake Donut
2023-10-20 17:09:25,Comment,3,Berliner? (I didn't see the tip before)
2023-10-20 17:06:50,Comment,3,Decentralized Ownership Network Utility Tokens (DONUT)
2023-10-20 17:04:48,Comment,2,BabyDoge. It is a deflationary token. 5% of every transaction  is burned and goes to donations for dogs (and 5% of every transaction is distributed among token holders). They secured the Guiness record for pet food donations a few months ago. They have their own swap (I think it can be staked too)...
2023-10-20 17:01:19,Comment,2,"I wouldn't recommend adding it to your portfolio cuz it's too much volatile and appears to be declining over time....

(I'm hodling it in hope of recovering my investment)

DYOR"
2023-10-20 16:59:04,Comment,2,Me too.
2023-10-20 16:57:08,Comment,2,Charts in dark mode too?
2023-10-20 16:51:16,Comment,2,I'm banned from the sub... 😂
2023-10-20 16:50:32,Comment,1,My boss said that my eyes aren't normal cuz I use dark theme on everything 😂...
2023-10-20 16:49:47,Comment,3,"Space ID? They provide domains with .bnb, .eth and .arb...."
2023-10-20 16:46:02,Comment,2,Not sure!
2023-10-20 16:45:10,Comment,1,I hope CC mods go decentralized... and a few other subreddits follow trend... (That would divert attentions of downvoters)
2023-10-20 16:38:40,Comment,2,"If Reddit sold, the moons would have been even lower..."
