Date,Activity Type,Upvotes,Content
2023-10-20 16:37:29,Comment,3,Call it cheese cuz it looks like cheese.
2023-10-20 16:36:54,Comment,2,"They are airdropping MOOND for PLUNGER, TACO and POOP holders. And to get airdrop, wallet should be connected. And I fear losing my stack by connecting my wallet...

And MOOND bought the ethtrader banner...."
2023-10-20 16:34:21,Comment,2,I'm glad they didn't do that... Any idea what CC mods would do?
2023-10-20 16:32:12,Comment,3,We are supporting MOOND? Have mods said anything about it?
2023-10-20 16:31:27,Comment,2,And get cursed with every dip?
2023-10-20 16:31:01,Comment,2,Good night!
2023-10-20 16:30:28,Comment,2,"If there's too much demand, users must offer higher tip amounts to try and outbid other users' transactions. A higher tip can make it more likely that your transaction will get into the next block.

PS: I can be your wife if you give me your seed. 😂 /s"
2023-10-20 16:27:51,Comment,2,And dumped as soon as they got the news...
2023-10-20 16:27:37,Comment,2,They should have used some of them... They're too afraid of Gary....
2023-10-20 16:26:30,Comment,2,All the bronuts!
2023-10-20 16:26:04,Comment,1,See [this](https://i.redd.it/bzmcw7y5esd71.jpg)
2023-10-20 15:30:29,Comment,1,Around 3 million (assuming the current price)
2023-10-20 15:27:11,Comment,1,Don't worry. Weekend will start soon.
2023-10-20 15:25:35,Comment,2,Vitalik
2023-10-20 15:19:45,Comment,2,Unnecessary rules mess up people.
2023-10-20 15:18:54,Comment,1,Like getting discounts at the coffee shop for hodling their NFTs?
2023-10-20 15:08:01,Comment,2,XMR is looking nice too....
2023-10-20 15:06:57,Comment,1,You guys are getting sleep?
2023-10-20 15:05:29,Comment,2,"Give me hopium, bronut!"
2023-10-20 15:05:09,Comment,1,2030?
2023-10-20 15:03:59,Comment,5,Returned from fiat mine. BTC charts look nice...
2023-10-20 15:01:20,Comment,3,Wen $1?
2023-10-20 14:59:38,Comment,2,And assets too (like real estate). Imagine getting passive income (as rent) from your share in a tokenized building.
2023-10-20 14:59:10,Comment,2,But the reign of all kings ends at some point.
2023-10-20 14:54:49,Comment,2,$2 with a listing.
2023-10-20 14:54:09,Comment,1,As it should be.
2023-10-20 14:49:01,Comment,1,Predictions about November?
2023-10-20 14:45:48,Comment,2,"I was banned too.. they said I evaded CCIP (the one about penalized distribution for non-hodlers)... I approached them and they muted me...

PS: I didn't do anything wrong."
2023-10-20 14:44:10,Comment,2,ETH or donuts
2023-10-20 14:42:58,Comment,2,Stocks need to exist on blockchain to survive.
2023-10-20 14:41:32,Comment,1,"If people adopt CBDCs, I'll join the XMR gang."
2023-10-20 12:37:23,Comment,3,It makes it more shitty. Imagine getting your wallet with CBDC locked by government.
2023-10-20 12:20:09,Comment,1,And then go to jail for bullying crypto...
2023-10-20 12:19:30,Comment,2,Wen ETH ETF?
2023-10-20 12:12:07,Comment,2,I'm DCAing ETH and XMR.
2023-10-20 03:21:10,Comment,1,Reddit got 40% of moons every distribution. 50 percent went to community. And 10 to mods.
2023-10-20 03:17:19,Comment,1,Moons were also hyped though.
2023-10-20 03:05:15,Comment,2,They got 40% of moons every distribution.
2023-10-20 03:04:38,Comment,1,I hope so too.
2023-10-20 03:02:02,Comment,2,Earth is round to ensure the daily is always active.
2023-10-20 03:01:26,Comment,1,Good night
2023-10-20 02:58:59,Comment,1,People who adopt CBDC will deserve that. Fiat is better than CBDCs.
2023-10-20 02:56:33,Comment,3,Had a dream about Reddit sunsetting avatars. I'm worried.
2023-10-19 11:04:19,Comment,1,He would like to hodl them too... 😅
2023-10-19 07:06:20,Comment,2,I like to hodl the sweet round baked item...
2023-10-19 07:05:24,Comment,2,">Greed is a bottomless pit which exhausts the person in an endless effort to satisfy the need without ever reaching satisfaction.  
>  
>Erich Fromm."
2023-10-19 07:00:42,Comment,2,It's collective efforts. A few bad eggs ruin the batch...
2023-10-19 06:59:57,Comment,4,Bronut is cool!
2023-10-19 06:59:36,Comment,2,Flippening started yesterday with Reddit announcement....
2023-10-19 05:47:45,Comment,2,Yeah. 😅. And they'll continue to rise...
2023-10-19 05:43:02,Comment,1,"Price of moon is at left side of graph.  
  
The graph compares recovery after the announcement."
2023-10-19 05:42:33,Comment,2,Price of moon is at left side of graph.
2023-10-19 05:38:54,Comment,1,I have XMR in my portfolio too....
2023-10-19 05:35:14,Comment,2,Price. 0.0086 can't be marketcap 😅
2023-10-19 05:32:30,Comment,2,Donuts have surpassed moons\*
2023-10-19 05:31:44,Comment,2,Financial Independence.
2023-10-19 05:30:49,Comment,5,Day 2 of Flippening. See chart [here](https://i.redd.it/lnxdmzmlh3vb1.png).
2023-10-19 03:24:14,Comment,2,"Governance score is lower of number of donuts and contribution score. Contribution score can't be sold. If you have 5k donuts and 10k contribution score, governance score will be 5k."
2023-10-19 03:22:24,Comment,1,Happy cake day.
2023-10-18 14:54:28,Comment,1,But isn't that useless? Cuz there would be no special memberships after November... and gas fees are higher on mainnet?
2023-10-18 14:47:47,Comment,2,You bought them on Mainnet?
2023-10-18 13:58:15,Comment,1,It's alright. ![img](emote|t5_37jgj|32639)
2023-10-18 13:56:10,Comment,2,My contribution scores aren't there...
2023-10-18 13:55:20,Comment,1,LOL
2023-10-18 13:45:14,Comment,2,Yeah. We will.
2023-10-18 13:44:27,Comment,2,Governance scores haven't been updated on Donut Dashboard. Any idea when they'll be updated?
2023-10-18 13:27:36,Comment,1,"Yeah, flippening has started already."
2023-10-18 13:26:53,Comment,2,Our friend\*
2023-10-18 13:23:40,Comment,3,Which guy?
2023-10-18 13:22:49,Comment,2,"Yeah. You're right about that. I hope PLUNGER, TACO and POOP find success as well..."
2023-10-18 13:22:07,Comment,2,Are there any alternative platforms?
2023-10-18 13:21:21,Comment,2,Try Dark mode... Dark mode makes it even better.
2023-10-18 13:20:50,Comment,2,Thanks u/FattestLion
2023-10-18 13:19:43,Comment,2,Flippening has commenced.
2023-10-18 13:18:29,Comment,2,And the Nigerian prince?
2023-10-18 13:17:53,Comment,6,"Moons might get resurrected... (They should call it cheese though cause it looks like cheese).

Bricks are doomed..."
2023-10-18 13:16:58,Comment,5,Cones performed better than Donut though...
2023-10-18 13:16:37,Comment,3,"And if in any doubt, get a hopium injection from r/ethtrader"
2023-10-18 13:11:59,Comment,3,Soon you'll be 420.
2023-10-18 13:11:23,Comment,2,Reddit was designed for PCs... I don't like mobile app...
2023-10-18 13:10:20,Comment,1,We will.
2023-10-18 13:09:57,Comment,2,"They'll be spamming daily with ""I didn't get my donuts"""
2023-10-18 13:08:52,Comment,2,Kraken will be soon enough... We can't be rugpulled by Reddit...
2023-10-18 13:07:08,Comment,3,yeah. I know.... it's my 2nd distro. I spent the first one on RCAs... so I didn't have much losses...
2023-10-18 13:06:02,Comment,2,Crypto made us old. 😂
2023-10-18 13:03:51,Comment,1,Would love to add GIFs and memes as comments...
2023-10-18 13:03:06,Comment,2,And donuts will start pumping in a few hours.
2023-10-18 13:02:39,Comment,1,"I woke up, saw Reddit and told my fiat mine manager that I won't be able to make it today. Spent the day getting hopium injected by bronuts..."
2023-10-18 13:01:31,Comment,0,"Media, Comedy are penalized. They get less donuts."
2023-10-18 12:59:46,Comment,4,Snapshot will be next week. Time passes so quickly.
2023-10-18 12:58:19,Comment,2,We can bribe them 😅
2023-10-18 12:57:05,Comment,2,Bronuts launching donuts to the space.
2023-10-18 12:53:02,Comment,2,The purpose of life is to choose a dream and to follow it to the end...
2023-10-18 12:51:09,Comment,1,You forgot to mention changing the rewards system.
2023-10-18 12:50:40,Comment,1,Donut isn't controlled by Reddit.
2023-10-18 12:47:59,Comment,2,That's not gonna stop me from dreaming again though...
2023-10-18 12:47:32,Comment,1,"On the bright side, we might be listed by Kraken ![img](emote|t5_37jgj|32633) soon"
2023-10-18 12:39:47,Comment,1,\[AutoMod\] Comedy
2023-10-18 12:24:55,Comment,3,Donut Flippening Day.
2023-10-18 12:24:30,Comment,2,Welcome to Bronut Family.
2023-10-18 12:24:08,Comment,2,And you can tip the posts you like to make up for what they paid.
2023-10-18 11:10:32,Comment,1,And then soon at $1.
2023-10-18 11:09:18,Comment,2,Even less than 1.
2023-10-18 11:08:12,Comment,2,And they emphasized the word BETA
2023-10-18 11:07:53,Comment,1,Maybe they'll be too afraid to trust any token again?
2023-10-18 11:06:05,Comment,2,I had 66 only. converted them to ETH.
2023-10-18 10:48:56,Comment,2,Whales can afford to lose. I can't...
2023-10-18 10:48:10,Comment,1,We should request Coinmarketcap to remove DONUTs from Reddit coin category...
2023-10-18 10:44:01,Comment,1,"Because Mars is farther away.

    Because no moon left?


I think moons would continue to exist... but in a very different manner..."
2023-10-18 10:42:22,Comment,2,Who would say 'no' to free crypto?
2023-10-18 10:01:12,Comment,1,They should have used Monero.
2023-10-18 09:58:45,Comment,1,Donuts are decentralized.
2023-10-18 09:58:19,Comment,1,They depended on others so they suffered... Hope they learn the lesson... r/Cryptocurrency mods said that they'll be trying to adopt a model like ethtrader.
2023-10-18 09:54:44,Comment,3,"Maybe they can create a new token, snapshot the holders and airdrop the new token to their wallets and keep going like r/ethtrader...

I hope some other communities adopt this system as well. It would be fun to see this in subs like r/todayilearned r/askscience and subs dedicated to various aspects of life..."
2023-10-18 09:51:21,Comment,1,Try to diversify your portfolio to minimize risks...
2023-10-18 09:48:45,Comment,1,And there's Pay 2 Post. You pay 250 donuts for each post.
2023-10-18 09:47:59,Comment,2,Road to $1. 1 cent is the first milestone.
2023-10-18 09:47:13,Comment,2,Inject hopium. Leave all other intoxicants...
2023-10-18 09:46:19,Comment,3,uphill and then taking off for Mars.
2023-10-18 09:45:30,Comment,2,We'll be recovering from this in a few weeks...
2023-10-18 09:44:55,Comment,2,There will be a lot of those who won't read P2P comment.. and go on posting...
2023-10-18 09:40:27,Comment,1,Don't worry. You'll be rich again tomorrow.
2023-10-18 09:31:33,Comment,5,"Donuts will be alright, I guess..."
2023-10-18 07:56:25,Comment,1,The activity in their subreddit is normal unlike CC.
2023-10-18 06:40:02,Comment,1,But it looks like Twitter.
2023-10-18 03:21:57,Comment,1,Reddit earns fees from each avatar transaction. I think they'll stay.
2023-10-18 03:20:24,Comment,2,I have exactly 66 left 😂. I'll be hodling them.
2023-10-18 03:17:06,Comment,3,I'm glad I spent my moons to buy avatars and I feel sorry for moon hodlers.
2023-10-18 03:16:07,Comment,2,2050?
2023-10-18 03:15:31,Comment,1,There'll be a lot of them soon...
2023-10-18 03:14:55,Comment,2,"When donut reaches $1 in 2030, I will have my own home."
2023-10-18 03:14:18,Comment,1,That was only a few hours ago.. Feels like a long time...
2023-10-18 03:13:36,Comment,1,I wanted every subreddit (above a certain limit of  members) to have their own token.
2023-10-18 02:56:16,Comment,1,Wrong daily.
2023-10-18 02:00:09,Comment,1,Crypto keeping your life fun.
2023-10-18 01:59:01,Comment,3,But mods depend on Reddit for premium memberships and other stuff.
2023-10-18 01:58:24,Comment,2,Sad* Reddit stopped supporting RCPs
2023-10-18 01:57:59,Comment,3,Moons are falling faster than donuts. Flippening will happen soon.
2023-10-18 01:56:54,Comment,2,"Donuts will move towards complete decentralization, right?"
2023-10-18 01:41:59,Comment,2,Mods are currently contacting Reddit regarding this... They'll figure something out...
2023-10-18 01:32:53,Comment,1,Just woke up and read this. This is a bad day ☹️
2023-10-17 08:41:03,Comment,3,They want wallets to connect to their page claiming it to be an airdrop... looks shady...
2023-10-17 08:26:45,Comment,1,A true bronut.
2023-10-17 08:26:14,Comment,2,Thanks for keeping the sub spam free.
2023-10-17 08:25:40,Comment,1,There is a recent post about MOOND mining. Advertisements like these should only be allowed after being scrutinized by mods and payment in form of donuts (to be burned).
2023-10-17 08:23:12,Comment,2,Are ads allowed in the sub?
2023-10-17 02:43:59,Comment,2,SEC's public relations office.
2023-10-17 02:43:22,Comment,1,A fake news would soon be followed by the real news. So it's alright to wish for this.
2023-10-17 00:55:01,Comment,3,Wen fake news about ETH ETF?
2023-10-16 18:59:54,Comment,1,Sounds good...
2023-10-16 18:55:25,Comment,2,There should be a name for this phobia
2023-10-16 18:51:51,Comment,2,Yeah. I have a phobia. I fear connecting my wallet to websites.
2023-10-16 18:35:40,Comment,1,2000 donuts
2023-10-16 18:28:40,Comment,2,Happy cake day.
2023-10-16 18:20:59,Comment,1,What if Gary is behind the fake news?
2023-10-16 18:18:24,Comment,3,Expected karma ratio?
2023-10-16 18:17:50,Comment,1,Let's bribe Kraken officials?
2023-10-16 18:15:01,Comment,1,"If they ask about crypto, say ""I don't know. I'm not a Nazi spy"""
2023-10-16 18:13:24,Comment,1,I heard they are doing something to animate the avatars... Maybe that'll bring back life to it?
2023-10-16 18:11:44,Comment,2,Did you lose your BTC at ATH or before that or after that?
2023-10-16 18:09:18,Comment,3,They can't write such articles about Monero whales...
2023-10-16 18:08:44,Comment,2,"Don't worry, he's a bronut.."
2023-10-16 18:08:00,Comment,1,I'm glad you checked your address before sending...
2023-10-16 18:07:07,Comment,1,Will there be a competitor subreddit mantatraders?
2023-10-16 18:06:15,Comment,2,we know what will happen to it... It'll become ETH-killed.
2023-10-16 18:01:33,Comment,4,Another ETH killer?
2023-10-16 18:00:58,Comment,1,I had donuts yesterday... I would buy some tomorrow... Thank anyway...
2023-10-16 17:58:52,Comment,2,Maybe... I hope ETF gets approved... We'll see then.. 😅
2023-10-16 17:57:25,Comment,2,"""may"""
2023-10-16 17:55:34,Comment,2,People would be busy taking profits if the news was real...
2023-10-16 17:53:52,Comment,1,Bronuts are making fun of the fake news... We would not have the same amount of activity if news was real...
2023-10-16 17:51:32,Comment,1,There's an airdrop for holders of PLUNGER and TACON tokens... and they posted in ethtrader to give MOOND (MoonsDust) tokens to top 100 donut holders... And the airdrop page want to connect the wallet...
2023-10-16 17:49:38,Comment,1,"They'll make it to headline after 20 years... ""A dormant whale starts moving BTC"""
2023-10-16 17:47:37,Comment,1,I had TACO and PLUNGER... so I qualified for the airdrop... but bronuts advised me to be careful and stay away from Moon Dust... I'd recommend the same to you...
2023-10-16 17:45:04,Comment,2,A lot of people would die of cardiac arrests 😂
2023-10-16 17:44:26,Comment,2,Hopium?
2023-10-16 17:44:13,Comment,2,Yeah ig.
2023-10-16 17:43:26,Comment,1,The whale has a lot of money. The whale doesn't care.
2023-10-16 17:42:29,Comment,2,How much time would the criminal (if found guilty) be serving in prison?
2023-10-16 17:41:40,Comment,2,Wen ETH ETF approval?
2023-10-16 17:40:21,Comment,2,Someone at Cointelegraph reported falsely that BTC ETF was approved. This caused BTC to pump. The news was discovered to be false. Immediately dip followed.
2023-10-16 17:37:08,Comment,1,I wonder how next few weeks will turn out...
2023-10-16 17:35:11,Comment,2,And I think this qualifies as 'fishy'...
2023-10-16 17:34:37,Comment,1,A trial against Cointelegraph?
2023-10-16 17:33:23,Comment,2,Is market manipulation by fake news a punishable offense?
2023-10-16 17:31:27,Comment,3,It started when we least expected it..
2023-10-16 17:30:45,Comment,2,"Don't share your seed with the person you're dating?

And don't disclose the amount of crypto you've. (You might have to give it up as alimony)"
2023-10-16 17:29:51,Comment,2,Buy 1 billion LADYWOJAK and tell her you're a billionaire.
2023-10-16 17:28:22,Comment,2,Were they caught?
2023-10-16 16:17:09,Comment,1,I am asking for advice... before deciding...
2023-10-16 16:14:57,Comment,2,Don't give up your keys even if they send you there....
2023-10-16 16:12:23,Comment,0,Will BTC have a similar trend when ETF is actually approved? Should I add BTC to my portfolio?
2023-10-16 16:11:21,Comment,2,"News for what's going on in crypto world? 

And hopium..."
2023-10-16 16:08:32,Comment,2,Just returned from fiat mine and found out that I missed it...
2023-10-16 16:07:11,Comment,1,We don't sell when it pumps... We buy high and sell low...
2023-10-16 15:55:51,Comment,1,Gonna stay away from all government issued tokens...
2023-10-16 15:49:56,Comment,1,You forgot to mention RCAs
2023-10-16 15:48:17,Comment,2,I see nothing wrong with following ethtrader traditions!
2023-10-16 04:49:58,Comment,1,Thanks!
2023-10-16 04:41:34,Comment,2,I completed the Endangered Animal RCA set yesterday.
2023-10-16 04:31:39,Comment,1,Thanks for helping me make up my mind.
2023-10-16 04:31:19,Comment,2,Thanks for the advice. I'll stay away from it...
2023-10-16 04:28:36,Comment,2,I'm having conflicted thoughts about it... I don't want to regret later... I saw Coingecko and it looks like failed projects...
2023-10-16 04:24:30,Comment,3,MoonsDust (MOOND) is being airdropped to TACO and PLUNGER holders. They posted in this sub to give MOOND to top 100 donut holders. I'm having second thoughts about connecting my wallet to their site... Advice would be appreciated...
2023-10-15 16:14:32,Comment,2,They can't write such articles about XMR whales 😂
2023-10-15 16:03:05,Comment,2,"Remember to pass down your seed phrase...

Your generation is lucky to have you..."
2023-10-15 15:59:24,Comment,2,Discountober?
2023-10-15 15:59:02,Comment,1,In top 10 ig.
2023-10-15 15:58:01,Comment,2,What would you do with money?
2023-10-15 15:10:34,Comment,2,My goal is to have 20k Donuts and join the governance team...
2023-10-15 15:08:09,Comment,5,Do you guys have stable coins in your portfolio? Which ones do you prefer?
2023-10-15 15:06:37,Comment,1,PI is $35 right now...
2023-10-15 15:03:51,Comment,2,You'll have what you want in the next bull run!
2023-10-15 15:02:05,Comment,1,And hopium injections are necessary for patience.
2023-10-15 15:01:42,Comment,2,Try to have fun... Don't stress yourself...
2023-10-15 15:00:57,Comment,1,I was expecting adoption of a site-wide token... I was disappointed by the new rewards system...
2023-10-15 14:59:03,Comment,1,"The faster it rises, the faster it dips.."
2023-10-15 14:58:15,Comment,3,We would have more members if premium membership could be bought on Gnosis chain...
2023-10-15 14:41:31,Comment,2,We believe in decentralization. We can have decentralized riots...
2023-10-15 14:40:26,Comment,1,Quickswap uses NFTs for liquidity positions...
2023-10-15 14:37:38,Comment,1,I'm not buying that... Losses have taught me not to trust the shitcoins...
2023-10-15 14:29:07,Comment,1,I watched Mirzapur. Is that how real Indian politicians behave? (assuming that you're an Indian)
2023-10-15 14:24:51,Comment,1,"US Government is responsible for terrorism in Middle East and death of innocents in Libya, Iraq, Afghanistan, Syria and the list continues... USD is the most used currency to finance terrorism."
2023-10-15 14:18:32,Comment,0,Fiatmares
2023-10-15 14:00:19,Comment,2,Maybe...
2023-10-15 13:58:52,Comment,4,I tipped someone 2 days ago.. and my wallet address showed up (instead of username)... Is it a normal problem?
2023-10-15 13:56:44,Comment,1,Is there a background story?
2023-10-15 13:56:01,Comment,1,Asians and Aussies will soon be sleeping...
2023-10-15 13:53:11,Comment,2,"Wen donut?

PS: No Tether?"
2023-10-15 13:52:24,Comment,2,How much ETH qualifies a person to be called an ETH whale?
2023-10-15 13:51:52,Comment,2,Better start working on that right now!
2023-10-15 13:50:51,Comment,3,It's only 2.6k right now...
2023-10-15 12:51:20,Comment,1,Yeah. That sounds better.
2023-10-15 12:44:48,Comment,2,Gen 5 will be animated?
2023-10-15 12:40:41,Comment,1,Hmmm. I'll be more careful in future...
2023-10-15 12:39:16,Comment,2,I assumed 120 million circulating supply. Coinmarketcap doesn't show max limit...
2023-10-15 12:35:10,Comment,2,username doesn't check out... it should be donutpicnic....
2023-10-15 12:34:08,Comment,4,"Each donut will be $8.3 (with current supply) if market cap reaches 1 billion dollars...

Edit: It'll be $5 as per u/eonesimoszsss calculations. There was an error in mine 😅"
2023-10-15 12:31:33,Comment,2,Thanks...
2023-10-15 12:29:04,Comment,3,I had my best comment score yesterday (69).... Hoping to achieve it today as well..
2023-10-15 12:27:42,Comment,1,How many baskets do you have?
2023-10-15 12:11:50,Comment,1,It was a pleasure trading with you. ![gif](emote|free_emotes_pack|grin)
2023-10-15 11:34:59,Comment,1,Halving?
2023-10-15 11:34:15,Comment,2,I have received the Hog Nosed Bat... Have you received donuts?
2023-10-15 11:32:55,Comment,2,"I understand the 'near snapshot' part... but if snapshot happened today, the estimate would be close to actual?"
2023-10-15 11:29:47,Comment,2,And it's very difficult to reach 1000 comments for a lazy person like me😅... Is the estimate okay for less than 1000 comments?
2023-10-15 11:26:37,Comment,4,How accurate is mydonut donut distribution estimate?
2023-10-15 11:22:53,Comment,1,It's alright.
2023-10-15 11:21:36,Comment,1,Sent you 5 donuts. See on [blockchain](https://gnosisscan.io/tx/0x999def178acfa3bb2e82160f1b8f9fd1e2c8c7591c2ccafc2d28486761442d8b).
2023-10-15 11:16:24,Comment,2,You can see it in your vault...
2023-10-15 11:14:31,Comment,2,I'm trying to reach the 20k governance limit...
2023-10-15 11:14:04,Comment,2,I hope jobs4donuts has more activity...
2023-10-15 11:12:19,Comment,3,I hope you re-earn more than 250 donuts as tips...
2023-10-15 11:11:20,Comment,2,"I hope you fulfill your dream..

Would you like to sell Hog Nosed Bat avatar for 5 donuts? (i'm trying to complete Endangered Animals set)"
2023-10-15 11:07:28,Comment,2,Free from what?
2023-10-15 11:04:21,Comment,1,Never take risks that'll take your roof...
2023-10-15 11:03:29,Comment,3,There's a 250 donut fee for posting... (if you don't know)
2023-10-15 11:02:33,Comment,1,The coin with a strange name hot girl in my DM is selling...
2023-10-15 11:00:56,Comment,2,Bronuts keep each other sane during the crab season...
2023-10-15 11:00:26,Comment,2,I had 69 comments yesterday.. I'll try to do it again today..
2023-10-15 10:59:36,Comment,2,No thanks... I'll stick to buy high and sell low policy...
2023-10-15 10:59:00,Comment,2,Daily dose of hopium!
2023-10-15 10:58:19,Comment,1,Try gnosis faucet?
2023-10-15 10:57:20,Comment,1,Trump inspired MEGA?
2023-10-15 10:42:30,Comment,2,I was trying to mine fiat in the morning... and saw the notifications a few minutes ago 😅
2023-10-15 10:12:15,Comment,2,Nice and sweet\*
2023-10-15 10:11:46,Comment,1,Exactly... And that means next bull run will start soon...
2023-10-15 10:11:09,Comment,2,"1. The bot has a system to store tips for each user outside the block chain.
2. Users can tip each other by commenting under a post or replying to a comment.
3. Users can withdraw the tips whenever they want.

PS: Coding and how it works isn't my expertise.."
2023-10-15 10:07:44,Comment,1,Dreams come true... Profits would make a lot of dreams come true...
2023-10-15 10:07:11,Comment,2,Rare? Every bronut has a lot of it...
2023-10-15 10:06:19,Comment,1,What were you expecting?
2023-10-15 10:06:07,Comment,2,Not as cool as Reddit Collectible Avatars..
2023-10-15 10:05:50,Comment,2,"They're nice... Any idea what ""unique rewards within xHamster ecosystem"" means?"
2023-10-14 18:01:15,Comment,2,Opensea link for that NFT?
2023-10-14 17:59:25,Comment,1,r/ETHCrusader
2023-10-14 17:54:18,Comment,1,I'm glad I don't have to drive while going and returning from the fiat mine.
2023-10-14 17:52:34,Comment,1,"When we become spacefarers, we'll be paying gas fees to pay for spaceship gas..."
2023-10-14 17:50:46,Comment,3,Hopium addict found 😂😂
2023-10-14 17:44:53,Comment,1,"Another day, another shitcoin."
2023-10-14 17:39:49,Comment,3,You guys are getting sleep?
2023-10-14 17:33:49,Comment,8,China lifts ban on crypto.
2023-10-14 17:27:15,Comment,5,Donuts will be $6.9 when that happens.
2023-10-14 17:26:02,Comment,3,Good bot
2023-10-14 17:25:49,Comment,1,I heard she had some private writings. I hope they get published...
2023-10-14 17:23:30,Comment,1,Hodling is better than selling.
2023-10-14 17:21:24,Comment,1,PS: Thanks for the tip.
2023-10-14 17:20:56,Comment,1,That's the third step actually. You should buy crypto during the dip 😅
2023-10-14 16:51:02,Comment,1,But having a private jet would be even better 😂
2023-10-14 16:50:02,Comment,1,Thanks u/Buzzalu
2023-10-14 16:49:22,Comment,1,You can find it in the next bull run (circa 2024)
2023-10-14 16:44:12,Comment,1,That's me after returning from fiat mine...
2023-10-14 16:42:42,Comment,2,Check the charts?
2023-10-14 16:42:04,Comment,3,Cuz the bronuts say so!
2023-10-14 16:41:43,Comment,1,"The more they promote CBDCs, the more XMR I buy..."
2023-10-14 16:38:19,Comment,1,Then you should meet them in their beds. 😅
2023-10-14 16:37:24,Comment,1,And looking at charts once or twice every hour.
2023-10-14 16:36:53,Comment,2,>~~We~~ Our drivers will be driving our lambos by then
2023-10-14 16:29:10,Comment,2,"Good luck to you too...

PS: Donuts will be $1 in 2030."
2023-10-14 16:28:14,Comment,1,You're taking profits? That's against traditions...
2023-10-14 16:25:39,Comment,2,Don't worry.. We'll be rich soon...
2023-10-14 16:24:40,Comment,2,Unless their time comes...
2023-10-14 16:23:33,Comment,2,I regret not buying BTC a few years ago... 😂😂😂
2023-10-14 16:22:02,Comment,2,Do you regret any of your decisions? (related to crypto)
2023-10-14 16:19:52,Comment,2,What can regret achieve?
2023-10-14 16:16:23,Comment,1,\[AutoMod\] Comedy
