Date,Activity Type,Upvotes,Content
2023-10-14 15:54:54,Comment,2,But it has been profitable in the long run... cuz I learned something... 😂
2023-10-14 15:50:46,Comment,2,Wen donut?
2023-10-14 15:49:23,Comment,1,Have it colored pink with donut stickers on it...
2023-10-14 15:47:01,Comment,3,Are you using mobile app?
2023-10-14 15:45:43,Comment,2,I invested in PEPE and got 25% loss... and learnt to stay away from shitcoins.
2023-10-14 15:43:23,Comment,3,That's the way.
2023-10-14 15:42:52,Comment,2,Bronuts: First time?
2023-10-14 15:42:24,Comment,2,Stocks weren't giving me the profits I wished for... So I shifted some of it to crypto... Explored a few currencies... and settled for ETH and XMR...
2023-10-14 15:36:30,Comment,1,Source?
2023-10-14 15:34:26,Comment,1,Try mentioning the username next time... They deleted their comment...
2023-10-14 15:32:16,Comment,2,And keep us sane during the crab season.
2023-10-14 15:31:46,Comment,2,One of us! One of us!
2023-10-14 15:28:58,Comment,7,Upvote harder.
2023-10-14 14:25:27,Comment,2,See [this](https://www.reddit.com/r/avatartrading/comments/zrfp7u/how_to_trade_avatars_a_guide/). Feel free to message me if you have any problem.
2023-10-14 14:05:28,Comment,2,Use Opensea (if you're out of free transfers)...
2023-10-14 13:04:37,Comment,2,That would incentivize hodlers... but there would be more work for mods...
2023-10-14 12:31:59,Comment,1,More dips and more pumps?
2023-10-14 12:09:36,Comment,2,A tipping bot like the one in r/ConeHeads?
2023-10-14 12:06:11,Comment,3,My best score is 54... I'll try to do 69 today...
2023-10-14 12:03:37,Comment,2,But they'll be too late... We'll be the ones benefitting from parabolic donuts.
2023-10-14 12:02:25,Comment,3,Spending the day scrolling Reddit...
2023-10-14 12:01:48,Comment,1,Nope. CONTRIB tokens were distributed 21 hrs ago... still not updated on the dashboard.
2023-10-14 11:58:15,Comment,2,When will governance scores be updated on Donut Dashboard?
2023-10-14 11:55:58,Comment,3,People will be busy with profits during the bull run...
2023-10-14 11:55:15,Comment,1,"Ok. I'm trusting you bronut... 

And we all agree that ETH is better than both..."
2023-10-14 11:50:22,Comment,2,And they want your seed too?
2023-10-14 11:49:24,Comment,1,Source?
2023-10-14 11:48:43,Comment,3,RCAs?
2023-10-14 11:48:07,Comment,1,There's wrapped Monero on Ethereum mainnet? Does it exist on any sidechain?
2023-10-14 11:45:02,Comment,1,Kraken ![img](emote|t5_37jgj|32639)
2023-10-14 10:29:28,Comment,3,Crypto for the masses! Another step towards mass adoption.
2023-10-14 10:01:48,Comment,2,LOL... No bronut can say that 😂😂
2023-10-14 09:46:09,Comment,2,And I asked why do you think that seeing the charts isn't productive?
2023-10-14 09:14:55,Comment,2,Morning... Seeing the charts isn't being productive?
2023-10-14 07:46:29,Comment,1,u/Cyrus-114
2023-10-14 07:45:36,Comment,2,It worked. Thanks!
2023-10-14 07:33:45,Comment,2,They were transferred to Gnosis cuz of the lower gas fees
2023-10-13 18:43:03,Comment,2,Have you added the token to your wallet. Are you checking donuts on Gnosis chain? Try checking Blockchain explorer.
2023-10-13 17:36:21,Comment,1,"Thanks, u/Buzzalu"
2023-10-13 17:28:37,Comment,1,I heard his girlfriend had some private writings... I hope they get published...
2023-10-13 17:18:44,Comment,2,ETH is better at tokenization and a better choice for mass adoption.
2023-10-13 17:17:29,Comment,2,Their loss.
2023-10-13 17:13:48,Comment,1,A traditionalist.
2023-10-13 17:13:15,Comment,2,\*sits down on knees\*
2023-10-13 17:11:57,Comment,3,Any religious bronuts? Do you pray for ETH pumps?
2023-10-13 17:10:56,Comment,2,A biography could be written titled 'How girlfriend turned into a snitch'
2023-10-13 16:39:55,Comment,1,😊
2023-10-13 16:38:39,Comment,2,Thanks u/lordciders
2023-10-13 16:25:21,Comment,1,It could be called Bipolar Bronut Disorder...
2023-10-13 16:24:19,Comment,2,Bronuts who see ETH dipping and donuts pumping... I think they would be confused about how to react...
2023-10-13 16:06:33,Comment,1,\[AutoMod\] Comedy
2023-10-13 15:48:46,Comment,2,Tipping donuts to bronuts...
2023-10-13 15:45:30,Comment,1,I hope V-Bucks from Fortnite enter blockchain... and locker items become NFTs...
2023-10-13 15:44:08,Comment,1,Discountober progressing well...
2023-10-13 15:22:05,Comment,2,Those folks are too rich now to bake donuts here...
2023-10-13 14:21:17,Comment,1,"No problem, bronut!"
2023-10-13 14:17:44,Comment,2,![gif](emote|free_emotes_pack|wink)
2023-10-13 14:14:19,Comment,1,All posts count...
2023-10-13 14:13:10,Comment,1,Hodl till the next pump...
2023-10-13 14:12:38,Comment,2,I have done that 😬... I kind of like that cult dedicated to traffic cones...
2023-10-13 14:10:52,Comment,1,Availing discounts...
2023-10-13 14:07:23,Comment,2,You can share with me 😂 I'm hotter than them 😂
2023-10-13 14:03:27,Comment,1,Europe?
2023-10-13 14:02:52,Comment,3,But they don't include comment karma... and they don't have monthly distributions...
2023-10-13 14:00:41,Comment,3,Is it possible to set a similar system (like donuts) in another subreddit without Reddit's support?
2023-10-13 13:55:34,Comment,3,Just reached home.
2023-10-13 13:51:59,Comment,1,Good bot.
2023-10-13 13:45:14,Comment,4,Don't share your seed with them...
2023-10-13 13:43:46,Comment,2,"If it was me, I wasn't lying..."
2023-10-13 13:42:29,Comment,8,"Search your username [here](https://donut-dashboard.com/#/distribution).

You got 406 donuts for karma, 2059 from tips and got deducted 1000 donuts for posting (4 posts)"
2023-10-13 10:13:24,Comment,3,>~~Ethtrader community~~ Bronuts ~~is~~ are way better than the doge community
2023-10-13 10:12:10,Comment,1,Availibility of crypto to masses?
2023-10-13 09:41:35,Comment,1,I'm not a Dragon Ball Z fan... but thanks...
2023-10-13 09:10:45,Comment,3,"Pumptober for RCPs.

Discountober for ETH."
2023-10-13 07:44:26,Comment,1,And what's the normal ratio at the end of the day?
2023-10-13 07:34:36,Comment,1,Or maybe Tunorb (opposite of bronut)
2023-10-13 07:33:03,Comment,2,RCAs... and you have an Aye Aye...
2023-10-13 07:31:06,Comment,2,No bronut will downvote the daily... But the sub is open to outsiders as well...
2023-10-13 07:30:12,Comment,2,"Any bronut giving away Aye Ayes, Saigas and Hog Nosed Bat for donuts... I need these to complete Endangered animals set. Willing to offer 10% above floor price."
2023-10-13 07:26:27,Comment,1,$6.9 in 2028. $10 in 2030.
2023-10-13 07:25:39,Comment,2,Multiple people can have that honor everyday cuz a lot of people downvote the daily as well.
2023-10-13 06:31:51,Comment,2,Afraid that she'll leave you for a whale?
2023-10-13 03:00:01,Comment,3,Or spending life-changing donuts on each other
2023-10-13 02:56:49,Comment,2,I'm curious too.
2023-10-13 02:51:17,Comment,1,You should be glad for getting discounts.
2023-10-13 02:48:09,Comment,3,Why isn't that one person signing?
2023-10-13 02:47:07,Comment,4,Any bronut whose significant other is also a bronut?
2023-10-12 19:11:04,Comment,2,Awww. You're so sweet...
2023-10-12 18:18:54,Comment,1,I thought Russians called Russia fatherland?
2023-10-12 18:17:38,Comment,2,I'm feeling turned on imagining crypto to be an anthromorph...
2023-10-12 18:16:00,Comment,2,Discountober.
2023-10-12 18:15:46,Comment,3,That's against traditions. We buy high and sell low..
2023-10-12 18:13:29,Comment,2,Is wooden spoon another token? 😅
2023-10-12 18:08:18,Comment,3,Any prize for someone with lowest profit/highest loss?
2023-10-12 18:02:47,Comment,1,You mean Saint Vitalik?
2023-10-12 18:01:04,Comment,2,$10000 in 2030. $69420 in 2050.
2023-10-12 17:55:21,Comment,2,Posted the question as the main comment for someone 'techy enough' 😅
2023-10-12 17:54:42,Comment,3,Why can't membership be bought on Gnosis chain? Is it a technical issue?
2023-10-12 17:53:32,Comment,2,And we shall be closer to mass adoption...
2023-10-12 17:51:07,Comment,5,Why can't the membership be bought on gnosis?
2023-10-12 17:49:10,Comment,1,"Apple, Microsoft and Tesla will be tokenized securities bought using ETH?"
2023-10-12 17:47:25,Comment,1,r/ConeHeads are even smaller than them... and their token is pretty good...
2023-10-12 17:46:24,Comment,1,"They will be like USD, CNY and EUR"
2023-10-12 17:45:39,Comment,2,"I'm gonna wait and see... If it's alright, I'll reinvest..."
2023-10-12 17:44:44,Comment,2,You wouldn't have heard about them... I'm from Pakistan.... 😅
2023-10-12 17:44:17,Comment,2,☹️
2023-10-12 17:43:55,Comment,1,This was me... Not sure why it is not showing my username...
2023-10-12 17:35:15,Comment,2,You're a genius.
2023-10-12 17:34:45,Comment,2,Spend a night thinking about it... Don't rush such decisions...
2023-10-12 17:32:52,Comment,2,Portfolio is to be diversified to minimize risks.
2023-10-12 17:30:12,Comment,2,https://donut-dashboard.com/#/distribution
2023-10-12 17:29:38,Comment,4,Cashed out stocks today. Can't risk losing money due to war.
2023-10-12 17:27:11,Comment,2,Bullish on ETH and XMR... There should be a similar community for XMR traders (with community token) too...
2023-10-12 17:25:01,Comment,1,Discountober
2023-10-12 17:24:32,Comment,1,Pumptober has commenced?
2023-10-12 17:21:40,Comment,2,"Nope. Never did that sh\*t

(Only tried it on Binance)"
2023-10-12 17:21:15,Comment,2,Thanks for sharing the information.
2023-10-12 17:19:34,Comment,3,'Baked' is the correct word.
2023-10-12 17:18:23,Comment,2,"Human trafficking, sales and purchases of drugs and almost every criminal thing...

Probably a large number of people wouldn't want to be tracked on blockchain... they will turn to privacy coins... XMR is at the top of the list..."
2023-10-12 17:16:27,Comment,0,"only a few. Opensea, Sushiswap, FIrstMate, Quickswap, Chainlist and Reddit.

I don't connect my wallets to other sites..."
2023-10-12 17:11:48,Comment,2,$69.420 in 250
2023-10-12 17:11:12,Comment,2,Rule 4: HODL!
2023-10-12 17:10:09,Comment,2,What's that?
2023-10-12 17:09:57,Comment,2,"BTC, ETH and XMR."
2023-10-12 17:09:35,Comment,1,All bronuts.
2023-10-12 16:53:15,Comment,1,and launch it to the moon.
2023-10-12 16:52:44,Comment,2,Monero
2023-10-12 16:48:27,Comment,2,and 4chan.
2023-10-12 16:47:32,Comment,2,You mean hot girls and the nigerian prince?
2023-10-12 16:46:12,Comment,1,And our unofficial name is Bronuts...
2023-10-12 16:13:43,Comment,1,"not sure...

PS: he got a lot of tips... he would definitely get more than 250 donuts..."
2023-10-12 16:12:03,Comment,1,Contributed what I could contribute.
2023-10-12 16:10:59,Comment,1,Burning is always welcome.
2023-10-12 16:09:43,Comment,1,They earned profits...
2023-10-12 16:08:00,Comment,2,They're increasing discount to get more sales...
2023-10-12 16:06:17,Comment,1,"Even cones have a RCA marketplace... and none for any RCPs... I want a marketplace which supports donuts, moons, bricks and cones.."
2023-10-12 09:54:18,Comment,2,Next stop 6900!
2023-10-12 09:53:32,Comment,1,"After flippening, they'll be comparing bricks and moons with donuts..."
2023-10-12 09:52:25,Comment,2,Being a bronut
2023-10-12 09:51:53,Comment,3,Preparing yourself for an early retirement?
2023-10-12 09:40:37,Comment,3,Article recommended for hopium addicted bronuts.
2023-10-11 18:45:34,Comment,1,At the snapshot after the post.... The distribution which comes after posting....
2023-10-11 18:33:08,Comment,1,😂😂😂
2023-10-11 18:28:11,Comment,3,Thanks!
2023-10-11 18:27:37,Comment,2,What are the others?
2023-10-11 18:27:09,Comment,2,ETH will soon take over BTC.
2023-10-11 18:24:29,Comment,2,There are more than 70 distributions before start of 2030... They can stack up a lot till then...
2023-10-11 18:22:53,Comment,2,It would be better if it comes sooner...
2023-10-11 18:21:41,Comment,1,Thanks u/Gubbie99
2023-10-11 17:51:21,Comment,1,\[AutoMod\] Comedy
2023-10-11 16:31:09,Comment,1,Fiat isn't as sweet as donuts.
2023-10-11 16:30:02,Comment,1,In the next bull run.
2023-10-11 16:27:47,Comment,1,Why only one? You can sell 2. You just need another person. 😂
2023-10-11 16:23:05,Comment,2,You can only claim if you have very low balance.
2023-10-11 16:21:59,Comment,1,Their loss.
2023-10-11 16:19:58,Comment,2,check gnosisscan.
2023-10-11 16:18:53,Comment,3,When will ETH take over BTC?
2023-10-11 15:41:54,Comment,2,"I think people have done it before me.

PS: I have changed my clothing."
2023-10-11 15:25:55,Comment,2,I was at fiat mine... I'll wear it soon.
2023-10-11 15:25:18,Comment,1,I think someone mentioned buying avatars with donuts a few days earlier in the daily.
2023-10-11 15:22:28,Comment,2,I think this has happened before. I have bought RCAs with moon before this trade ...
2023-10-11 15:18:26,Comment,1,Sebastian and 3 Endangered animals
2023-10-11 15:16:47,Comment,1,10k in 2025. 50k in 2030
2023-10-11 15:15:18,Comment,3,Spent 800 donuts to buy RCAs.
2023-10-11 15:14:13,Comment,1,Charts give insomnia due to excitement or depression.
2023-10-11 14:14:20,Comment,1,But I didn't know that at that time.
2023-10-11 13:56:10,Comment,2,"I was a little worried that my donuts would be wasted... for a few minutes, I was thinking what I would post if I didn't receive avatars in a few hours. 😅"
2023-10-11 13:48:21,Comment,2,It was from the previous day.
2023-10-11 08:32:30,Comment,1,Also check Automoderator's comments
2023-10-11 08:32:13,Comment,2,What's done can't be undone. Don't worry about it..
2023-10-11 07:59:37,Comment,15,Do you know that posting costs 250 donuts? And it will be deducted from next distribution.
2023-10-11 07:57:25,Comment,1,Marketcap of Ethereum is 1.5 % of the market cap of gold.
2023-10-11 07:40:05,Comment,1,Flippening before the bull run...
2023-10-11 07:36:56,Comment,2,In November 2021?
2023-10-11 06:21:18,Comment,2,oh... it requires seperate signatures... Thanks 😅
2023-10-11 06:09:43,Comment,3,I have received donuts but no contribution tokens. Is there a problem? Or they haven't been distributed yet?
2023-10-11 04:01:30,Comment,3,"Is it alright to transfer CONTRIB tokens to another wallet (Can I sell/gift my contribution points) ? If yes, can I swap ETH to CONTRIB in any exchange?"
2023-10-11 03:59:39,Comment,2,>Love the hopium ~~optimism~~!
2023-10-11 03:58:47,Comment,1,Donuts will be $10 in 2030.
2023-10-11 03:56:38,Comment,2,Wrong daily. 😅
2023-10-11 03:56:21,Comment,1,Wrong daily
2023-10-10 15:42:02,Comment,3,Or maybe they misinterpreted the charts.
2023-10-10 15:39:33,Comment,3,Ok bronut.
2023-10-10 15:38:04,Comment,2,Hmmm. Thanks for answering. 😁
2023-10-10 15:37:08,Comment,3,I have only nine donuts (which I got as tips) right now 😅. I'll contact you after the distribution.
2023-10-10 15:34:50,Comment,3,Thanks. I heard CC had a system to incentivize hodlers... I was wondering if there's a similar system here.
2023-10-10 15:30:50,Comment,6,"If I use donuts I get during first distribution to get avatars, will it effect future distributions?"
2023-10-10 15:29:58,Comment,1,I'm waiting for the first distribution to do that....
2023-10-10 15:28:52,Comment,2,They deserve that for not reading Automoderator comments
2023-10-10 15:26:14,Comment,2,I labor at a fiat mine for 5 days a week to do that.
2023-10-10 15:23:53,Comment,1,greater and sweeter and nicer.
2023-10-10 15:21:47,Comment,2,I want it to be 420
2023-10-10 15:20:37,Comment,1,Some non-traditionalists buy low and sell high. and they call the difference in price profits.
2023-10-10 15:17:28,Comment,2,And 50000 donuts > 1 donut
2023-10-10 15:16:41,Comment,1,5 digit is sweeter than 3 digit.
2023-10-10 15:14:06,Comment,2,Is there a way to see number of premium members? Mods should publish a list every month.
2023-10-10 15:13:08,Comment,1,Simple and wise.
2023-10-10 15:12:45,Comment,2,I can get a flat with that amount.
2023-10-10 15:11:51,Comment,1,💉Donuts will be $10 in 2030💉
2023-10-10 15:11:04,Comment,1,Username doesn't check out.
2023-10-10 15:10:11,Comment,1,1 donut for donut. 9 donuts for double chocolate. single chocolate cost 4.5 donuts.
2023-10-10 15:09:26,Comment,2,I wanted to ask that too.
2023-10-10 09:08:09,Comment,1,Thanks ☺️
2023-10-10 09:07:49,Comment,2,I told them that I wasn't interested in mining... and would love to chat with them about other things...
2023-10-10 08:49:56,Comment,3,69420
2023-10-10 08:49:09,Comment,3,Link for multisig transaction?
2023-10-10 08:48:34,Comment,1,Nope. Hodling it. And waiting for fiat to buy more.
2023-10-10 08:44:36,Comment,2,It should be plural. I won't be satisfied with only one. 😂
2023-10-10 08:20:17,Comment,3,I have a feeling that this will happen in 2030...
2023-10-10 08:12:03,Comment,3,And hot girls and Nigerian prince.
2023-10-10 08:05:25,Comment,1,I hope that didn't ruin your sleep..
2023-10-10 07:55:45,Comment,1,Good morning. Feeling sweetness in the air?
2023-10-10 07:39:34,Comment,1,They'll regret not buying ETH
2023-10-10 07:37:12,Comment,1,Not sure.
2023-10-10 06:42:58,Comment,2,r/CryptoKamaSutra
2023-10-10 06:38:01,Comment,2,They will regret their decisions in a few months.
2023-10-10 06:16:25,Comment,2,They lack patience.
2023-10-10 06:12:04,Comment,2,There's still time... Tell him to buy during this discount season...
2023-10-10 06:06:04,Comment,2,There were 69 upvotes yesterday.
2023-10-10 06:03:05,Comment,1,"Donut Dashboard?

CCMoons has an RCP estimator too."
2023-10-10 03:16:01,Comment,4,And what about Palestinians? They have been suffering for last 100 years.
2023-10-10 03:14:29,Comment,1,And the war has only started. I have a feeling that this will continue.
2023-10-10 02:57:43,Comment,1,I'm targeting 20k in next 2 months.
2023-10-10 02:56:06,Comment,1,And ETH?
2023-10-10 02:54:19,Comment,1,Required quality checks?
2023-10-10 02:50:19,Comment,1,Pumptober will commence when we least expect it.
2023-10-10 02:47:54,Comment,1,"When life gives you donuts, hodl them. They'll be $10 in 2030"
2023-10-10 02:46:39,Comment,0,Wen donut?
2023-10-10 02:44:31,Comment,2,1155 has more gas fees.
2023-10-10 02:40:04,Comment,1,I was very new to crypto... and saw PEPE pumping...
2023-10-10 02:39:17,Comment,1,No problem. 😅
2023-10-09 18:39:28,Comment,4,I commented about poop tokens but my comment was deleted by someone with governance score more than 20k...
2023-10-09 18:38:35,Comment,3,I bought PEPE and learnt never to trust shitcoins again. I think investment in PEPE paid off well by teaching me a lesson 😂
2023-10-09 18:37:08,Comment,2,I declare thee married.
2023-10-09 18:35:39,Comment,2,https://www.mydonuts.online/
2023-10-09 18:34:17,Comment,1,And I fear it's only starting.
2023-10-09 18:24:09,Comment,2,chain explorers mentions number of decimals for each ERC-20 token. not sure why it's 18 though.
2023-10-09 18:22:58,Comment,1,Power of bronuts?
2023-10-09 18:22:19,Comment,3,Gas fee would be millions or probably billions times greater than that 😅
2023-10-09 18:20:41,Comment,2,Daily dose of hopium... We need it to keep going...
2023-10-09 18:19:41,Comment,2,It's back.
2023-10-09 18:18:42,Comment,2,I remember your name 😅
2023-10-09 18:18:10,Comment,2,What if Gary is Satoshi?
2023-10-09 18:16:23,Comment,1,Donut Estimator is back.
2023-10-09 18:15:48,Comment,2,I think the war is causing it.
2023-10-09 18:14:08,Comment,3,You can add 18 decimals
2023-10-09 17:17:23,Comment,1,Feeling sweetness in the air?
2023-10-09 17:08:45,Comment,2,"And RCAs will be booming too... (unless Reddit does something bad)

PS: You have a nice RCA collection."
2023-10-09 17:03:07,Comment,2,Pumptober will be starting soon. I feel ETH will be +10% in next week
2023-10-09 16:51:07,Comment,2,Donuts will be $10 in 2030.
2023-10-09 16:50:12,Comment,1,I sometimes play Fortnite in the fiat mine.
2023-10-09 16:40:36,Comment,2,![gif](emote|free_emotes_pack|give_upvote)
2023-10-09 16:36:57,Comment,2,"Bronuts together, donut strong."
2023-10-09 16:36:32,Comment,1,I want more RCPs in more subreddits....
2023-10-09 16:32:16,Comment,2,it's a crypto casino.
2023-10-09 16:21:51,Comment,4,Any source for this?
2023-10-09 16:20:21,Comment,3,I can't access it either. ☹️
2023-10-09 08:11:23,Comment,2,never used donuts... but I have used moons...
2023-10-09 08:04:55,Comment,0,This is a legitimate token distributed to owners of reddit collectible avatars
2023-10-09 08:03:39,Comment,1,checking daily to see if baking has been completed.
2023-10-09 08:02:21,Comment,2,r/Poopheadavatars has airdropped poop token to eligible wallets. See details [here](https://www.reddit.com/r/Poopheadavatars/comments/1726fnn/rpoopheadavatars_poop_token_is_now_live/). I got 26.6 million poop for hodling a bucket head.
2023-10-08 17:14:55,Comment,2,Someone downvoted and its back at 66
2023-10-08 16:52:43,Comment,1,3 more\*
2023-10-08 16:22:07,Comment,2,And the different tortoises are ETH mainnet and sidechains.
2023-10-08 16:17:49,Comment,1,Can we do something to have Vitalik canonized as a saint?
2023-10-08 16:16:35,Comment,5,[Here's](https://www.youtube.com/watch?v=_mV5OTd7gMg) the proof.
2023-10-08 16:12:52,Comment,3,10 required for 69 upvotes
2023-10-08 15:06:28,Comment,1,Nope. It's a very different project.
2023-10-08 13:52:04,Comment,1,And even that one wants to steal your crypto.
2023-10-08 13:40:59,Comment,1,Morning while traveling to my fiat mine... and in evening after returning from there. Sometimes during lunch breaks
2023-10-08 13:36:37,Comment,2,I'm trying to keep it above 5000 this month. So I check once or twice daily.
2023-10-08 13:35:49,Comment,3,Heroes without capes.
2023-10-08 13:34:48,Comment,3,My company's competitor offered me a freelance job. I'll have more fiat to buy ETH in a few days.
2023-10-08 13:28:59,Comment,1,I think his girlfriend will plead guilty and 'cooperate with the government'
2023-10-08 13:26:10,Comment,1,Switching to weekly again would be good for donut hype.... but more work for mods
2023-10-08 13:21:14,Comment,2,That'll be 3 ETH in 2030.
2023-10-08 13:20:27,Comment,2,Patience is what pays in long-term
2023-10-08 13:18:41,Comment,1,Does that avatar look like a donut?
2023-10-08 13:14:15,Comment,1,Slow and steady wins the race.
2023-10-08 13:13:17,Comment,1,Influencers were influenced by something 😂
