Date,Activity Type,Upvotes,Content
2023-10-13 13:54:46,Comment,2,I would say true because I have not seen a single case myself of someone guessing 12 words seed phrase
2023-10-13 13:53:40,Comment,2,Binance because it was the first CEX I used back when I first got into crypto
2023-10-13 13:49:52,Comment,2,I hope this distribution give us all the amount of Donuts we are hoping for BAGMI![img](emote|t5_37jgj|32645)
2023-10-13 13:49:15,Comment,2,Yes we all are having fun![img](emote|t5_37jgj|32639)
2023-10-13 13:47:09,Comment,2,We both are ultimate BroNuts then
2023-10-13 13:46:44,Comment,1,Doesn't matter I have had the joy of doing the 69th upvote
2023-10-13 13:41:07,Comment,4,Yeah BroNuts I did the 69th upvote now I have become the ultimate BroNut![img](emote|t5_37jgj|32641)
2023-10-13 13:37:27,Comment,2,Yes I talk to my brothers and 3 of my friends
2023-10-13 13:31:10,Comment,2,100 in MM because they will help me buy 100 of those plates in future
2023-10-13 13:30:34,Comment,1,I think many of BroNuts are not free from work yet so we might see increase in activity later today
2023-10-13 13:12:01,Comment,1,Done BroNut that is the first thing to do daily morning
2023-10-13 13:11:15,Comment,3,Small thing to do which saves from a lot of loss
2023-10-13 12:54:38,Comment,1,What's better than chatting with BroNuts
2023-10-13 12:54:12,Comment,1,For that we need more use cases of donuts
2023-10-13 12:53:40,Comment,2,Who sold too early
2023-10-13 12:43:12,Comment,-1,You're right these are common techniques I don't know why everyone is downvoting
2023-10-13 12:35:52,Comment,-1,Ok but why would I copy paste a old post from r/cc?
2023-10-13 12:33:27,Comment,-2,Can you share the link?
2023-10-13 12:29:45,Comment,1,HODL and closely looking at market movements.
2023-10-13 12:28:43,Comment,1,Right now 2 but hoping to make it 6-7 by the end of year.
2023-10-13 12:28:15,Comment,1,50k Donuts is what I want to achieve
2023-10-13 12:27:42,Comment,1,"BroNuts some Crypto techniques for you guys feel free to add more.

**Dollar-Cost Averaging (DCA):** Instead of investing a lump sum, consider spreading your investment over regular intervals. This helps reduce the impact of market volatility.  
  
**Technical Analysis:** Learning to read charts and understand market trends can be beneficial. Tools like TradingView and Coinigy can provide insights into potential price movements.  
  
**Fundamental Analysis:** Understand the underlying technology and fundamentals of the cryptocurrencies you're interested in. What problems do they solve? What's their use case?  
  
**Staking and Yield Farming:** If you have the opportunity, consider staking your crypto or participating in yield farming to earn additional tokens.  
  
**Security Measures:** Use hardware wallets for cold storage to keep your crypto assets secure. Enable two-factor authentication on exchanges and wallets.  
  
**Educational Resources:** Keep learning. The crypto space is dynamic, and staying informed about new projects, technologies, and market trends is crucial. For this join communities on reddit and follow good resources on X(Twitter).  
  
**Risk Management:** Only invest what you can afford to lose. Diversify your portfolio to spread risk.

Have save journey BroNuts![img](emote|t5_37jgj|32639)"
2023-10-13 12:21:45,Comment,1,I hope so lets see what October holds for us for the rest of the month
2023-10-13 12:21:13,Comment,1,I'm happy they'll rot in jail
2023-10-13 12:20:53,Comment,1,Donuts are my fav snacks
2023-10-13 12:20:32,Comment,2,Technically it is an altcoin but it is as imp as BTC for crypto
2023-10-13 12:19:58,Comment,1,Innovative projects with real-world applications could be a good strategy.
2023-10-13 11:54:19,Comment,0,Bear market is opportunity to prepare for the bull market
2023-10-13 11:53:23,Comment,0,Yes real BroNuts the know the potential of Donuts
2023-10-13 11:52:42,Comment,1,No that is my dream
2023-10-13 11:50:12,Comment,1,Are you talking about Donut estimator? If yes then you can check that at https://www.mydonuts.online/
2023-10-13 11:48:11,Comment,1,First experience is that do not invest more than you afford to lose
2023-10-13 11:46:13,Comment,1,Why can't I see any text in the post?
2023-10-13 11:45:34,Comment,3,Its Friday the 13th tell me which Donut🍩 is the spookiest?
2023-10-13 11:44:47,Comment,2,Meta Mask wallet
2023-10-13 11:44:27,Comment,2,Then have one they are very tasty
2023-10-13 11:44:07,Comment,2,A house for parents
2023-10-13 11:43:49,Comment,1,This makes me believe we all are gonna make it in next bull run⬆️
2023-10-13 11:43:02,Comment,2,He tips a lot
2023-10-13 11:42:18,Comment,1,Spooky spooky 🍩s
2023-10-13 11:41:47,Comment,2,Man don't give us hope🥺
2023-10-13 11:41:00,Comment,2,Couldn't agree more
2023-10-13 11:40:39,Comment,1,Yes only 11 upvotes remaining BroNuts do it
2023-10-13 11:40:17,Comment,2,Check your MM and make sure you're on Gnosis chain and Donuts are added as token
2023-10-13 08:43:26,Comment,3,Thats a sexy number😏
2023-10-13 08:41:37,Comment,3,Week day is ending on good note🍩
2023-10-13 08:40:09,Comment,2,BroNuts love positivity
2023-10-13 08:39:42,Comment,10,What is the highest amount of donuts you received in tip?
2023-10-13 08:38:45,Comment,4,There is no tax on crypto here
2023-10-13 08:38:23,Comment,2,Good job BroNut keep it up
2023-10-13 08:37:22,Comment,5,That is what BroNuts are for🍩
2023-10-13 08:37:06,Comment,6,Yes I'm also very excited for the weekend after stressful week days
2023-10-13 08:33:32,Comment,12,BroNuts are active my comments are getting upvoted🤝
2023-10-13 08:32:40,Comment,6,Not at all but I can't be hacked or scammed that easily
2023-10-13 08:29:48,Comment,6,Computer Science
2023-10-13 08:27:37,Comment,9,Finally I'm back from Uni and now I have 2 days to chat with you guys it is going to be so fun🍩🍩🍩
2023-10-13 08:26:57,Comment,1,BAGMI🚀
2023-10-13 08:24:44,Comment,2,We can only imagine rn
2023-10-13 08:24:21,Comment,2,Yes I'm ready
2023-10-13 08:23:58,Comment,3,Yes and you're always active kudos to that
2023-10-13 08:23:25,Comment,3,When they'll make me rich
2023-10-13 08:22:52,Comment,3,Yes very early
2023-10-13 08:22:34,Comment,3,Done
2023-10-13 02:56:48,Comment,1,Lets go🚀
2023-10-13 02:55:21,Comment,2,Done sir🫡
2023-10-13 02:54:55,Comment,1,Good for us BroNuts
2023-10-13 02:54:28,Comment,0,Lets go
2023-10-13 02:54:16,Comment,3,That would be dream but would they call each other bro?
2023-10-13 02:53:54,Comment,1,"Good Morning BroNuts Its Friday last day of Uni for this week then I'll have weekend off in which I'll chat with my BroNuts take care of yourselves till then and don't forget to upvote the daily.
BAGMI!!!"
2023-10-12 18:31:45,Comment,2,Dumptober so far
2023-10-12 16:00:44,Comment,2,I don't think we'll see it this year
2023-10-12 16:00:18,Comment,2,Only true love Donuts
2023-10-12 15:38:45,Comment,1,Good BroNut
2023-10-12 15:35:53,Comment,2,Yes if I could advice myself I would advice to take profits
2023-10-12 15:35:22,Comment,2,I think bull run is going to start in 2025
2023-10-12 15:34:29,Comment,2,NEST Arcade for me
2023-10-12 15:34:13,Comment,2,RCPs on steroids
2023-10-12 15:33:56,Comment,2,Yes good growth for Donuts
2023-10-12 15:33:24,Comment,2,Reminder we only need 10 more upvotes for the sexy number BroNuts assemble!
2023-10-12 15:32:39,Comment,2,Yes it is so hard when they say that you spent so much time and you are still in loss
2023-10-12 15:31:27,Comment,2,DYOR and make sure to take profit when you can
2023-10-12 14:41:28,Comment,1,Thats the plan BroNut
2023-10-12 14:32:03,Comment,2,Donuts
2023-10-12 14:31:51,Comment,2,Thanks for welcoming BroNut
2023-10-12 14:31:25,Comment,1,Donuts
2023-10-12 14:30:03,Comment,1,Most of their value is based on hype
2023-10-12 14:24:31,Comment,1,RCPs are the most underrated Crypto right now and they will boom in next bull run I'm sure
2023-10-12 14:23:58,Comment,3,I think they need signatures as well
2023-10-12 14:23:33,Comment,3,I want another 6 months so I have my bags ready
2023-10-12 14:14:29,Comment,2,Yes just got to know good for us🍩
2023-10-12 14:14:07,Comment,1,Was he on drugs or something
2023-10-12 14:10:16,Comment,1,Good Post OP
2023-10-12 14:09:57,Comment,2,Good day and thanks for the post it is very informative
2023-10-12 14:09:13,Comment,4,BroNuts I'm back from Uni have I missed anything and how is your day going?
2023-10-12 14:08:29,Comment,2,Yes happened to me yesterday
2023-10-12 14:07:59,Comment,1,We already did... yeah!
2023-10-12 14:07:43,Comment,1,Yes BroNuts do that all the time
2023-10-12 14:07:18,Comment,1,Guranteed future millionaire
2023-10-12 14:06:43,Comment,1,I will buy because I know their potential
2023-10-12 14:06:14,Comment,1,They are already recoverimg🍩
2023-10-12 14:05:54,Comment,2,I wish I was a whale but I'm not
2023-10-12 14:05:22,Comment,1,Yes BroNuts know the potential of donuts
2023-10-12 14:03:16,Comment,2,Yes we will then hope for 0.04$ they will grow more and nore
2023-10-12 14:02:44,Comment,1,Not a single donut a day but I need thousands of them a day
2023-10-12 14:01:57,Comment,1,Yes sir🫡
2023-10-12 14:01:46,Comment,2,Quick gains
2023-10-12 14:01:30,Comment,3,Now take it back to 0.02$
2023-10-12 03:09:54,Comment,1,This sub is my motivation
2023-10-12 03:09:38,Comment,1,Good Day fellow BroNut
2023-10-12 03:09:24,Comment,2,Just going for uni will report back on my return BroNut
2023-10-12 03:08:49,Comment,1,A man can only fantasize
2023-10-12 03:08:35,Comment,2,Lets hope it does dump more
2023-10-12 03:08:10,Comment,0,Happy New daily😊
2023-10-12 03:07:53,Comment,1,Yes it is late
2023-10-12 03:07:31,Comment,1,Yes happening from many days
2023-10-12 03:07:12,Comment,2,Every little drop counts in making the ocean GL BroNut🍩
2023-10-12 03:06:21,Comment,2,GM Thursady morning for me
2023-10-12 03:05:58,Comment,0,What's profit never heard of it
2023-10-12 03:05:23,Comment,1,Done Sir🫡
2023-10-12 03:05:09,Comment,2,Hi👋
2023-10-12 03:04:54,Comment,1,Tell your portfolio to wait for the better days not all days are same
2023-10-12 03:04:11,Comment,2,HODL 🍩🍩🍩
2023-10-12 03:03:32,Comment,1,Nah we are in the bear market for so long how can we give up now
2023-10-12 03:01:58,Comment,1,Then you don't watch the market and wait for better days
2023-10-12 03:00:55,Comment,1,Wait let me accumulate first
2023-10-12 03:00:41,Comment,1,My target is 50k and I currently have 1.3k Donuts🍩
2023-10-12 02:59:34,Comment,1,I think Donuts
