Date,Activity Type,Upvotes,Content
2023-10-19 18:32:00,Post,17,Decoding Bull Runs: A Comparative Analysis of Top 10 Cryptos in Historical Surges
2023-10-16 05:36:11,Post,14,Your Most Memorable Crypto Stories!
2023-10-08 08:06:39,Post,15,How to Crypto: A Beginner's Guide
2023-10-07 13:11:35,Post,2,Proposal: Governance-Backed Posting Privileges
2023-10-05 19:05:56,Post,9,Virtual Pet Adoption
2023-10-28 05:08:45,Comment,1,!myactivity
2023-10-28 05:06:49,Comment,2,Good Morning Bronuts🍩
2023-10-27 23:15:44,Comment,2,How is my donuts family doing?
2023-10-27 09:33:00,Comment,2,I see a pattern before every distribution whales sell to buy later at lower rate
2023-10-27 09:32:06,Comment,5,Just like before every distribution people are selling and donuts are taking dip
2023-10-27 09:31:08,Comment,1,The estimate is only valid around snapshot
2023-10-27 09:29:34,Comment,1,GM and done sir
2023-10-27 09:29:19,Comment,2,This has become a routine for me reddit app sucks
2023-10-27 09:28:47,Comment,1,I still see a lot of new faces
2023-10-27 09:28:18,Comment,1,Have nice sleep Bronut
2023-10-27 09:27:53,Comment,2,It always happens in the starting days of round
2023-10-27 09:27:10,Comment,2,Yes it is the only time I get active in this community so I long for weekends
2023-10-27 09:26:24,Comment,2,Waiting on mods to have their say
2023-10-27 09:25:58,Comment,2,Yes Bronuts have solution to everything
2023-10-27 09:25:34,Comment,2,First distro is always the most exciting one
2023-10-27 09:24:40,Comment,8,Bronuts Assemble![img](emote|t5_37jgj|32645) and mark your attendance where are you all?
2023-10-27 04:40:01,Comment,4,Good Morning Bronuts who can smell donuts cooking?
2023-10-27 04:32:49,Comment,1,![img](avatar_exp|141573552|bravo)
2023-10-26 20:28:36,Comment,5,What can we Bronuts not do we even have CSV file of our own thanks to hard working bronuts to make it happen
2023-10-26 17:00:00,Comment,2,Yes just like what Reddit did to Moons
2023-10-26 16:59:41,Comment,2,I never thought about it before but now as you mentioned it new fear unlocked
2023-10-26 16:55:08,Comment,9,What is your worst fear in crypto?
2023-10-26 15:37:51,Comment,2,It is part of crypto journey hold tight Bronut
2023-10-26 15:37:13,Comment,0,You can do it on Android using Kiwi browser I guess
2023-10-26 15:36:39,Comment,0,I am not that active so how low it is today in comparison to previous days?
2023-10-26 15:19:03,Comment,3,Bronuts how many DONUTs it costs in your area to buy a real donut?
2023-10-26 15:17:48,Comment,1,100% Bronut that is why I'm not that active these days after my Uni started because I'm mostly busy studying.
2023-10-26 15:15:17,Comment,1,What is better celebration than making it to top 10 here as well
2023-10-26 15:11:27,Comment,2,Thanks Sensei
2023-10-26 15:11:00,Comment,1,Going good my result was yesterday and I came 2nd in whole University out of 800 students so I am quite happy.
2023-10-26 15:08:25,Comment,2,Yes we are immune to it now
2023-10-26 15:07:53,Comment,2,BTC leading as always
2023-10-26 15:07:33,Comment,2,Hope we reach there fast fingers crossed
2023-10-26 15:06:46,Comment,2,Around 3
2023-10-26 15:06:23,Comment,1,GM but we are so better as compare to some days before
2023-10-26 15:06:03,Comment,2,Waiting for my governance power to help you all
2023-10-26 15:05:25,Comment,1,I hope you get back on your feet faster and stronger![img](emote|t5_37jgj|32645)
2023-10-26 15:03:43,Comment,2,That is what I love about this sub we got so many amazing Bronuts here![img](emote|t5_37jgj|32639)
2023-10-26 15:03:12,Comment,2,Yes more than happy because I made it to top 10
2023-10-26 15:02:39,Comment,1,Thanks![gif](emote|free_emotes_pack|heart_eyes)
2023-10-26 15:00:41,Comment,1,"Made it to top 10 Lets go Bronuts![img](emote|t5_37jgj|32639)

**BAGMI**![img](emote|t5_37jgj|32641)"
2023-10-26 12:41:52,Comment,2,Yes I think because I have total karma around 3.7k and according to data my karma is 5.3k
2023-10-26 12:39:32,Comment,1,You can check it here https://www.reddit.com/r/ethtrader/s/zT7ZmdT1bj
2023-10-26 12:38:02,Comment,1,Yes I made it to top 10 which was quite unexpected as in the last week I was not active at all
2023-10-26 12:35:45,Comment,3,It will be multiplied by ratio
2023-10-26 12:31:37,Comment,3,Bronuts how much karma you got this round and are you happy with it?
2023-10-26 12:23:48,Comment,2,Wow I'm finally in top 10 a huge improvement from my last 1250 donuts
2023-10-26 12:18:28,Comment,5,Hi Bronuts what is the news about CSV file I was away
2023-10-26 02:07:53,Comment,1,Yes Bronut☺️
2023-10-26 02:05:44,Comment,2,I would be able to only complete that on weekends due to busy schedule
2023-10-26 02:02:47,Comment,2,Bronuts why is daily so dead I am not that active these days
2023-10-26 02:01:20,Comment,0,Good Morning Bronuts🍩
2023-10-25 13:30:37,Comment,2,Are we heading towards bull run or there will be more dips?
2023-10-25 12:46:13,Comment,1,Bronuts how many tasty donuts you guys are expecting for this round🍩
2023-10-25 12:45:21,Comment,1,Can't trust Sol again after last fall
2023-10-25 12:44:54,Comment,2,Yes but pump donuts🍩
2023-10-25 12:44:27,Comment,2,Good luck I don't know how much distributions will it take for me
2023-10-25 12:43:48,Comment,1,Quick profit probably
2023-10-25 12:43:32,Comment,1,No demand of donuts
2023-10-25 12:14:48,Comment,3,Bronuts if you can change one coin in top 10 what would it be?
2023-10-25 11:55:45,Comment,5,Good Morning bronuts I am back after a day missed you all yesterday how is everthing going?
2023-10-24 12:41:38,Comment,1,Bronuts make predictions for November
2023-10-23 14:13:54,Comment,5,Donuts will give us more profit or ETH?
2023-10-23 14:12:23,Comment,1,Gotta take all the profits I can in this bull run
2023-10-23 14:11:12,Comment,1,Buy the dip Bronuts
2023-10-23 14:10:50,Comment,2,Thanks for your hard work sir
2023-10-23 14:09:35,Comment,1,Donuts can easily dump due to small MC
2023-10-23 14:08:26,Comment,2,Selling early
2023-10-23 14:08:16,Comment,2,Slow and steady wins the race Bronut
2023-10-23 14:07:56,Comment,2,Donut
2023-10-23 12:28:38,Comment,1,"Bronuts it is first fiat mine day for many of us how are you holding?
I had a tasty chocolate donut🍩 to recover after exhausting work."
2023-10-23 03:24:05,Comment,0,Good Morning Bronuts how are you all doing market is looking good I wanted to check on you guys before going to Uni.
2023-10-22 20:45:16,Comment,2,Good Night Bronuts will see you all tomorrow one more day to tasty donuts![img](emote|t5_37jgj|32650)
2023-10-22 19:59:24,Comment,1,Around 3
2023-10-22 19:09:41,Comment,1,October has been really rollercoaster for us Bronuts
2023-10-22 18:50:59,Comment,3,I think the ratio in this round will be 1:3 so around 2.1k Donuts but I think the estimate is not right I will at least have 5k donuts
2023-10-22 18:40:43,Comment,2,I'm in the same boat I showed up when we were already at 75 but it is good to see so much activity🍩
2023-10-22 18:39:40,Comment,2,!mykarma
2023-10-22 18:34:32,Comment,1,Good luck hoping to see quality comments getting nominated by you
2023-10-22 18:33:53,Comment,2,Welcome to the Bronut Family![img](emote|t5_37jgj|32639)
2023-10-22 18:20:49,Comment,3,"How many donuts are you expecting this round Bronuts?

I'm aiming for 10k which is not easy due to my university and busy schedule"
2023-10-22 18:17:31,Comment,2,Just upvoted 82 now
2023-10-22 18:15:08,Comment,1,I'll officially consider you mad
2023-10-22 18:14:27,Comment,2,There is no way back now you'll fall in love with Donuts
2023-10-22 18:10:23,Comment,3,I was buy doing assignments and thinking of Donuts![img](emote|t5_37jgj|32638)
2023-10-22 17:50:47,Comment,2,Yes bronut
2023-10-22 17:50:34,Comment,3,Aminok said that they are gathering info
2023-10-22 17:45:37,Comment,3,If she is getting help from me like she does in every other tech related thing then 0% otherwise 100%
2023-10-22 17:45:02,Comment,3,People are gonna get crazy FOMOing
2023-10-22 17:19:13,Comment,4,Bronuts make crypto predictions for next year
2023-10-22 17:18:18,Comment,3,By playing that would be so fun
2023-10-22 17:17:28,Comment,2,Yes I would be first in line with all my Bronuts
2023-10-22 09:49:40,Comment,2,It is rumored that you last longer if you have ETH with you
2023-10-22 09:36:40,Comment,2,Not going to support shitty Reddit
2023-10-22 09:32:40,Comment,2,Yes and we Bronuts are here to help you![img](emote|t5_37jgj|32639)
2023-10-22 09:32:19,Comment,2,I think it would be win for us if we can replicate Gnosis chain tally using flairs
2023-10-22 09:29:19,Comment,1,I would love to see that
2023-10-22 09:25:32,Comment,6,"Some info for new Bronuts, Donuts![img](emote|t5_37jgj|32650) are distributed on Gnosis chain and if you want them displayed next to your name you have to transfer them to ETH main net."
2023-10-22 09:24:58,Comment,2,Bronut Donuts are distributed on Gnosis chain and if you want them displayed next to your name you have to transfer them to ETH main net.
2023-10-22 09:19:37,Comment,2,Say Donuts![img](emote|t5_37jgj|32638)
2023-10-22 09:19:23,Comment,2,Yes inject the sugar in my veins
2023-10-22 09:19:05,Comment,2,They are cooking I can smell them already
2023-10-22 09:16:05,Comment,2,First distribution is always the most exciting one
2023-10-22 09:11:41,Comment,2,Don't let me down
2023-10-22 09:11:13,Comment,2,CatGirl Token
2023-10-22 09:07:53,Comment,10,Good Morning Bronuts we are very close to snapshot how are you all feeling?
2023-10-21 19:49:18,Comment,2,"Good Night Bronuts today has been good for crypto one more day closer to bull run. I will see you all tomorrow take care till then.

**BAGMI!!!**![img](emote|t5_37jgj|32645)"
2023-10-21 19:39:27,Comment,2,Set higher targets Bronut
2023-10-21 19:35:23,Comment,1,I wish I could be more active here but I'm very busy this weekend
2023-10-21 19:34:54,Comment,1,Just how fast the night changes
2023-10-21 19:32:48,Comment,0,so you saying I can complete my fetish and get 100 ETH both at the same time seems to good to be true😂 /s
2023-10-21 19:26:21,Comment,1,Thanks for the alert bronut
2023-10-21 19:26:02,Comment,2,2-3
2023-10-21 18:58:32,Comment,1,Yes bronut
2023-10-21 18:43:49,Comment,1,Yes good for us
2023-10-21 18:39:20,Comment,2,Good Luck bronut first distribution is always the most exciting one
2023-10-21 18:38:18,Comment,-1,Bronuts this place is getting better day by day and for some reason I'm feeling proud like Donuts are my own child![img](emote|t5_37jgj|32650)
2023-10-21 18:37:02,Comment,1,Now you won't be able to live without Donuts![img](emote|t5_37jgj|32639)
2023-10-21 18:36:24,Comment,2,Yes we can but it will take time
2023-10-21 18:36:08,Comment,1,Good to see all of this handled in a good manner
2023-10-21 18:35:11,Comment,1,Things change so fast in crypto just look at Moons
2023-10-21 18:34:54,Comment,2,yes it is a slow process but beautiful when the market is always green
2023-10-21 18:34:21,Comment,2,Yes you have to transfer Donuts on ETH main net
2023-10-21 16:05:32,Comment,3,Market Cap of Donuts is only around $2 million
2023-10-21 16:04:29,Comment,1,Bronuts to the top💪
2023-10-21 16:03:52,Comment,1,Paying more attention to my studies😂
2023-10-21 16:03:33,Comment,1,We'll see more dips for sure
2023-10-21 15:37:42,Comment,6,I see a lot of new members in the sub which is good I hope this sub grows more
2023-10-21 12:19:53,Comment,2,yes greed gets the most of us
2023-10-21 11:30:12,Comment,4,Man he used to be so positive about donuts
2023-10-21 11:28:41,Comment,5,Which mod are we talking about and this should be addressed officialy
2023-10-21 11:25:41,Comment,5,I was away can someone summarize what happened was a mod involved in insider trading?
2023-10-21 11:07:36,Comment,5,Bronuts what is happening in crypto today? Anything interesting?
2023-10-21 05:42:56,Comment,1,Yes
2023-10-21 05:21:33,Comment,7,How many Donuts is your goal before bull run?
2023-10-21 05:20:25,Comment,2,Let real profits come first
2023-10-21 05:19:57,Comment,4,And most people used tk say they were in for the tech only
2023-10-21 05:19:19,Comment,1,100m MC will complete most of ours dream
2023-10-21 05:18:42,Comment,1,Donuts to the top
2023-10-21 05:18:29,Comment,2,Not yet
2023-10-21 05:17:53,Comment,1,Yes that is why it is the most innovative Crypto
2023-10-21 05:17:28,Comment,2,Yes anything below ATH of ETH is a good time
2023-10-21 05:16:49,Comment,1,Yes it is now part of my routine
2023-10-21 05:16:16,Comment,2,2025 we should see new ATH of ETH
2023-10-21 05:15:50,Comment,2,10k atleast
2023-10-21 05:15:08,Comment,2,When they will stop making money from it
2023-10-21 05:14:43,Comment,2,2025 is going to be amazing for crypto
2023-10-21 05:13:00,Comment,1,We're up to 25💪
2023-10-21 05:12:20,Comment,0,Welcome bronut
2023-10-21 05:10:51,Comment,2,I hope by the end of weekend Donuts hit 0.01$
2023-10-21 05:09:43,Comment,2,Yes it feels like we received our last distribution yesterday
2023-10-21 05:08:29,Comment,1,Yes buy it while its cheap
2023-10-21 05:07:23,Comment,1,What if I want the extra cream from Yennifer do I have to say it 5 times?
2023-10-21 05:06:37,Comment,1,4 days I can already smell tasty Donuts🍩
2023-10-21 05:05:56,Comment,2,Yes I have
2023-10-21 05:05:41,Comment,2,Good Morning bronut
2023-10-21 05:05:19,Comment,6,Good Morning Bronuts🍩 what are your plans for today?
2023-10-20 20:17:54,Comment,2,"Signing Off...Bronuts take care I couldn't engage much with you guys today due to work but hoping to see more of you tomorrow take care.

**BAGMI!!!**![img](emote|t5_37jgj|32641)"
2023-10-20 20:15:21,Comment,2,Thanks that is what Bronuts are for![img](emote|t5_37jgj|32639)
2023-10-20 20:10:45,Comment,2,Sure and thanks 0xAf924Ed9F131EFBFBCf5B68e1664daEB5d0ceC2f
2023-10-20 20:05:21,Comment,2,"Is there legit ETH faucet?

Edit: I want to claim MOOND airdrop but don't have enough gas fee"
2023-10-20 19:59:36,Comment,1,I agree with you I even made a post about bull runs in which I stated that bull run will not happen in 2024 imo
2023-10-20 19:48:53,Comment,1,Hoping for the best
2023-10-20 19:47:38,Comment,4,Market is looking better hope it goes only up from here
2023-10-20 19:46:57,Comment,2,This sub keeps me updated
2023-10-20 19:46:44,Comment,1,Eth holding strong
2023-10-20 19:46:32,Comment,1,Yes Bronuts love to help
2023-10-20 19:46:20,Comment,1,Yes definitely capable of listing and price we can do 10x easily
2023-10-20 19:45:47,Comment,2,Welcome to r/ethtrader Bronut hope you enjoy your time here
2023-10-20 19:45:22,Comment,1,Good Night Bronut have good sleep
2023-10-20 18:21:24,Comment,1,Thanks I missed you all a well
2023-10-20 18:21:01,Comment,1,Thanks
2023-10-20 17:36:58,Comment,1,Good Night have nice sleep
2023-10-20 17:32:27,Comment,3,BroNuts I am back from Uni today was a long day. Did I missed anything and most important how are you guys doing?
2023-10-20 02:04:48,Comment,2,Good Morning Bronuts I just woke and thaks for showing love on my post I posted before sleeping and woke up to you all liking my post it motivates me to post more😊
2023-10-19 19:30:31,Comment,2,Sleep well Bronut
2023-10-19 19:30:09,Comment,2,We love both ETH and Donuts
2023-10-19 19:29:45,Comment,0,Thanks Bronut😊
2023-10-19 19:29:23,Comment,0,🥰
2023-10-19 19:27:49,Comment,1,Yes this is just the start
2023-10-19 19:27:33,Comment,2,We are hitting 100 easily
2023-10-19 19:27:02,Comment,3,"Signing Off Bronuts take care today was fun chatting with you all see you guys tomorrow.
BAGMI🚀"
2023-10-19 19:07:49,Comment,1,Yes I hope all of our dreams come true
2023-10-19 19:06:05,Comment,1,Yes we are free to dream so why not
2023-10-19 18:59:34,Comment,1,I can believe the 1C one but listing one is too much to ask for
2023-10-19 18:54:01,Comment,1,Yes with seat belts fastened ![img](emote|t5_37jgj|32641)
2023-10-19 18:53:30,Comment,1,Glad you liked it
2023-10-19 18:53:13,Comment,1,We all live and learn
2023-10-19 18:52:16,Comment,2,Yes Bronut we are decentralized that is our strong point and when all will realize this we will pump hard
2023-10-19 18:51:03,Comment,1,Thanks for the support it motivates me to write more
2023-10-19 18:50:02,Comment,2,Appreciated bronut
2023-10-19 18:46:41,Comment,3,Bronuts to the top
2023-10-19 18:44:17,Comment,3,Thanks Bronut
2023-10-19 18:42:29,Comment,2,Thanks
2023-10-19 18:33:02,Comment,7,"BroNuts I just made a post about Bull runs [https://www.reddit.com/r/ethtrader/comments/17bq1gv/decoding\_bull\_runs\_a\_comparative\_analysis\_of\_top/](https://www.reddit.com/r/ethtrader/comments/17bq1gv/decoding_bull_runs_a_comparative_analysis_of_top/)

Kindly have a look and show support if you like it![img](emote|t5_37jgj|32639)"
2023-10-19 18:28:40,Comment,2,Yes Bronut
2023-10-19 18:27:30,Comment,1,It is very difficult due to price gap but anything can happen in crypto
2023-10-19 18:26:56,Comment,2,Yes next gen will wish they were this early
2023-10-19 18:26:31,Comment,1,We are recovering![img](emote|t5_37jgj|32645)
2023-10-19 18:26:18,Comment,5,It won't take long
2023-10-19 18:24:59,Comment,3,"The ‘Next Wave’ Is Coming—$15.6 Trillion Wall Street Flood That Will ‘Dwarf’ The Last Bitcoin, Ethereum, XRP Price Bull Run Revealed.

Forbes saying this what do you think Bronuts?"
2023-10-19 18:22:17,Comment,2,We all are one Bronut
2023-10-19 18:18:52,Comment,0,TBH no we need a lot of time and efforts to recover from this
2023-10-19 18:13:22,Comment,1,You'll thank yourself later
2023-10-19 18:12:49,Comment,1,"Wen listing? 

Continue Bronuts![img](emote|t5_37jgj|32650)"
2023-10-19 18:07:38,Comment,1,I'm glad it worked😊
2023-10-19 18:06:51,Comment,3,Take Care Bronut hoping to see more of you tomorrow
2023-10-19 18:00:29,Comment,1,Go back to main page and open daily post again it works for me everytime
2023-10-19 17:54:28,Comment,5,Yeah Bronuts I did the 69th upvote again
2023-10-19 13:07:28,Comment,3,Bronuts Reminder the advertising spot in the Daily Discussion's is free and it is only 1000 Donuts per day which is a steal so if you want to advertise something make use of it
2023-10-19 13:01:15,Comment,3,It will definitely be failure
2023-10-19 13:01:01,Comment,3,You too Bronut
2023-10-19 13:00:20,Comment,3,Yes there will be definitely some people who are yet not aware of this
2023-10-19 12:04:26,Comment,4,Bronuts I am back from uni and I have recovered from dengue as well how are things going hope you all are doing good😊
2023-10-19 03:21:03,Comment,2,That is the hopium we needed
2023-10-19 03:20:41,Comment,4,I think around 2-3
2023-10-19 03:20:19,Comment,3,Thanks🥰
2023-10-19 03:17:24,Comment,3,This is the last thing I want from new users bu don't worry I got you covered Bronut
2023-10-19 03:16:52,Comment,3,Yes it has increased all of our's trust in Donuts
2023-10-19 03:16:19,Comment,2,Good to see that
2023-10-19 03:14:03,Comment,2,"As of right now, No but if activity increases later in the day then yes"
2023-10-19 03:12:11,Comment,2,Yes all of them
2023-10-19 03:09:45,Comment,2,Happy Cake Day hope it brings good things for Donuts🍩
2023-10-19 03:09:13,Comment,2,Good Morning
2023-10-19 03:09:03,Comment,1,Yes I'm glad and thanks to the mods for this
2023-10-19 03:08:43,Comment,1,Yes sir🫡
2023-10-19 03:08:24,Comment,3,How do you like the activity so far any new plans for donuts in the future?
2023-10-19 03:07:52,Comment,3,That is the way Bronut😊
2023-10-19 03:07:28,Comment,1,I wish it breaks through around distribution
2023-10-19 03:07:05,Comment,2,Wen Listing?
2023-10-19 03:06:49,Comment,1,Not yet have you?
2023-10-19 03:06:31,Comment,3,That is the last thing I want to see in this sub
2023-10-19 03:05:57,Comment,5,Reminder!!! Don't forget to upvote daily.
2023-10-19 03:05:36,Comment,4,2h in to new daily and we already are close to 500 comments with this speed we can reach 6k comments today
2023-10-19 02:31:44,Comment,3,BroNuts Assemble💪 I need to see how many are you here today before going to Uni
2023-10-19 02:02:50,Comment,3,Donuts recovering so fast Bronuts who else is excited🤩
2023-10-18 22:38:04,Comment,3,Yes we spread positivity
2023-10-18 22:35:12,Comment,2,No worries Bronut we got you covered🍩
2023-10-18 22:32:51,Comment,2,Don't call yourselves Moon refugees you're Bronuts from now on💪
2023-10-18 22:20:39,Comment,2,Yes I really wanted my Virtual Pet Adoption idea to be implemented and it was supported by many but we lack people who can do it
2023-10-18 22:16:12,Comment,5,Guys we should work on new use cases of Donuts🍩 who agrees?
2023-10-18 21:50:15,Comment,5,Bronuts what do you think the ratio will be in this round?
2023-10-18 21:49:21,Comment,2,After a long while we finally moved from our fav 69 number
2023-10-18 21:48:43,Comment,1,Yes you should Donuts🍩 have a better future
2023-10-18 21:48:17,Comment,1,Good Night have a nice sleep
2023-10-18 21:47:48,Comment,2,Yes it will happen
2023-10-18 21:47:33,Comment,2,Cones
2023-10-18 20:47:16,Comment,2,We have to let this not happen and I 💯believe that mods will not let this happen
2023-10-18 20:44:04,Comment,5,I think Kraken is now going to take their time and it is understandable after what happened but we should do our best to support donuts🍩 so that we become so good that they can't resist to list us Bronuts
2023-10-18 20:36:46,Comment,2,I am seeing a lot of new faces today how do you find the community so far Bronuts?
2023-10-18 20:35:12,Comment,1,I did the 100th upvote Bronuts feels so good💪
2023-10-18 20:33:48,Comment,1,One left left Bronut
2023-10-18 20:33:28,Comment,1,Because we are decentralized
2023-10-18 20:33:01,Comment,2,I hope so because we don't like the negativity we only want to have some good time here
2023-10-18 20:32:20,Comment,2,Good to see high activity in the sub I hope it brings good things for us
2023-10-18 20:31:30,Comment,2,But it is very volatile sadly
2023-10-18 20:29:54,Comment,2,Donuts are the only thing that keeps me sane in all of this
2023-10-18 20:29:13,Comment,2,We are already at 100 mark lets go Bronut🍩
2023-10-18 20:28:50,Comment,3,Welecome to the Bronuts Club we are so glad to have you here I hope you enjoy your time here😊
2023-10-18 20:27:09,Comment,1,Yes HODL on Donuts and ETH
2023-10-18 20:26:26,Comment,1,Beonuts if you remember I used to say when will we hit 5k mark and today we crossed it with 5 hours left💪
2023-10-18 13:06:09,Comment,1,I hope we regain our price before next distribution
2023-10-18 12:37:08,Comment,4,"How many Bronuts we welcomed today?
This is one of the best sub you can find enjoy your time here guys🍩🚀"
2023-10-18 12:34:32,Comment,2,Prediction time BroNuts! When will we be seeing new ATh?
2023-10-18 11:49:04,Comment,1,So many people active but the daily is still at 50 Upvote Bronuts don't forget that!
2023-10-18 11:48:15,Comment,2,Thank you OP for the post and Donuts🍩 really showed why they are the best.
2023-10-18 11:46:48,Comment,1,What do you think the ratio will be this round Bronuts?
2023-10-18 11:45:55,Comment,2,My donut bag is as it was before the dump
2023-10-18 11:45:26,Comment,0,Donuts are our only hope🥺
2023-10-18 11:45:12,Comment,1,Please Donuts🍩 don't disappoint us
2023-10-18 11:44:49,Comment,1,Hi guys how is everyone doing I see Donuts are regaining its position that is very good😊
2023-10-18 03:32:50,Comment,3,I won't sell a single Donut this is our testing times Bronuts
2023-10-18 03:32:00,Comment,3,Yes happy but people are panic selling I hope we recover
2023-10-18 03:29:14,Comment,0,Guys we need time to recover from this but I think in the mean time we should give our all support to Donuts![img](emote|t5_37jgj|32650) by making more use cases so that we will survive and grow on ourselves. **BAGMI**![img](emote|t5_37jgj|32641)
2023-10-18 02:17:30,Comment,1,Crypto is very brutal who agrees? But we gotta not give up and have patience.
2023-10-17 21:38:14,Comment,4,Yes I remember most of you guys by name🤝
2023-10-17 21:36:17,Comment,4,Me too I don't want it to become r/cc because I could have earned way more there but still I prefered to remain quite active here because it is a very positive vibe here overall hope it stays like that
2023-10-17 21:33:20,Comment,6,Lets support Donuts together we can make it best just need everyone's support🍩
2023-10-17 21:23:41,Comment,-1,"New members of the community some info for you guys we are called Bronuts and one of our fav word is BAGMI(Bronuts Are Gonna Make It).
One more thing we only have upvote button Bronuts don't see downvote🍩"
2023-10-17 21:14:30,Comment,2,Where is my math guy u/boiboi3434 at we are gonna break 5k mark right
2023-10-17 19:40:59,Comment,1,I hope Donuts regain their potential because they are decentralized and this is our strong point BroNuts
2023-10-17 19:30:12,Comment,1,BroNuts Crypto can really be brutal but I would say to please protect our beloved Donuts as these are decentralized so we don't have to worry
2023-10-17 19:25:38,Comment,2,Man now we will be hitting 10k comments daily
2023-10-17 19:14:41,Comment,3,This was my first month of RCPs and this happened man I bought all RCPs of worth aroud 450$ which is around 20$ right now
2023-10-17 17:07:35,Comment,2,Sorry to disturb you but first I need to swap Moons to ETH on Arbitrum Nova right? I'm trying to do that using sushiswap but I am getting only $24 of ETH on $38 of Moons is there any better way
2023-10-17 16:53:52,Comment,1,Thanks I know how to swap to ETH on nova but can you help with the bridging part
2023-10-17 16:37:51,Comment,5,BroNuts I'm thinking of selling some Moons to buy yummy Donuts what is the easiest way to do it?
2023-10-17 06:46:50,Comment,2,We will be reaching 6.9k soon
2023-10-17 06:46:23,Comment,1,Don't worry BroNuts got you covered🍩
2023-10-17 06:45:58,Comment,2,It was pumping before that right?
2023-10-17 06:45:13,Comment,2,How to know who is downvoting and toxic?
2023-10-17 06:44:43,Comment,2,How short are we talking?
2023-10-17 06:44:25,Comment,1,Yes but everytime there is dip we see less activity
