Date,Activity Type,Upvotes,Content
2023-10-17 06:43:55,Comment,2,For last round or overall?
2023-10-17 06:43:06,Comment,3,When is Donut going back to $0.02
2023-10-17 06:42:42,Comment,1,We all will be here no matter what💪
2023-10-17 04:14:13,Comment,2,Yes now it is better
2023-10-17 04:08:04,Comment,2,The emoji made it more like a Donut serial killer ngl
2023-10-17 03:57:12,Comment,2,8 days to the next snapshot I can already smell tasty Donuts![img](emote|t5_37jgj|32650)
2023-10-17 03:56:16,Comment,3,Make a website where you can buy land with Donuts
2023-10-17 03:55:39,Comment,2,Nah sound is slow lets talk about speed of light
2023-10-17 03:54:34,Comment,1,Yes inject it in my veins
2023-10-17 03:50:22,Comment,3,Today the activity is quite high for the start bronuts
2023-10-17 03:48:49,Comment,3,Let's make a Donut town together where we have house for every Bronut
2023-10-17 03:47:33,Comment,4,That is amazing 4k is the new normal keep it up Bronuts![img](emote|t5_37jgj|32639)
2023-10-17 03:46:17,Comment,2,Yes a listing will set us up
2023-10-17 03:31:57,Comment,3,Always ready
2023-10-17 03:29:01,Comment,3,Donuts giving us discount in these inflation times is the best thing to happen
2023-10-17 03:17:16,Comment,2,Guys what were the number of comments yesterday I fell asleep
2023-10-17 02:36:59,Comment,2,Haha it has been good for us ngl
2023-10-17 02:36:44,Comment,1,They playing with my heart harder than my crush
2023-10-17 02:36:15,Comment,2,Keep it pumping
2023-10-17 02:35:56,Comment,1,I am short of just 1000000000 of Donuts![img](emote|t5_37jgj|32650)
2023-10-17 02:35:25,Comment,2,That sounds good Bronut
2023-10-17 02:34:34,Comment,3,Yes Bronut![img](emote|t5_37jgj|32639)
2023-10-17 02:32:40,Comment,6,Guys what is the best way to convert Moons to Donuts considering my Moons are in the vault
2023-10-17 02:30:38,Comment,3,Depends on how much ETH I'm holding and on the dip
2023-10-17 02:30:15,Comment,3,Everyone is going to get jealous of us Bronut
2023-10-17 02:29:55,Comment,4,First thing which I'm early on and thanks it is Donuts![img](emote|t5_37jgj|32650)
2023-10-17 02:29:27,Comment,5,Can't wait for that day
2023-10-17 02:29:10,Comment,3,Yes we can easily do 20-30x
2023-10-17 02:28:40,Comment,5,Good Morning Bronuts today I'm feeling a lot better than before and the market is also holding good I feel today is going to be great![img](emote|t5_37jgj|32645)
2023-10-16 15:16:50,Comment,2,Signing off Bronuts Dengue really got me I'm not feeling that good so I'll see you guys late make sure to earn good karma in real life as well😊
2023-10-16 14:27:27,Comment,2,Let me fill my bags
2023-10-16 14:18:36,Comment,1,I think they are doing it so you receive more donuts you should be happy they are supporting or send them to my post
2023-10-16 13:55:58,Comment,1,Yes we have long way to go
2023-10-16 13:55:39,Comment,2,Yes if it was not fake news then we would have reached 5k today
2023-10-16 13:53:03,Comment,1,So it was fake news after all
2023-10-16 13:41:22,Comment,1,Let the doubters regret
2023-10-16 13:40:21,Comment,0,I hope it brings good things for us
2023-10-16 13:39:37,Comment,1,Pump is coming
2023-10-16 13:39:24,Comment,3,It is always discount for those who know the real potential
2023-10-16 13:38:49,Comment,0,Bronuts we should have Donut week who agrees?
2023-10-16 13:37:19,Comment,2,BTC going nuts!!!
2023-10-16 13:36:54,Comment,1,Pumptober finally arrived
2023-10-16 13:36:36,Comment,2,Yes Pumptober is going to pump harder
2023-10-16 13:31:54,Comment,1,Yes and you're on time Bronut
2023-10-16 13:28:35,Comment,2,Yes we just got our last distribution and snapshot is already around the corner
2023-10-16 13:26:58,Comment,2,9 days away
2023-10-16 13:25:24,Comment,2,BAGMI![img](emote|t5_37jgj|32641)
2023-10-16 13:23:09,Comment,2,Haha because that will make them multiple earnings
2023-10-16 13:20:14,Comment,2,I hope it stays Pumptober
2023-10-16 13:16:14,Comment,1,Thankd Bronut😊
2023-10-16 13:14:41,Comment,4,Bronuts are really good at multi-tasking
2023-10-16 13:14:19,Comment,4,Really missed your calculations Bronut
2023-10-16 13:13:44,Comment,1,Pakistan and I was amazed to see that it made into top 10 list of most crypto holders by country.
2023-10-16 13:08:12,Comment,2,When you put it this way I agree
2023-10-16 13:03:30,Comment,2,I would love to buy a house and pay my student debt
2023-10-16 13:02:16,Comment,5,BroNuts where are you guys at activity has suddenly dropped
2023-10-16 13:00:05,Comment,1,Thanks
2023-10-16 12:50:45,Comment,1,I can qualify how much Donuts are you willing to pay?
2023-10-16 12:49:51,Comment,1,And not a single article on crypto in my country even during last bull run
2023-10-16 12:47:42,Comment,1,Iran has legal organ market tell your friend to check it
2023-10-16 12:46:10,Comment,2,Yes you are right but here in my country many people can't even use the bank applications
2023-10-16 12:42:28,Comment,2,"Bronuts one has to be educated to use crypto right?

Then how will we see mass adoption as many people are not literate."
2023-10-16 12:40:34,Comment,1,We are always near to 5k but never make it so close but yet so far
2023-10-16 12:40:05,Comment,2,We have good vibes 24/7 so hop on
2023-10-16 12:38:30,Comment,2,You are right technically we are not earning for free because we all are investing our times here but this is the best way one can earn I enjoy a lot engaging with fellow Bronuts
2023-10-16 12:36:39,Comment,1,Yes a lot actually but at least one should put effort to earn
2023-10-16 12:12:10,Comment,2,Yes my post was having quite a good start but it went down from there
2023-10-16 12:11:29,Comment,2,Gotta summon the ultimate Bronut u/kirtash93 to guide us all
2023-10-16 11:59:42,Comment,1,"Haha and ""Do"" in my language means two so sometimes it is very funny to see that"
2023-10-16 11:50:43,Comment,1,"Do you guys prefer ""BroNut"" or ""Bronut"" ?"
2023-10-16 11:50:03,Comment,1,Yes but we have the power to tip good content and upvote
2023-10-16 11:46:59,Comment,2,I wish everyone was like you but greed gets many of us
2023-10-16 11:39:11,Comment,2,I face more problems on app so if you have access to desktop it is better
2023-10-16 11:37:36,Comment,1,Donuts and Moons for max profit
2023-10-16 11:36:58,Comment,1,We are happy as long as it is pumping
2023-10-16 11:33:42,Comment,1,Yes not a lot but I have which I'm holding for quite a long time
2023-10-16 11:32:43,Comment,1,Thanks BroNut
2023-10-16 11:32:33,Comment,1,I think 3
2023-10-16 11:31:53,Comment,2,Reddit is in the way of my beloved Donut farming
2023-10-16 11:30:14,Comment,1,Lets go![img](emote|t5_37jgj|32641)
2023-10-16 11:30:04,Comment,1,Welcome back I wish I could workout but feeling low due to sickness
2023-10-16 11:29:39,Comment,1,I would say ETH
2023-10-16 11:29:01,Comment,1,Donut will look good with it
2023-10-16 11:28:29,Comment,1,It will at least reach ATH in next bull run
2023-10-16 11:28:06,Comment,0,I hope this pump is here to stay
2023-10-16 11:27:50,Comment,2,It has been acting weird lately
2023-10-16 11:27:34,Comment,1,We'll start teaching then
2023-10-16 11:27:15,Comment,2,I think we will reach $0.5 by combo of both listing + bull run
2023-10-16 11:26:19,Comment,1,Yes sometimes you wish that bull market starts from tomorrow but we have to wait
2023-10-16 11:15:30,Comment,1,We still have 9 days so you can catch up
2023-10-16 10:48:14,Comment,1,You can do it BroNut
2023-10-16 10:47:44,Comment,1,Haha you can say I really enjoyed my time here but it was mostly because I was free and now I have Uni so can't be that active
2023-10-16 10:44:13,Comment,2,"As we are reaching towards the last week before the snapshot how much karma you have earned so far BroNuts?

I earned around 1.5k karma and made 5 posts"
2023-10-16 10:42:39,Comment,3,We all does who were there in the bull market
2023-10-16 10:37:24,Comment,1,Try your luck farming Bricks but you won't have any fun
2023-10-16 09:37:26,Comment,2,Wow Bronut you missed a lot I hope next bull run you take profits because greed always gets the most of us
2023-10-16 08:55:42,Comment,1,Glad you liked it BroNut
2023-10-16 08:50:14,Comment,1,Thanks BroNut![img](emote|t5_37jgj|32645)
2023-10-16 08:48:56,Comment,2,Done now you'll feel sugar rush in your veins![img](emote|t5_37jgj|32650)
2023-10-16 08:47:53,Comment,0,I love you guys![img](emote|t5_37jgj|32639)
2023-10-16 08:46:55,Comment,2,Yes and you already are a big fat whale in my books I would be happy to have 50k before bull run
2023-10-16 08:44:04,Comment,6,"Looks like downvote gang is here need your help BroNuts my post had 10 upvotes now it is down to 6 only in 20 mins

https://www.reddit.com/r/ethtrader/comments/178ysz4/your\_most\_memorable\_crypto\_stories/"
2023-10-16 08:42:53,Comment,2,I hope so
2023-10-16 08:41:47,Comment,2,Is it too much to ask for if I want Donuts to be $0.2 and ETH at $2.5k by the end of this year
2023-10-16 08:40:24,Comment,3,We need this sort of hopium dose keep it coming
2023-10-16 08:39:48,Comment,2,We will finally be OGs then and be so proud
2023-10-16 08:37:17,Comment,3,Ironically my post has 69% upvote rate BroNuts really love this number
2023-10-16 08:20:11,Comment,2,Thanks BroNut
2023-10-16 08:14:26,Comment,1,Just the thought of Donuts make me happy![img](emote|t5_37jgj|32650)![img](emote|t5_37jgj|32651)![img](emote|t5_37jgj|32638)
2023-10-16 08:13:56,Comment,2,Market is green BTC is performing quite good hope our ETH follows the trend
2023-10-16 08:13:21,Comment,2,I'm very excited for this round I hope I receive good amount of donuts![img](emote|t5_37jgj|32650)
2023-10-16 08:12:47,Comment,2,Here is some hopium from my side you earn at least 4-5 Donuts![img](emote|t5_37jgj|32651) from a single comment
2023-10-16 08:05:33,Comment,2,We all live and learn
2023-10-16 07:50:38,Comment,3,BroNuts are your crypto decisions logical or sentimental?
2023-10-16 07:47:35,Comment,3,Yes sir that is the first thing we Bronuts do btw cool avatar
2023-10-16 07:41:06,Comment,2,Yes the Bronuts are resting after the party
2023-10-16 07:39:26,Comment,2,If you are a Bronut then you can't see it
2023-10-16 07:35:35,Comment,1,Good Morning we got nothing better to do
2023-10-16 07:17:23,Comment,2,Yes it would be nice to talk about how shit posting got us all here😂
2023-10-16 07:16:25,Comment,2,GM yes it feels nice to look at charts
2023-10-16 07:16:07,Comment,1,Good Morning BroNut and complain more we might see a trend
2023-10-16 07:13:28,Comment,1,Yes it is very slow today
2023-10-16 07:05:50,Comment,3,Why is the activity so slow BroNuts Assemble![img](emote|t5_37jgj|32645)
2023-10-16 07:05:03,Comment,1,I think in late 2024 or early 2025 we have to be patient BroNut
2023-10-16 06:41:29,Comment,2,And a Donut listing will be cherry on the top![img](emote|t5_37jgj|32639)
2023-10-16 06:41:03,Comment,2,BroNuts don't even know that downvote button exists
2023-10-16 06:40:26,Comment,1,Good Morning BroNut hope you are doing good
2023-10-16 06:40:00,Comment,3,"What is most important in crypto according to you?  
  
1) More investment  
  
2) Spending more time researching  
  
I would say 2nd option because I have seen many people taking advantage of more knowledge."
2023-10-16 06:37:39,Comment,2,Nice start of week hope it goes up from here only
2023-10-16 06:34:56,Comment,2,I just asked my Donuts![img](emote|t5_37jgj|32638) and they reported that not yet because they want more of their fellows to join them for the bull run
2023-10-16 06:29:19,Comment,3,Good to see a lil market pump making everyone happy![img](emote|t5_37jgj|32645)
2023-10-16 06:19:40,Comment,4,Yes I remember this about SQUID but I came to know about it after the dump
2023-10-16 06:18:25,Comment,2,"We only predict Donuts here /s

On serious note maybe somewhere around ATH because still many people are holding it and it is the most famous memecoin"
2023-10-16 06:17:27,Comment,2,Good Morning good start for crypto but not a good start of week for me but I'm happy seeing the charts going green
2023-10-16 05:58:24,Comment,3,My bad yes $1 Million have they retired yet? Because I would not have to do anything ever with this insane amount
2023-10-16 05:54:41,Comment,3,Wow so they made $100k that is insane amount of profit you can almost retire with this amount here.
2023-10-16 05:51:32,Comment,3,Definitely one of the best decision of our lives.
2023-10-16 05:50:26,Comment,3,Wow how much was their investment?
2023-10-16 05:42:59,Comment,2,Thanks BroNut
2023-10-16 05:37:24,Comment,1,"BroNuts as I have caught Dengue so I was getting bored so I was just remembering my times in crypto and made a post about it.

[https://www.reddit.com/r/ethtrader/comments/178ysz4/your\_most\_memorable\_crypto\_stories/](https://www.reddit.com/r/ethtrader/comments/178ysz4/your_most_memorable_crypto_stories/)

Show some love BroNuts![img](emote|t5_37jgj|32639)"
2023-10-16 05:16:19,Comment,4,What else is your hobby beside crypto?
2023-10-16 05:14:59,Comment,3,That means good ratio![img](emote|t5_37jgj|32644)
2023-10-16 04:48:34,Comment,2,It is not just you this happens to all of us but BroNuts are here for the rescue![img](emote|t5_37jgj|32639)
2023-10-16 04:47:56,Comment,2,Yes we just need a listing to sky rocket![img](emote|t5_37jgj|32641)
2023-10-16 04:46:33,Comment,3,Not yet give me 2-3 month then I'll be ready
2023-10-16 04:46:13,Comment,2,Good Morning I hope we see Pumptober for the rest of the month
2023-10-16 04:45:48,Comment,3,Good Night have a nice sleep BroNut
2023-10-16 04:32:58,Comment,2,Not in hospital they said I will be admitted if it gets severe so I'm resting right now and feeling a little better than before
2023-10-16 04:32:03,Comment,1,Couldn't sleep last night and have runny nose I'm taking rest and medication.
2023-10-16 04:31:14,Comment,1,Thanks BroNut
2023-10-16 04:30:23,Comment,1,Pakistan
2023-10-16 03:13:44,Comment,3,Good Morning BroNuts hope you all are doing good I couldn't go to University today because I caught Dengue and I'm not feeling good and time is moving slow for some reason I'm getting bored so I thought what is better than chatting with fellow BroNuts😊
2023-10-16 02:48:51,Comment,1,Same I can feel you
2023-10-15 20:43:21,Comment,1,Yes but I did the 69th one so I'm happy and it is a fun game we BroNuts like to play😊
2023-10-15 20:42:38,Comment,2,Signing off🍩... BroNuts it was so good to chat with you all today will see more of you guys tomorrow take care till then BAGMI🚀
2023-10-15 20:34:57,Comment,1,Good Night see you tomorrow😊
2023-10-15 20:34:24,Comment,1,Good Night and thanks for the 68th one I just made it 69th sleep tight fellow BroNut🌌
2023-10-15 20:33:22,Comment,5,Finally did the 69th upvote BroNuts now I feel good🍩🍩🍩
2023-10-15 20:32:25,Comment,1,So much has happened and we are still here💪
2023-10-15 20:31:06,Comment,1,Why not have both
2023-10-15 20:28:43,Comment,1,BroNuts what would you prefer Kraken Listing or ETH at $2000?
2023-10-15 20:27:31,Comment,1,Still 66 for me
2023-10-15 20:26:34,Comment,1,2 remaining I'm saving mine for 69th
2023-10-15 20:25:42,Comment,1,Yes sir that is why we are accumulating as muvh as we can🤝
2023-10-15 20:25:08,Comment,1,That is why it is roller coaster ride
2023-10-15 20:24:35,Comment,2,I don't think because the price gap is very huge
2023-10-15 20:24:05,Comment,1,Take Care we will see you tomorrow BroNut😊
2023-10-15 20:23:14,Comment,2,"30% BTC
30% ETH
20% DONUTs
10% MOONs
10% Alts"
2023-10-15 20:21:50,Comment,1,Don't worry we got you covered💪
2023-10-15 20:21:01,Comment,2,You'll thank yourself in future
2023-10-15 20:20:14,Comment,2,Good Night have a nice sleep will see you tomorrow
2023-10-15 13:51:50,Comment,3,Yes 4k is confirmed
2023-10-15 13:51:20,Comment,3,Yes and it has been 13 hours so we can do it
2023-10-15 13:47:15,Comment,6,With this pace we can reach 5k comments keep it coming BroNuts💪
2023-10-15 13:03:00,Comment,1,I just checked my screen time on Reddit is around 4 hours on average daily what about you guys?
2023-10-15 12:54:22,Comment,1,Yes we are lucky to be this early
2023-10-15 12:47:45,Comment,1,Yes sir Donuts are very tempting🍩
2023-10-15 12:43:45,Comment,1,Yes that is the first rule of every BroNut🫡
2023-10-15 12:42:24,Comment,2,I use Brave browser
2023-10-15 12:39:56,Comment,1,Trying to fill as much as I can
2023-10-15 12:39:35,Comment,3,Sometimes I feel so good that making a single comment will atleast earn me 3-4 Donuts🍩
2023-10-15 12:38:40,Comment,2,Yes it is quite active today
2023-10-15 12:37:51,Comment,1,That sounds fun BroNut😊
2023-10-15 12:37:29,Comment,1,Lets make small targets first 10 million then 100 million
2023-10-15 12:08:25,Comment,2,"What keeps you positive in depressing market time?

For me this sub is enough to keep me motivated and positive![img](emote|t5_37jgj|32639)"
2023-10-15 12:07:32,Comment,2,BroNuts don't judge anyone and if you are doing something wrong they'll guide you instead of bashing you
2023-10-15 12:05:24,Comment,1,I don't think so because the price gap is very huge
2023-10-15 11:13:14,Comment,1,Yes but I think we need more use cases to attract exchanges and masses.
2023-10-15 11:10:47,Comment,1,Yes but I have around 1.5k karma this round I think
2023-10-15 11:06:11,Comment,2,I made 4-5 posts as well
2023-10-15 11:04:28,Comment,5,When do you think we will see new use cases of Donuts?
2023-10-15 11:02:35,Comment,2,I want 10k DONUTs at least from this distribution it is not going to be easy but I can try my best
2023-10-15 10:56:05,Comment,1,SOL
2023-10-15 10:29:23,Comment,3,What is the secret recipe to success in Crypto?
2023-10-15 10:24:58,Comment,2,"""Hope is the thing with feathers that perches in the soul and sings the tune without the words and never stops at all"" -Emily Dickinson"
2023-10-15 10:22:31,Comment,3,Who else is addicted to crypto just like me and check charts after a little while
2023-10-15 09:57:49,Comment,2,Don't kill our hopium
2023-10-15 09:53:05,Comment,2,Donuts are not controlled by Reddit
2023-10-15 09:52:14,Comment,4,What is the best combo to have with Donuts![img](emote|t5_37jgj|32650) other than Coffee
2023-10-15 09:43:37,Comment,1,For half a million you can buy one of the best house of the town here
2023-10-15 09:35:52,Comment,2,Here in Pakistan you can buy normal house for $40k
2023-10-15 09:21:09,Comment,1,Yes I love spending my weekend here with BroNuts
2023-10-15 09:19:51,Comment,3,BroNuts do you sell one RCP to buy another?
2023-10-15 09:19:29,Comment,2,BroNuts do you sell one RCP to buy another?
2023-10-15 09:19:15,Comment,1,BroNuts do you sell one RCP to buy another?
2023-10-15 09:14:34,Comment,2,Good Morning BroNut🍩
2023-10-15 09:13:39,Comment,2,"Thanks and yes it makes me happy as well seeing people having their dreams come true
BAGMI🚀"
2023-10-15 09:12:49,Comment,2,I need around 3m to buy a house but this is still unachieveable for me
2023-10-15 09:11:39,Comment,2,4k into Donuts because they can easily 10x and 1k on Moons
2023-10-15 09:10:54,Comment,1,Yes but we don't have to hurry lets make it best so by the time it gets listed we have secure future rather than a short time pump due to hype
2023-10-15 06:55:46,Comment,1,RCPs
2023-10-15 06:49:03,Comment,2,One of the best investment you can make
2023-10-15 06:41:29,Comment,1,Good BroNut
2023-10-15 06:36:22,Comment,6,"**REMINDER!!!** 

Upvote the daily BroNut we are at 30"
2023-10-15 06:33:56,Comment,3,Who is going to name their kids after Crypto that will give you financial freedom?
2023-10-15 06:32:19,Comment,2,Good Morning the weather here is very nice today but I still love Bronutting with BroNuts here
2023-10-15 06:31:33,Comment,2,10x is going to make us all rich
2023-10-15 06:10:38,Comment,2,Yes but many used to say that in last bull run
2023-10-15 06:10:16,Comment,2,Yes sir![img](emote|t5_37jgj|32641)
2023-10-15 06:07:24,Comment,2,Donuts![img](emote|t5_37jgj|32650)
2023-10-15 06:01:49,Comment,1,"BTC, ETH and SOL because if they all reach ATH again I'll make a lot of profits"
2023-10-15 06:00:27,Comment,1,Yes
2023-10-15 05:59:38,Comment,3,Mine was believing SOL to be ETH killer
2023-10-15 05:44:30,Comment,3,Invested in a scam project called NEST Arcade
2023-10-15 05:35:37,Comment,2,"Good Night BroNut have a nice sleep.

This sub has really made us all one all around the world it is morning for me"
2023-10-15 05:23:01,Comment,2,That is some dedication
2023-10-15 05:22:47,Comment,1,Yes many BroNuts were not active yesterday including me
2023-10-15 05:19:24,Comment,2,That's what BroNuts love to do
2023-10-15 05:19:04,Comment,1,I think it is not a single person but a group
2023-10-15 04:57:17,Comment,1,Mention not BroNut![img](emote|t5_37jgj|32645)
2023-10-15 04:54:02,Comment,1,50 comments a day will easily make you 5k donuts
2023-10-15 04:49:52,Comment,1,Thanks![img](emote|t5_37jgj|32639)
2023-10-15 04:49:36,Comment,2,Why do you think Satoshi Nakamoto has not revealed himself? He can gain a lot of popularity and what do you think would be the impact on crypto market if he does that? I think it is good  that he has not revealed himself because his single statement will move the market upside down
2023-10-15 04:48:47,Comment,2,Yes but only top earners are making that amount 5k is more reasonable for people who are active
2023-10-15 04:44:54,Comment,2,1290 hoping for 10k after this distribution
2023-10-15 04:42:43,Comment,1,Yes lately I am spending a lot of time on crypto
2023-10-15 04:37:33,Comment,3,Giving competition to u/aminok he is coming for you
2023-10-15 04:28:53,Comment,2,Welcome BroNut
2023-10-15 04:28:16,Comment,1,We just received last round Donuts and the next distro is around the corner
2023-10-15 04:27:49,Comment,2,Yes in the next bull run + exchange listing can make it happen
2023-10-15 04:27:13,Comment,2,This is first time I'm hearing about this coin
2023-10-15 04:24:50,Comment,2,Are you serious or joking because if you guys can recognize me by my name then I am proud that I have played my part
2023-10-15 04:23:52,Comment,1,Good bot now I am a poet
2023-10-15 04:22:40,Comment,1,Yes 10k+ Donuts will make you a lot of profit
2023-10-15 04:21:46,Comment,4,If all of your coins reach ATH again which will make you the most profit?
2023-10-15 04:20:58,Comment,2,Not right now
2023-10-15 04:20:43,Comment,2,Everyday is a new start for crypto
2023-10-15 04:20:15,Comment,2,I just made 2 or 3 comments yesterday that is why /s
2023-10-15 04:19:29,Comment,1,Man they all are trying to help you consider yourself lucky /s
2023-10-15 04:18:55,Comment,3,Yes I sometimes wake up in night and quickly look at charts
2023-10-15 04:18:32,Comment,2,I want this sub to explode in the bull run![img](emote|t5_37jgj|32641)
2023-10-15 04:16:40,Comment,3,Yes you can't go wrong with Donuts
2023-10-15 04:14:14,Comment,3,Yes I will be and if I'm active till then I will be respected by everyone and it would be so fun to tell everyone how chill this sub used to be and people will go crazy on the ratio.
2023-10-15 04:12:48,Comment,3,Good Morning BroNuts how is everyone doing I just woke up and guess what I had Donut with Coffee after a long time for breakfast.
2023-10-15 03:02:49,Comment,1,Why not do for this round I was not active in last round
2023-10-14 12:36:42,Comment,-1,I was away so couldn't see the sub how is everyone doing anything interesting that I missed?
2023-10-14 04:33:12,Comment,3,Sad to hear about fires and floods hope it gets better mate.
2023-10-14 04:21:30,Comment,3,Good Morning BroNuts hope you all are doing great and what are your plans for weekend? I am going to watch CWC match.
2023-10-13 19:54:54,Comment,4,"Replace one line of quote from movie with the word ""crypto"".

I'll start ""May the crypto be with you"" (Star Wars)"
2023-10-13 19:47:59,Comment,6,I am feeling good days are starting for Donuts![img](emote|t5_37jgj|32639)
2023-10-13 19:42:48,Comment,1,Not investing in BTC when I first found it back in 2014
2023-10-13 19:35:32,Comment,3,"I keep myself busy with things I love to do like gym, music, video games and jogging."
2023-10-13 14:54:07,Comment,1,Yes I will do from now on
2023-10-13 14:53:53,Comment,1,Thanks![img](emote|t5_37jgj|32639)
2023-10-13 14:46:32,Comment,2,Guys where can I see my CONTRIB amount?
2023-10-13 14:45:55,Comment,1,Yes we BroNuts are checking charts every 15 mins
2023-10-13 14:43:06,Comment,3,Thanks for sharing I'm very excited because this was my first distribution.
2023-10-13 14:42:18,Comment,1,Is it just me or does MM not load for you guys on Gnosis chain? So I switch to ETH main net for logging in and then switch back to Gnosis chain
2023-10-13 14:40:36,Comment,1,Yes nice way to filter them
2023-10-13 14:39:45,Comment,1,Bullish![img](emote|t5_37jgj|32641)
2023-10-13 14:39:11,Comment,1,If she is really hot she can have my Do-Nuts (Do in my local language means Two)
2023-10-13 14:37:42,Comment,1,SocialFi is gonna boom in next bull run with RCPs leading it
2023-10-13 14:37:20,Comment,2,I still need time to accumulate 50k donuts then I'm ready for bull run
2023-10-13 14:36:46,Comment,2,Sometimes I feel proud of being a BroNut
2023-10-13 14:36:18,Comment,2,Only for a moment then back again to low 60s
2023-10-13 14:35:36,Comment,1,Good Luck bro
2023-10-13 14:35:24,Comment,2,Bear market shows who is here for quick bucks and who is really interested and want the profit as well
2023-10-13 14:34:40,Comment,1,Nice way to phrase it thanks for injecting hopium in my veins
2023-10-13 14:33:54,Comment,1,Make sure to buy my course to get instant results so I can cover my loss
2023-10-13 14:32:58,Comment,2,When will they bring a fun crypto game
2023-10-13 14:32:37,Comment,3,HODL on donuts
2023-10-13 14:32:22,Comment,2,Thanks for sharing didn't knew that
2023-10-13 13:56:12,Comment,1,The hate is not directed towards bricks but on the mods because they only see their benefit
2023-10-13 13:55:24,Comment,1,Donuts are gonna show everyone in the next bull run
2023-10-13 13:55:05,Comment,1,You really are the Maths guy
